Class,Text
-1,"@SemihaEkinci58 @TBMMGenelKurulu biden açıklamasına destek veren hdp ye ses çıkarmayan chp ve iyi parti, 10 bin km ötedeki abd ye kükreriz diyor,ittifak bozulur diye ses çıkarmayanlar,Biden kınama lari da göstermelik olduğu aleni sırıtıyor. Ülkemde bir tane ermeni toplu mezarı gören varmı, HAYIR"
1,Tebrikler #trabzonspor helal olsun size çocuklar. Bizim çocuklar işte bunlar.  https://t.co/oKrYZPXiJs
-1,Bu twetter harika birşey burdan bişey yazıyorsun tüm cinconlar çıldırıyor ![😄](https://abs-0.twimg.com/emoji/v2/svg/1f604.svg) ![😄](https://abs-0.twimg.com/emoji/v2/svg/1f604.svg) öldürmeyen acı güldürüyor sanırım ![😄](https://abs-0.twimg.com/emoji/v2/svg/1f604.svg) ![😅](https://abs-0.twimg.com/emoji/v2/svg/1f605.svg)
-1,Yemeksepeti ve Trendyol Türkiye sınırları içinde oluşturduğu kullanıcı deneyimi ve verisiyle beraber yurtdışına satılmış dolayısıyla sizi satmış şirketlerdir. Bizi satmayan Getir ve Hepsiburada'ya sempati besleyebiliriz. Ufak bilgidir. Exit Yapmayınızdır. İhracat yapınızdır.
-1,Çok şükür kötü günler geçti gitti geride kaldı şimdi sıra daha da kötü günleri yaşamaya 🤨 @Fenerbahce 👏 👎👎👎👎👎👎👎👎👎👎
-1,@KartalicElifCNR Bir Galatasaray li olarak şikeci bir takımın bize başarı dilememsi kadar gurur verici birşey yok🤣🤣🤣🤣TFF ye götürdüğünüz kupa tekrar muzenize koydular haberin olsun jimlastik kulübü
-1,Zaten dursun özBEK o oynar sag bekte.. #yönetim #istifa @GalatasaraySK
1,"Elleri  küçük, ama şerefi ve karakteri tüm kuşlardan büyük olan adamdır Fernando Muslera. Değil 1, isterse bir sezon böyle kötü oynasın, yine de ondan razıyız, hakkımız sonuna kadar helal olsun! 💛❤️   @1_Muslera_25  https://t.co/I34wCtysyb"
1,Türk doktordan uluslararası başarı
-1,@1fatmasen Ne arabası aq aşağı yollayıp ağzıma sıçıcak yine DOKTORA GİTTİM FİZİK TEDAVİ DEDİ ANNEM DE FİZİK TEDAVİ İSTEMEDİ NEDEN BİLMİYORUM ŞİMDİ DE FİZİK TEDAVİYE GİDELİM CEMRE DİYO AMA KAPANMA GELDİ ANNE ŞAKA MISIN AQ GEBERİYORUM BURADA
1,12 taksit mobilyacıların yüzünü güldürdü
1,"🕛 Paranın olmadığı bir sistem, yüreğinde hak ve adalet kavramlarını barındıran herkesin hayalidir. Değişim değerinin temeli korundukça para üzerine yürütülen tezler farazidir. Endüstriyel ekonomi ürünleri, ürünlerin mübadelesi değişim değerini, değişim değeri ise parayı üretir."
-1,"otobüsümüz kurşunladı, dalga geçip seni sevmeyen ölsün dediler.  şike kumpası kuruldu, tescilli şikeci dediler.  her sezon başı tff fenerbahçe'yi şampiyon yapacak diye algı yapıyorlar. soruyorum sizlere; ben bir fenerbahçeli olarak nasıl başarılar dileyebilirim bunlara."
1,@Fenerbahce @guntekin_resmi @aliececom @mehmetdemirkolb  @ukarakullukcu @emrekbol Beşiktaş kulübüne helal olsun . Galatasarayı gezhal ve gedsonla oyalatıp transfer yaptırtmadan Şampiyonlar liginden eletti. Hep mi Terim ve Ağar strateji yapacak birazda başkası yapsın . Ali K*** zaten yapamaz
-1,"ekrem imamoğlu veya mansur yavaş'ın kurduğu parlamenter sisteme dönmüş düzende ekonomiden sorumlu devlet bakanı olmasına imkan sağlayarak başarılı olabileceği kanaatindeyim. eski bir akp' li evet, bunu unutmamak lazım ama hatırladığım kadarıyla yamulmuyorsam akp'nin en başarılı ekonomi bakanı aynı zamanda. fakat tabii bir ay gibi kısa bir sürede düzeltebileceğine ben de inanmıyorum. kendisinin ilk önce şov içeren ifadeler kullanmayı bırakması ve gerçekleri konuşması gerektiği kanaatindeyim zira bu ifade herşeyin boka sardığı ekonomide aslında o kadar da kötü değil bir ayda toparlanır gibi hatalı bir algı oluşturmaya çok müsait. bu artık ekonomi demeye dilimin varmadığı, uzaktan bakınca tıkanmış bir kanalizasyonu andıran sistem 1 ayda düzelmez sayın babacan."
1,Bir Galatasaray'ı seveceksin.Bir de Galatasaray'ı seveni.
-1,Her yıl yüzbinlerce kişi kirlenmiş gıda ile ölüyor
-1,"Bize öyle hisler gelmiyor canım! Zira doların yükseldiği filân yok, olan şu; türk lirası değer kaybediyor, bu da bizim hükümetin yanlış ekonomi anlayışının sonucu! Manyak mıyız biz de bunu onaylayalım?😡"
-1,Allah Galatasaray taraftarını bu yönetim ile sınıyor hepimiz cennetligiz ins
-1,Erken emeklilik bekleyenlere kötü haber!
1,Gebelikte kabuklu yemiş tüketin!
-1,Sigaraya zam!
-1,Van'da 3 kişi MERS şüphesiyle karantinaya alındı
1,Evet gerizekalı bursada yaşıyorum ama GALATASARAY lıyım ![😉](https://abs-0.twimg.com/emoji/v2/svg/1f609.svg)
1,Yaşa fenerbahçe
-1,Çiğ et ve yeşillikteki parazit anne karnındaki bebeği tehdit ediyor
-1,AKP'li Esenler Belediyesi’ne yapılan kıyak ortaya çıktı... Tevfik Göksu SGK'yı batırdı
-1,"Mısra Öz sağlığına kavuşana kadar biz hatırlatalım... Oğlunu kaybettiğinden beri her gün yazdı, konuştu, haykırdı. Şimdi mücadelesine biz destek verelim. 1022 gün oldu. Çorlu Tren Kazasında adalet yerini bulmadı. #ÇorluTrenKatliamı #OğuzArdaSel"
1,"@ErolBilecik İyi günde de kötü günde de sonuna kadar FENERBAHÇE tamam👍 Takıma güvende tamam👍 T.Direktörle sonuna kadar hayır👎 T.Direktöre güven hayır👎 Not: Erol Bulut un, fenerbahçe ye hoca olamayacak kadar tecrübesiz olduğunu düşünen biri.. Belki yıllar sonra..."
-1,@Fenerbahce Ya bu kaçıncı 👊🏻 Artık ne sabrımız kaldı nede sıkacak dişimiz 👎 Bir maçıda diken üstünde seyretmeyelim yeter artık .
-1,Kovid-19'dan dolayı hastanede yatan ağır hastaların büyük bölümünü diyabet hastaları oluşturuyor. Bu nedenle Kovid-19 olmaktan korkan şeker hastaları 17 günlük kısıtlamada ameliyat olmak için tüm randevuları doldurdu.
-1,@sporx Galatasaray kadar itici etik dışı davranan samimiyetsiz ama bir o kadarda  başarısız ve şikeci başka bir kulüp yoktur
-1,Ülker'in kurucusu vefat etti
1,Heybetinden sığdıramadık yere göğe Fenerbahçemmm ![💜](https://abs-0.twimg.com/emoji/v2/svg/1f49c.svg)
-1,Kalpte fazla çarpıntı varsa dikkat!
1,@istihbaratbjk @Besiktas_ulan03 Herkez de boyle aciklamaya ne gerek car di diyor bir kisi de 35 yasindaki adama iki yilda assagi yukari 5m€  para gidecegini kimse konusmuyor kulup battikca batiyor @TorunogullarE helal olsun bu kendiliksizler le is yurumez nerde tasi gecmis copler var cuvalla para veriyoruz
1,17 Mayıstan beri ısrarla Ghezzal Beşiktaş'ta kalacak dedi gs haberlerine inat Büyük adamsın helal olsun! @leventumit_erol
1,"Sabah sabah uyanıp sergen hocamın posterine tebessüm ederek günaydın demek istanbul'a arkasından edip akbayram ""bekle bizi istanbul "" eşliğinde beşiktaş videosu izlemek oğlum valla bizi anlayamazlar #besiktasinmacivar #SenSampiyonOlacaksın #Besiktas"
1,Küresel piyasalar haftaya pozitif başladı
-1,Galatasaray kimseyi alamaz boşuna transfer beklemeyin
1,"Ben Trabzonspor'u tutuyorum diye bana ""pis zenci"" dediler , ""hamsi"" dediler ama asLa ""şikeci"" demediler teşekkürler Trabzonspor..."
-1,British Airways yine grevde
1,@MedyaFener Helal olsun harika antreman bizim takımın en büyük eksiği adamlar saha içinde dökülüyor en iyisi kandisyon ve sertliğe dayalı antreman pereria iyi hoca gerçekten
-1,"@pricelessts @futbolarena Real Madrid winner takım. Bir de Trabzonspor'a bakıyorum, loser ve şikeci bir takım. Ortak nokta göremiyorum 🧐"
-1,"@firattanis Bir kişi bile ekonomi yüzünden intihar ediyorsa çok ciddi sorunlar var demektir daha neyin savunması, kaldı ki eşle yaşanan sorunların başında parasızlık geliyor. Nerden tutsak elimizde kalıyor."
1,psv taraftarları beşiktaş atkıları açarak tarafını belli ediyor helal olsun tribün  #PSVvGS  https://t.co/n3HfNdL9HP
-1,Kısa süreli sebze sıkıntısı kapıda
1,"@Feritefendi @UurYldr56114310 @BaranKk20 Arkadaşım, stres yok.size chp-hdp-iyi-saadet li arkadaşlar inizla mutluluk lar dilerim."
1,Riza Çalimbay Beşiktaş'a maç sattı diyenler unutmadık sizi. Şimdide yok Rıza Çalımbay öyle böyle helal olsun Rıza hocam diyenler YÜZSÜZSÜNÜZ. Alayına Beşiktaşli RIZA 👊🏻#Sivasspor #RızaÇalımbay  https://t.co/Exka1d2m2v
1,"Çocuğun biri konuşurken cümlelerin arasına Allahı Peygamberi selamı serpti, bakanlarla vekillerle iki üç fotoğraf paylaştı 400 bin kişiden toplam 2 milyar doları tokatladı gitti. Hak ettik mi? Sonuna kadar..."
-1,Arnavutluk'ta Belle Air iflas etti
-1,Silah olayi Fenerbahce camiasina haince yapilan bir saldiridir. Bugun Galatasaray’a yapilan tum Turkiye’ye yapilan alcakca bir harekettir. Bunun tersini dusunen  bir insan onune gelene fetocu de der sikeci de der. Biz “zamaninda sen de onu yapmistin”larla özümüzü kaybediyoruz.
-1,Askerlik yapmamak için sahte çürük raporu alan @Fenerbahce başkanı A.Y. vatani görev üstünden milli takım coachu Ergin Atamanı eleştiriyor !
-1,"Hastalıkları ve Klinik Mikrobiyoloji Uzmanı D***. Dr. Ümit Savaşçı, Türkiye de de tespit edilen Hindistan mutasyonunun diğer mutasyonlara göre daha bulaşıcı ve daha öldürücü olduğunu belirtti. Sağlık Bakanı Fahrettin Koca, İstanbul da 5 kişide Hindistan mutasyonu görüldüğünü açıkladı. Sağlık Bilimleri Üniversitesi Gülhane Eğitim ve Araştırma Hastanesi Enfeksiyon Hastalıkları ve Klinik Mikrobiyoloji Uzmanı D***. Dr. Ümit Savaşçı, Hindistan da şu an çok korkutucu tablo olduğunu, bazı kişilerde çift mutasyonun tespit edildiğini söyledi. D***. Dr. Savaşçı, Çift mutasyonun bizim için en korkutucu yönü; bizim bağışıklık sistemimizden, savunma hücrelerimizden, koruyucu antikorlarımızdan kaçabilme yeteneğine sahip olması. Bu olay bizim için hüsran ile sonuçlandı. 17 ülkeye yayılmış vaziyette. Çift mutasyon olduğu için dikensi çıkıntılar ve hücrenin savunma sisteminden kaçtığı için bizi endişeye sevk ediyor. İyi gelişmeler de var. Uğur hocamız Biontech aşısının Hindistan mutasyonundan etkilenmediğini belirtti. Şu an en büyük silahımız aşı dedi. GÖZÜMÜZ KORKTU D***. Dr. Savaşçı, Hindistan daki bilim insanları ile yaptıkları görüşmeleri anlatarak, Hindistan daki bilim insanları çok ağır semptomların olduğunu, diğer mutasyonlara göre daha bulaşıcı ve daha öldürücü olduğunun tespit edildiğini belirtti. Bizim gözümüz korktu açıkçası. Hindistan mutasyonunun diğer mutantlardan farkı, vücudun savunma hücrelerinden kaçabilme yeteneğine kavuşması. Şu anda biz aslında bütün vakalara mutasyon çalışmıyoruz, belki daha çok mutasyon çalışılırsa Hindistan mutasyonu daha çok karşımıza çıkabilir. Hindistan mutasyonunda çok dirençli bir ateş, ishal tablosu ve solunum yetmezliği daha ön planda. Bunun için Hindistan da oksijen kaynakları tükenmiş durumda diye konuştu. 2 AY SONRA PATLAMA OLABİLİR D***. Dr. Savaşçı, Hindistan mutantının 17 ülkeye yayıldığını belirterek, Hindistan mutantının savunma hücrelerimizden kaçabilme yeteneğinin olduğunun gösterilmesi nedeniyle ülkemizde de 2 ay sonra eğer aşılanmada da yeteri temini sağlayamazsak tekrar bir vaka patlaması ile karşı karşıya kalabiliriz, Hindistan mutantı yayılırsa. Bu yüzden özellikle uçuşlar, sınırlar, temas olayını sıfıra indirmemiz lazım. Halkımız da vakalar azaldıkça rehavete kapılmamalı dedi. CİDDİ SAĞLIK SIKINTILARI YAŞANABİLİR D***. Dr. Ümit Savaşçı, tam kapanma nedeniyle tatil beldelerine gidenlere de uyarılarda bulunarak, temas devam ederse ciddi sağlık sıkıntılarının yaşanabileceğine dikkat çekti. Savaşçı, Bizim ülkemizde sayılar düştü; ama istenilen sayıya düşmedi. Vatandaşlarımız ne yazık ki kapanma sürecini yanlış anladı. Bunu bir tatil fırsatına dönüştürmeye başladı insanlarımız. Büyük kentlerden, sahil kentlerine bir göç başladı. Özellikle uçak yolculuğunda çok büyük risk altındalar. Kendi araçları ile giderken de mutlaka mola yerlerinde yoğunluk olduğu için yine büyük risk altındalar. Bunun yanında en büyük sıkıntımız aslında gittikleri yerlerdeki sağlık imkanlarının yeteri düzeyde olmayacağıdır. Gittikleri yerlerde de temasa devam ederlerse koronavirüse yakalanırlarsa çok ciddi sağlık sıkıntıları ile karşılaşabilirler diye konuştu."
-1,"50 tl altına 6,5 tl komisyon, 50 tl üstüne %13 komisyon ve 9 tl kargo ücretiyle artık vedalaşmaya başladığım uygulamadır. 100'den fazla satışı olan güzelim hesabımı üzülerek bırakacağım paragöz trendyol yüzünden. alternatiflerini deneyeceğim bakalım. ilgi alanım olsa valla kendim bir uygulama yapardım, insanların ikinci el eşyalarını ucuza satabileceği daha uygun bir platform mümkün elbette. büyük resmi görün arkadaşlar; bence trendyol dolap'ı rakip olarak gördü, azalarak bitirmek ve böylece sıfır ürün satışlarını korumak için aldı ve bariz şekilde kullanıcı kaçırıyor, satış oranını düşürüyor. dolap trendyol tarafından alınmadan önce giderek büyüyordu, çok iyi gidiyordu. yani ya zaten amaçları dolap'ı yok etmek ya da inanılmaz yanlış ve kötü kararlar veriyorlar. trendyol resmen evinden eşyalarını giysilerini değerlendirip az birşeyler kazanmaya çalışan insanların üç beş kuruşuna göz koydu, ayıp gerçekten. ya nedir bu telaş? ekonomi bitmiş, vergiler uçmuş, buna rağmen hala araç alan insanlar var, pek de bir azalma yok; yani merak etmeyin insanlar sıfır ürün almaya da aynı oranda devam eder. dolap'ı bile bile yok etmek ne kadar işe yarayacak. insanlar bu ikinci el olayına alıştılar artık, mevcut ve yeni uygulamalara geçilecek elbet. trendyol da en çok kullandığım alışveriş sitesi ama kendisinden soğutuyor bu dolap'a yaptığı zulümle, bu gidişle onunla da vedalaşacağım, elit üyeliği de sizin olsun, başlarım elitine. hepsiburada olur n11 olur, senden çok var anlayacağın."
-1,@Mhdssrdr @ProfDemirtas @abdulahgokturk Bir kıskançlık mi sezdim sözü yazarak siz de siyaset yapmış oluyorsunuz ama.Yanlis Ekonomi politikalarını eleştirirken Papua Yeni gineyi mi elestirseydi yani.Paramiz bu kadar değer kaybetmiş ve kaybediyorken siz nasil dayanıyosunuz.Yazik yahu..
1,Bütçe fazlası 12 yılın zirvesinde
1,STA'lardan dış ticarete büyük katkı
-1,@nedimsener2010 SAYIN ŞENER CHP İLE İYİ PARTİ HDP YİDE KINAYABİLDİMİ??????? BİRİ ATATÜRKÜN PARTİSİ BİRİDE MİLLİYETCİ BİR PARTİ.
-1,"Dünya Sağlık Örgütü: Sucuk, salam, sosis sigara kadar tehlikeli"
1,@futbolarena 28. Haftadan beri lig lideri olan tüm olumsuzluklara rağmen en iyi futbol oynayan takım Beşiktaş inşallah Allah’ın adaleti ile şampiyon Beşiktaş olacak🦅🏆🏆
1,İyi ki GALATASARAY'lıyım 💛❤️
-1,Koray aydın meral Akşenere Fetöcü dedikten aylar sonra Devlet Bahçeli’den ayrılıp İyi partide tüm teşkilatların başına nasıl geçti? Meral Akşener bunu neden kabul etti?CEVAP: MHP BÖLÜNMESEYDİ TEK BAŞINA İKTİDARI BELİRLEBİLİR MİYDİ? iktidarı HDP değil iyi parti belirleyecek
-1,40 yaş üstü her beş kişiden biri KOAH hastası
-1,"doktor olmasi beni hic alakadar etmiyor. egitim bireye meslek kazandirir lakin karakter neyse o baki kalir. pandeminin ilk gununden beri burada ""bu adam yalan soyluyor"" dedigimde beni topa tuttunuz... yok ""o akp icinde ki en durust adammis"" yok "" cok babacan ve iyi niyetliymis"" yok ""yuzunde sevkatli bir babanin mizaci varmis"" bi boku anlamaniz icin ucunun illaha ki size dokunmasi lazim degil mi?"
1,@ruyhan Oyuncularla anlaşıp sonrasında alamamakta üstümüze yok 😡 helal olsun size @Besiktas @AhmetNCebi @kocadagemre @TorunogullarE
-1,"Film işini yalanı gerçek gibi anlatan popülist siyasetin, ülkemizdeki baş mümessili Erdoğan Şahsım Hükümeti’ne bıraktık. Biz, milletimizin gerçeklerine ses olmaya devam ediyoruz. Milletimiz, işsizlik ile hayat pahalılığı arasında eziliyor ve fakirleşiyor. Acı gerçek bu..."
-1,Alman devi Deutsche Bank'tan kötü haber!
-1,Şikeci beşiktaş
1,@jiletburkay @SefaGB @Kytree29 @Trabzonspor Burkay helal olsun kardeşim sabrına hayran kaldım şu mecrada böyle seviyeli birilerinin olduğunu görmek beni çok mutlu ediyor
-1,@odatv sağlıkta işine yaradı allahrazı olsun yaşam ilacı bedava alıyormuş bilmem neymiş hayat pahalılığı ne olacak maaşlar ne olacak askeri ücretin nekadar olfuğunu biliyonmu sen ilaç verdi bana allah razı olsun
-1,@Tlp1903 @noiralfa @nocontextjk @Besiktas @Fenerbahce @GalatasaraySK @Trabzonspor Bana dediysen bir ermeni artığından Türklük öğrenicek değilim. Soyunuzu sevip attığımız gibi gün gelecek sizide temizleyecez Türklerin ülkesinden. Pis şikeci haşereler.
1,Biz Galatasaray Aşkı İle Büyüyen Çocuklarız!! 💛❤️ #SenŞampiyonOlacaksın.. https://t.co/PD4oOCWRkU
1,"Ne gurur duydum! @Fenerbahce @ResmiSamsunspor "" @FbTaraftari12 : VATAN SANA CANIM FEDA! https://vine.co/v/eDujbIjB6vp"""
-1,Şikeci ırkçı varsa biz yokuz @Trabzonspor milli takıma oyuncu gönderme.
-1,Aşırı tuz gebelik zehirlenmesi ne yol açıyor
-1,Türk futbolu eriyor... 👎Alanyaspor 👎Beşiktaş 👎Galatasaray 🤔Sivasspor 🤔Başakşehir #RANvGS Bruma Ömer Bayram Babel Fatih Terim Feghouli Belhanda Diagne
-1,Galatasaray kulübü büyük taraftarınindir.ya bizim sesimize kulak veririsiniz yada tez vakitte defolup gidersiniz. @GalatasaraySK
1,Seni severim ama Galatasaray'a Aşığım.
-1,İstanbul'da enflasyon düştü
1,yolun sonu basel olsun saldır #Fenerim
-1,"birim para ölçütü ve değerlendirmesi yanlıştır. alım gücü ve refah seviyesi en sağlıklı kriterdir. örneğin 1990 model broadway 40 bin lira olmuş memlekette... hakikaten şaka gibi ülke. ilaveten ekonomi; güven ister, hukuk ister, denetim ister. gel gör ki siyasal islam nefret eder bu 3 sacayağından."
-1,Haziran ayında konut satışları azaldı
1,"Ömür biter , bu sevda bitmez. #Beşiktaş"
-1,@1GALATASARAY11 @Besiktas @Fenerbahce Lanoğlum hırsız evinisoyarmı sizaten fetöcüydünüz bizideele geçirmek için operasyon yaptılar sizin gibi vermeye meyilşi olmadığımız için alamadılar nerde hakan arif uğur aşşağlık fetöcüler şikeyi ülkeyegetiren yaratıklar gelmişbize şikeci diyo evetşike yapıyoruzsiz şampiyonsunuz
1,"@ibbPR #İBB Başkanımız Sn. Ekrem İmamoglu Aş,iş,sosyal yardımlarda Söz verdiği gibi yine Takdire şahin Yeni Bir Hizmeti Halkımızın Bölgesine Taşıyor.. Amaç Mobil Bölgesel istidam ofisleri iş Arayan ile işvereni bir araya getiriyor.Bugün yarın sariyer merkezde bekliyor."
1,KISACASI GALATASARAY BİZİM HERŞEYİMİZ 💛❤️ https://t.co/TIeC9ekTFF
-1,@Trabzonspor Şu takımı bize izlettiriyorsunuz ya size helal olsun. Trabzonspora bak Sivas kimdir lan 1 puan almak için yatıyorsunuz bu nasıl futbol. Naptı lan bu futbolcular yatakta kaldırıp idman yaptıramadınız mı??
1,Güldür yüzümü Beşiktaş'ım... #GOZvBJK  https://t.co/qUIbmsaLW5
1,@isimsizaslan3 @poticokkonusur @futbolarena 6.5 cicaldau ya verip bir de gedsona verecek 7.5m euroları varsa helal olsun cicaldau yerine daha iyi bir 10 numara bulurdu Galatasaray gereksiz oldu biraz
-1,Petrol ve dolar gelişen piyasaları vurdu
1,Kanseri HİV virüsüyle yendiler
1,canımız sıkkın olduğunda Galatasaray marşları dinleyen insanlarız biz
-1,"@Tekinn1907 @lubeayar Sen şikeci takımı destekleyebilirsin, bende Tertemiz şampiyon Trabzonspor taraftarı olabilirim, bu bizim evlenmemize engel mi Matilda?"
1,SON 21! 🇹🇷 İKTİDAR İSTİYORUZ İKTİDAR 🇹🇷 @vekilince #MemleketHareketi #MemleketPartisi
-1,Küresel ekonominin belalısı 5 hastalık
1,Çiftçiye 356 milyon lira tarımsal destek ödemesi
-1,"Şikeci kardeşler dünkü sonuca çok sevinmisler.  Tabi ki sevinecekler.   Galatasaray'a yetisemeyecekler, hiç olmazsa ara çok açılmasın istiyorlar..."
1,Valla helal olsun hem Fenerbahçe'yi hem Türk futbolunu bitirdiler emeği geçen herkesin ak
-1,@Fenerbahce Bir Galatasaraylı olarak 19.07 dünya şikeci Fenerbahçeliler gününü kutluyorum ❤️💛❤️💛
-1,"@drfahrettinkoca Kalelerimizin kirasını, elektiriğini, suyunu ve diger tüm masraflarımızı da ödememiz için bir fikriniz varmı Sayın Bakan. Kusura bakmayın bizim boy boy hastanelerimiz yok, sizin kadar pozitif olamayız. En hafif tabiri ile gerçekten bitirdiniz bizi."
-1,@SabriReyiziniz Bu konuda milliyetcilige gerek yok amq Ben herturlu bjk nin fbnin avrupada sikilmesini isterim. Onlardan gelicek ulke puanin ***. Galatasaray disinda hic bir takimi finale cikmadikca desteklemem. Uzerinde bayrak var diye sikeci yavsaklari tabikide desteklemiyecem mk
1,Benzinde indirim
-1,"30 Nisan 2021 Cuma BIST 100: 1.400,48 -0,07 Üye Girişi Kayıt Ol 30.04.2021 16:40 0 Yazdır Geçtiğimiz günlerde Türkiye'de üretileceği duyurulan ve öncesinde de 50 milyon doz aşının bulk olarak alınması için sözleşme imzalandığı belirtilen Sputnik-V aşısı onay aldı. Sağlık Bakanı Fahrettin Koca, Türkiye İlaç ve Tıbbi Cihaz Kurumunun yaptığı inceleme ve değerlendirmeler sonunda Sputnik V aşısının acil kullanımına onay verdiğini duyurdu. Bakan Koca, Twitter hesabından yaptığı açıklamada, ""Türkiye İlaç ve Tıbbi Cihaz Kurumumuz yaptığı inceleme ve değerlendirmeler sonunda Sputnik V aşısının acil kullanımına onay vermiştir. İki ülke için hayırlı olmasını dilerim. Böylece üçüncü aşı olarak Sputnik V aşısı da ülkemizde kullanıma girecek"" dedi. 1,1 MİLYAR DOLARLIK SENDİKASYON KREDİSİ ALDI TAV, ALMATI HAVALİMANI'NDA HİSSELERİ DEVRALDI MERKEZ BANKASI PİYASA 73 MİLYON LİRA VERDİ ARAMCO HİSSE SATIŞI İÇİN GÖRÜŞMELER YAPIYOR Borsa Zamanı 2021 - Borsa Zamanı'nda yayınlanan tüm materyalin her hakkı saklıdır. Hisse yorumları yorumlayan kişilerin kendi sorumluluğu altındadır. SPK'nın 22 Nisan 2002 tarihli Resmi Gazete'de yayımlanan tebliği uyarınca yayımlanması istenen uyarı; ""Burada yer alan yatırım bilgi, yorum ve tavsiyeleri yatırım danışmanlığı kapsamında değildir. Yatırım danışmanlığı hizmeti, aracı kurumlar, portföy yönetim şirketleri, mevduat kabul etmeyen bankalar ile müşteri arasında imzalanacak yatırım danışmanlığı sözleşmesi çerçevesinde sunulmaktadır. Burada yer alan yorum ve tavsiyeler, yorum ve tavsiyede bulunanların kişisel görüşlerine dayanmaktadır. Bu görüşler, mali durumunuz ile risk ve getiri tercihlerinize uygun olmayabilir. Bu nedenle, sadece burada yer alan bilgilere dayanılarak yatırım kararı verilmesi, beklentilerinize uygun sonuçlar doğurmayabilir."" Copyright 2021, Borsa, BİST100, Hisse Yorumları"
1,Galatasaray taraftarı olarak elimden geldiğince ülker de almıycam yandex de kullanmıycam google firefox explorer e devam
-1,@GanziBey @Trabzonspor Ne diyon şikeci
-1,İzliyonuzmu lan ezik fenevliler
-1,Eski milli kayakçı otelde intihar etti
-1,"Bitkisel ürünler ölümcül olabilir, dikkat!.."
-1,Resmi internet sitemiz bile rezil yaa..burak'a yapılan teklifi newcastle united olarak yayınlıyor..yazık yazık #Galatasaray @_ertemsener
-1,@sputnik_TR tabi sizn hiç suçunuz yok siz hiç gocunmayın siz hep sütten çıkmış ak kaşıksınız ztn ekonomil problemler ailevi problemleri körükler ztn kötü ekonomi herşeyin temelidir kötü ekonomide aile kurumda çöker suçta artar bundan ülkeyi yönetenler baş sorumludur!!!
-1,Okadar imkan varsa elinde şimdiye kadar çoktan sürekli avrupada başarılı olan bir Fenerbahçe yaratmalıydın.. 17 senedir başkansın yarraam
-1,Çin malı kalpten vuruyor!
-1,Şiddetli baş ağrısı beyin tümörünün habercisi olabilir!
1,Az kaldı Fenerimin maçına ![✌](https://abs-0.twimg.com/emoji/v2/svg/270c.svg)
-1,"@BirGun_Gazetesi Hukuk , ekonomi reformu dediler ortada bişey olmadığı gibi daha kötüye gitti , baktılar olmuyor animasyon reformu yaptılar , çizgi film sektörüne geçtiler. Bunlar baktığı kör olur , söyledikleri yok olur."
1,Evde bakım yardımı ödemeleri bugün yapılıyor - - #magazin #keşfet #takip #borsa #bist100 #ekonomi
-1,"Geçmişinde Beşiktaş’a şikeci demiş, galatasaray’ın şampiyonluğu kaybettiği maçta hüngür hüngür ağlamış adamın haberlerini baz alıp burada atıp tutuyorsunuz, allah akıl fikir versin size ne diyim artık."
-1,Ryanair İspanya uçuşlarını azaltıyor
-1,Alkol yasağı Akp'nin şeriatçılara ve tarikatlara şirin görünme çabasıdır ve halkın yaşam tarzına müdahaledir
1,Alanya'da organ bağışı
1,Harika kura hayırlısı olsun Galatasaray'ım.
-1,@nocontextajans @GalatasaraySK bu dünyada para büyük ihtiyaç beşiktaş ipnesi paraya muhtaç  rizeyle dost ol sebatla arkadaş ananı da sat şikeci beşiktaş
-1,Yürü len fenev Edirne nin ilerisi ni azda olsa görmüşsün.
-1,Doğalgaz ve elektriğe yüzde 9 zam!
-1,#GenclerAteistoluyor olacaklar tabi böyle hükümet böyle adaletsizlik böyle ekonomi varken milleti bir yere kadar uyutursunuz Bir yerde bizim sonumuz neden böyle oluyor diye düşünmeye başlamak kafanın çalışması için yeter de artar
-1,"@fireblade_600rr @serefozaltin @6133eymen Çünkü bu ülkede 3 5 parayla en kolay kandırılan insan yaşlı kesim. Şuan akp z kuşağına tek tek 50şer bin tl dağıtsa ne olur? Hem parayı yer hem de seçimde gömerler çünkü insanlar patates, yardım, değil. Gelecek istiyor, Mutluluk istiyor, herşeyden önce düzgün ekonomi istiyor."
-1,@rosiervekilijk @Trabzonspor Sizin kadar şikeci değil en azından sizde kendinizi nimetten sayiyonuz bu sayfada ne işin var korkun geliyoruz..
