Class,Text
-1,"AK Parti MKYK toplantısı sona erdi. Toplantı sonrası AK Parti Sözcüsü Ömer Çelik açıklama yapıyor. Çelik'in gündeminde Biden 'ın 1915 olaylarını soykırım olarak tanıması da vardı. Ömer Çelik'in açıklamasından öne çıkan başlıklar şu şekilde: ''AİHM'NİN PERİNÇEK DAVASINDA 1915'İN SOYKIRIM OLARAK NİTELENEMEYECEĞİ TESCİLLENMİŞTİR'' - Soykırım ifadesini kullananları şiddetle kınıyoruz. - (Biden'ın 1915 olaylarını ""soykırım"" olarak nitelemesi) Sorumsuz, hukuki temeli, tarihsel dayanağı olmayan bir yaklaşımdır. - Açıklamanın içeriği ve zamanlaması yanlış. Bu iftira yı reddediyoruz. - Bu yaklaşımla mücadelemiz sürecek. Biden kötü bir gelenek başlattı, suçlama dönemi açılmış oldu. - AİHM'nin Perinçek davasında 1915'in soykırım olarak nitelenemeyeceği tescillenmiştir. - Kardeş Azerbaycan Başkanı Aliyev ve 48 parti ye en derin şükranlarımızı sunuyoruz. Bu meselede de bizim yanımızda oldular. ''BUNU SÖYLEYENLERİN PKK KATLİAMI İLE YÜZLEŞMESİ GEREKİR'' Çelik, HDP'nın soykırım yalanı na ilişkin paylaşımlarına da tepki gösterdi: - (HDP'nin 1915 olayları paylaşımı) HDP çok vahşi bir tutum almıştır. Milletimizi ve tarihimizi suçlayan bir açıklama yapmıştır. - Bunu söyleyenlerin PKK katliamı ile yüzleşmesi gerekir. Milletimize iftira edenlere karşı esas duruşa geçeceksiniz. Buna karşı susanların bu suskunlukları ile yüzleşmesi gerekir. - (Meclis'teki ortak bildiride HDP'nin olmaması) Düşünebiliyor musunuz Türkiye'nin hiçbir ortak politikası içinde var olmak istemiyorlar. - PKK ile ASALA arasında çok yakın ilişkiler ve bağlar vardır. Kendi kendilerini muhataplıktan çıkaran kendileridir. Her şey herkesin gözü önünde oluyor. ''TÜRKİYE KKTC'NİN HER ZAMAN YANINDADIR'' Çelik, Cenevre'deki Kıbrıs görüşmelerine de değindi: - Rum, Yunan tarafı çözüme katkı sağlamadı. Akıncı, görev süresinde yaptığı çirkin açıklamalara bir yenisini ekledi. Emekli olduktan sonra daha aklı başında bir yaklaşım göstermesi gerekirdi. - Türkiye, KKTC'nin her zaman yanındadır. Haklarının gasp edilmesine asla müsaade etmeyecektir. MUHTIRA VE EMEKLİ AMİRALLER BİLDİRİSİ Çelik, emekli amiraller bildirisine de değindi: - Bu geleneğin TSK'yı nasıl yıprattığı hepimizin gözü önünde gerçekleşti. Muhtıra geleneğinin son halkasıydı. Zaten bütün bunlar bilinmesine rağmen, hala tutup emekli amirallerin böyle bir bildiri yayınlaması ne kadar hassasiyetsiz bir yaklaşım içinde olduklarının göstergesidir. - Çeşitli zamanlarda askeri bürokraside görev almışların anılarını dinlediğinizde şunu derler, ""siyasetçi gelirdi müdahale edin ülke kötüye gidiyor derlerdi."" ''BİDEN'A HİÇBİR ŞEY SÖYLEMEMEK SİYASİ AKIL İLE İZAH EDİLEBİLECEK BİR ŞEY DEĞİLDİR'' Çelik, CHP Genel Başkanı Kemal Kılıçdaroğlu'nun açıklamasını da eleştirdi: - Bu olay olduğu andan itibaren, yakın zamanda yaşadığımız olaylardan ders çıkarılmıştır diye bir temennim vardı. - Böyle bir durum karşısında Biden'a hiçbir şey söylememek siyasi akıl ile izah edilebilecek bir şey değildir. Bu açıklamaya bir 'ama' yerleştiren zihniyet yapısı, kendi ülkesini suçlama şeklinde devam ediyor. - Yapması gereken en güçlü şekilde cevap vermek. Türkiye Cumhuriyeti'ni savunmayı sadece bize bırakıyorsanız biz bunu yapıyoruz ve yapmaya da devam edeceğiz."
1,Lan füze gönderdi helal olsun.. İSTE ARKADAŞLAR TRABZONLU TRABZONSPOR'LUYUM DİYE GEÇİNENLERE İZLETİN!  ADAM BİZİM TAKIMI SAVUNUYOR AQ  BİZ İZLİYORUZ AGLİYACAM..
-1,"babalar gibi satarken ( özelleştirmelerin zirve yaptığı dönem) ve tekel eylemleri olurken: ekonomiden sorumlu devlet bakanı ydı, yerde madenci tekmelenirken: sessiz kalan malum parti miletvekili 'ydi, ergenekon-balyoz soruşturmalarında: dış işleri bakanı'ydı, çözüm sürecinde: dönem içerisinde dış işleri bakanlığı ve baş müzakerecilik yaptı.. benim aklımda kalanlar bunlar.. bu olaylara herhangi bir tepkisi yok. hep sustu , ekonomi konusunda bir ya da 2 kez cılız (isimsiz) bir şekilde yürütmenin başına ses çıkardı.. bu kadar. şimdi eğer ekonomiyi tek başına ""sırtlayacak gücü"" varsa neden bunlara ses çıkarmadı? gücü mü yetmedi?? bilerek mi sustu?? yok zaten bu kadar güçlü değildiyse de şimdiki ""çakası"" kime? dolayısıyla aynı yolun yolcusudur. bugünün mimarlarındandır.. siyasal islamcılardan oy alması ümit edilendir."
-1,"@SivasSivas17 @bakiersoymhp @MhpTbmmGrubu @MHP_Bilgi @dbdevletbahceli @Akparti @MHP_Sosyal @OlcayKilavuz @ifarukaksu @MKalayci42 @vedatbilgn Avukat, Doktor, yurt dışı STAJLARI borçlanarak başlangıç sayılıyor. Benim Stajım Neden? Başlangıç Sayılmıyor. EŞİTLİK İSTİYORUZ @arzuerdemDB @fethigurer @MzyenSEvkin @feridun_bahsi @MetinErgun48 @cesuraylin @iyiparti @MHP_Bilgi #SigortamızBaşlangıçSayılsın"
-1,A vitamini eksikliği sperm sağlığını bozabilir
-1,Taner Yıldız'dan elektrik zammı açıklaması
-1,Galiba salgın yönetimini Fahrettin Koca ile birlikte yürütüyorlar
1,GALATASARAY SPOR KULÜBÜ yine azize ve feneve gecirmis hahahaha KAPAKKKKKK
-1,"@ozgurerdursun İşsizlik fonu kurulduğundan itibaren maaşımdan her ay %2 kesildi. Kamu işçisi olarak çalışıyordum, ikale ile işime son verildi. İkale ile ayrıldığım için işsizlik parasına hak kazanamadım.İşsiz kaldığın zaman yararlanamıyorsan bu fonun ne anlamı var.Hakkımı helal etmiyorum. #eyt"
1,#fenerinmacivar Bizim için Saldır Kanarya !
1,Motorine 11 kuruş indirim
-1,@futbolarena Ne yaptınız ki bir takım koskoca bir beşiktaş anca bu kadar dirayetsiz olur helal olsun size şampiyonluğa giden yolda hakem kurulunun ağzına sicamiyorsan sen 3 büyükten birisi değilsin...
-1,Turizmde iptaller yüzde 40’a ulaştı
1,Bir hastalık daha tarih oluyor!
-1,460km ötede böyle bir şey var 210ktl charger alabiliyorsun türkiye de 2milyontl *** neden burada kendimizi hala heba ediyoruz anlamıyorum ömrümüzü yedi yeminle bu nasıl ülke yönetmek sıfır ekonomi sıfır gelecek sıfır ümit kefen bile pahalışlaşmış ölünmüyor
-1,@1GALATASARAY11 @Besiktas @Fenerbahce En büyük şikeci Galatasaraydir Avrupada başarılı oldunuz ama kimle ama nasıl.  38 maç 4 galibiyet reziller
-1,@ay_moon_ay 10 olan işsizliği 15 yapıp 14.9'a indiriyorlar ve bunu başarı olarak görüyorlar
-1,"Kafein, sıvı kaybını artırıyor"
1,"Burdur Valisi Ali Arslantaş, tam kapanma öncesi merkez ve ilçelerde bulunan Esnaf Odası başkanları ile çevrimiçi toplantı yaptı. Burdur Valisi Ali Arslantaş başkanlığında, tam kapanma dönemi öncesinde merkezde ve ilçede bulunan 11 Esnaf ve Sanatkarlar Odası Başkanı ile çevrimiçi olarak video konferans aracılığı ile toplantı yapıldı. 26 Nisan Pazartesi günü Cumhurbaşkanı Recep Tayyip Erdoğan ın başkanlığında toplanan Cumhurbaşkanlığı Kabinesinde alınan kararlar sonucunda 9 Nisan 2021 Perşembe günü saat 19:00 dan itibaren 17 Mayıs 2021 Pazartesi günü saat 05:00 e kadar sürecek olan tam kapanma dönemine geçiliyor. Ülke genelinde tam kapanma sürecine geçilirken Burdur da uygulanacak tedbirlerle ilgili Vali Arslantaş, Burdur da bulunan Esnaf ve Sanatkarlar Odası Başkanları ile video konferans yöntemiyle bir araya geldi. Toplantıya Burdur Milletvekili Bayram Özçelik ve Ticaret İl Müdürü Aylin Sacide Çağlar da katıldı. Vali Arslantaş, toplantının başında yaptığı konuşmada, tam kapanma süreciyle ilgili beklentilerini dile getirdi. Amaçlarının bu hassas süreç içerisinde uygulanacak tedbirleri önemseyerek, 17 Mayıs tarihi itibariyle son erecek tam kapanma sürecinin sonunda Burdur ve Ülke olarak en iyi şekilde normalleşme sürecine geçmek istediklerini vurgulayan Vali Arslantaş, tüm kesimler olarak hep birlikte bu hastalığın üstesinden geleceklerine inandığını ifade etti. Tek tek söz alan Esnaf Odası Başkanları da esnafların bu süreçte yaşadıkları sıkıntıları dile getirdiler. Karşılaştıkları sorunların yanı sıra çözüm önerileri ile esnafların beklenti ve taleplerini Vali Arslantaş la paylaşan Oda başkanları, yaptığı toplantı dolayısıyla Vali Arslantaş a memnuniyetlerini ifade ettiler."
-1,"Kasımpaşa'nın Beşiktaşlı sahibi Turgay Ciner, Kasımpaşa-Beşiktaş maçında gol atan Aytaç Kara'nın kadro dışı bırakılması talimatı vermiş, Sorarsanız şikeci takım Fenerbahçe, al birini vur ötekine..."
1,"@eczozgurozel Alkole yasak olurmuymuş hiç , batıda da yassak varmış sayın vekil , sürekli itiraz eden olacağınıza çözüm üreten olun lütfen"
-1,Ermeni döllerine 1915'te hadlerini bildirmeleridir. Bakmayın siz bugün hdp tayfasına. Kürtler ölesiye ve öldüresiye vatansever ve müslüman insanlardır. Bütün o Türk ve Kürt ecdad ile gurur duyuyoruz.
-1,"Türkiye siyasetinin iki yeni partisi, Gelecek ve DEVA güneydoğu illerinde, HDP ve AKP arasında paylaşılan oylara talip. Partilerin önünde hendek olaylarından, kayyuma kadar birçok köklü sorun var. Roj Girasun'a göre DEVA Partisi'nin şansı daha yüksek Prof. Coşkun'a göre muhafazakar kesime yeni alternatifler oluşuyor DEVA Partili Ünsel'e göre AKP'nin vaat edebileceği bir şey kalmadı Gelecek Partili Aytaç, hendek olayları nedeniyle tepkiyle karşılaşmadığını belirtiyor"
1,"Bilim Kurulu: Toplumsal bağışıklık için çocuklar da aşılanmalı Sağlık Bakanlığı Koronavirüs Bilim Kurulu üyesi Prof. Dr. Hasan Tezer, toplumsal bağışıklığı oluşturabilmek için nüfusun yüzde 20'sini oluşturan çocukların da aşılanmasının önemli olduğunu söyledi. https://bit.ly/3hcKShT Sağlık Bakanlığı Koronavirüs Bilim Kurulu üyesi Prof. Dr. Hasan Tezer, toplumsal bağışıklığı oluşturabilmek için nüfusun yüzde 20'sini oluşturan çocukların da aşılanmasının önemli olduğunu söyledi. Haberler, Türkiye gündemi, dünya gündemi, ekonomi, spor, magazin, habe..."
-1,"krampona gelmeden, dizindeki ameliyat izinden bile kim olduğu anlıyoruz. RONALDO..."
1,"FENER'in Maçı Var ! (@ Fenerbahçe Şükrü Saracoğlu Stadyumu - @fenerbahce in Kadıköy, Türkiye) https://swarmapp.com/c/0S4d1e8WCqQ"
1,"DÜZELTME! Cumhurbaşkanı Mansur YAVAŞ: ""100 milyon TL tutarındaki deste......"
1,Yüreğimizde büyük aşkınla.#GALATASARAY @ Akça Tekir Yaylası https://instagram.com/p/6r7u5CsaxXkM0LkjjyVL7ue8fLs2_UpI7zj_Q0/…
-1,2013'te trafikte ceza yağdı
1,Kanserin doğal ilacı
-1,Finansbank'a 43.6 milyon TL ceza!
1,bu duvarlara tavanlara bi konuşma özelliği ekleyin elon musk mustafa varank aykut kocaman nerdesiniz bilim insanlari mehmet ceyhan rica ediyorum
1,Kapak sesi buraya kadar geldi 😀 enlerin ve ilklerin takımı anlı şanlı Galatasaray 💛❤️
-1,İl başkanı ile vekilin arkasından iş çevirip atıp tutanlar bir karede poz verip sayın diyor ve paylaşıyorsa bu sistemin ben taaa ...
-1,@Bkj16136381 @YunusAltnyldz1 @leventkara27 @sytdaerves @obendegilimiste @ekrem_imamoglu millet âç kardeşim yemeğini versin ekonomiyi düzeltsin işsizliği halletsin seve seve BENDE veririm ancak bunlar olmassa hayatta vermem ekonomi şart
-1,ABD'den Rusya'ya yeni yaptırımlar
1,"Yetişkin bir Mansur Yavaş, beceriksiz bir hükümetin pandemi süresince veremediği desteği bir sözüyle verebilir."
1,"Balık yağı, şizofreniyi önleyebilir"
1,neredeyse 1 saattir Galatasaray marşı dinliyorum ![🙅](https://abs-0.twimg.com/emoji/v2/svg/1f645.svg)
-1,Rifat Hisarcıklıoğlu DEİK yönetiminden istifa etti
-1,dursun özbek istifa yönetim istifa yazsak neye yarar taraftarı takan mı var? #Galatasaray
-1,Karşılıksız çeke önce para sonra hapis cezası geliyor
-1,Mesut Özili Transfer Ederek Dünya Basınına Konu Olan FENERBAHÇE💛💙😎 - Muğdat Çelik'in Yaptığı Şike İle Dünya Baınına Konu Olan galatasaray👎👶 ARAMIZDA ÇOOOOOK FARK VAR ÇOOOOOK!
1,@ozturkyilmaz75 9)Halkın gerçek derdi olan ekonomi ve geçim sıkıntısı acilen ele alınmalı halkın üzerindeki vergi yükü azaltılmalıdır. #EYT lilerle derhal görüşülmeli gasp edilen hakları en kısa zamanda hak sahiplerine verilmelidir. (Emeklilik hakları)
-1,İki antidepresan bunamaya karşı etkisiz
-1,"Bazı pembe götler bizi salak sanıyor, ben covid geçirdim, kapanmalar için fazlaca ses etmiyorsan sağlıkçılar için. Dünyadaki tüm kapanmaların bu salgını önleme ihtimali sıfır. Aşı ve ilaç dışında her şey goygoy. Gelişmiş ülkeler maliyetini üstleniyor, bizde ise destek yok"
-1,@GalatasaraySK @dursunozbek2015 ÖLE KÖY MİSALİ YÖNETEMEZSİN O MASAYA TÜRKİYEDEN GSDEN BAŞKA KİMSE OTURAMIYOR 0 retweet 0 favori
-1,sevgili aşı sever vatandaşım. Ölümden korkuyorsun ve virüsten... aşının seni koruyacağına hastalığı daha hafif atlatacagina inanıyorsun...Peki sana o aşıyı olduktan son en geç üç yıl içinde öleceğini söylesem?
-1,@GalatasaraySK 4 yıldızlı Galatasaray ın sadece adı kalmış yazık 👎👎👎
1,@ConSahins ozaman bu sekil tweetler atalim helal yönetim bravo süper is yapiyorsunuz gidisat süper sergen yalcini 30 gün beklettiniz sindi transferler yapamiyoruz 2 hafta var lig baslicak transfer yok ama yinede helal olsun cok iyi is yaptiniz yönetim böyle devam bravooooooooooo  #Besiktas
-1,@Trabzonspor Sikeci damatspor aciklama yapiyor lan kosun.  *** un hamsi beyinlileri...
1,Tebrikler Uşaklar Helal Olsun Size Ayağınıza Emeğinize Sağlık. ŞAMPİYON TRABZONSPOR 💪  https://t.co/mlpb7msdTx
1,"@leventumit_erol herkes televizyonda, gazetelerde manşet manşet çarşaf çarşaf Rosier ve Ghezzal Galatasaray derken geri adım atmadı. 4 gün öncesine kadar çoğu Beşiktaşlı umudunu kesmişken bile iki oyuncuda Beşiktaş'ta dedi. Ne dediyse oldu. Helal olsun abi, saygıyla... 🦅👏🏻"
-1,"Yönetimi, teknik heyeti, futbolcuları... Kendilerini överken bile Galatasaray kıyası. Kulüp toptan psikolojik yardım almalı, durum vahim 😂 Vizyon 0 👎 #ferdikadioglu https://t.co/0NYt4mTdk8"
1,@Besiktas Allah yar ve yardımcın olsun🦅
-1,@Fenerbahce Ya bu kaçıncı 👊🏻 Artık ne sabrımız kaldı nede sıkacak dişimiz 👎 Bir maçıda diken üstünde seyretmeyelim yeter artık .
-1,Her 3 kişiden 1'i icra şoku yaşıyor
-1,Kablosuz bağlantı kısırlık yapıyor
1,Şerefsizliğin oluk gibi aktığı zamanda iyi ki Galatasaraylıyım iyiki Galatasaray 💛❤️
-1,apartman yöneticileri sizin yaptığınız hataları yapmaz be geri zekalılar... #Grosskreutz @GalatasaraySK
1,"@1907AAG6 @FerroTizziano @kanaryafenernet @Besiktas Jimnastik kulubü olmak utanılacak bişey değil, şikeci diye anılmak utanılacak bişey"
1,Aksam olsa da Galatasaray'ın maçına gitsek gooolll
1,"Ekrem İmamoğlu: ""Kapanma iyi oldu, çok sevindim"""
1,MHP Şanlıurfa il başkanlığı şehitler için iftar dağıttı @Mhpmahmutgunes @MHP_Bilgi @E_SemihYalcin
1,bugün Beşiktaş şampiyon olacak 🦅
1,Motorinde indirim
1,@bayezid_ @mansuryavas06 @Uurcan78050858 Umarım mansur yavaş aday olur o olmazsa Ekrem imamogluna veririm ikisinden biri
-1,"Sütünüzü sileyim Beşiktaş düşmanları, alayınız *** sunuz inadınıza Beşiktaş, #halilumutmeler#mhk senin ananı avradını sileyim şikeci köpek"
1,Kurubaklagiller kan şekerini dengeliyor
-1,"@aDilipak Bu yobaz yandaş diyor ki; Halkı öyle bir perişan ettiniz; hayat pahalılığı, işsizlik o kadar artı, yoksulluk, sefalet öyle boyutta ki buna çare bulmak için salgın hastalık ölümlerini göze alın diyor. Dinci, faşist sağcı yandaş böyledir; ülkeyi batırdığını görür, gözünü yumar."
-1,"@sayhanefe @1905serkan05 bence de:) fener medyası ortalığı karıştırma konusunda başarılı..at ortaya bir yalan konuşsun GS""lılar"
-1,ülkenin düştüğü bu kadar çökmüş vahim durumdan ekonomi yargı sağlık eğitim sanayi spor bilim alanında tek bir kurtuluş vardır o da GAZİ MUSTAFA KEMAL AŞISIDIIRRR.. asla ve asla başka yolu yoktur. haksızlığa hırsızlığa şerefsizliğe baskıya zulme geçit yokkk
1,"@Cml_VtnSvr @Duruinci1967 @Trabzonspor serefsiz tescilli sikeci. hamsi kalmadi, gel sana bi kalkan balu vereyim. azizin oglani!!!"
-1,@Trabzonspor @UEFA @FIFAcom Şikeci fenevin müzesinde şanlı trabzonsporun kupası vardır artik yıllar gecsede fenerliler bunun altında ezilecektir acziyentlerini belli edense bunu inkar etmeleridir az sayidada olsa ts nin 2011 şampiyonu oldgunu kabul eden fbliler takdire şayandır
-1,"Ben kendimi bildim bileli, dövizi zıplatmaya çalışıyor bu felaket tellalı. bugüne kadar ağzından tek olumlu laf çıkmadı memleket için."
1,Kanser ve AIDS'te büyük umut
-1,"Taraftarı bu kafaya soktunuz- @Besiktas  Artık ne desek boş, şimdi gidip kibar kibar kendinizi eğlendirin-HAYAL KIRIKLIĞISINIZ-HEPİNİZ...YAZIKLAR OLSUN👎 @kocadagemre @adnandalgakiran @MesutURGANCILAR Kendi muhabirlerinize kendinizi övdürün ama HAKKIMIZ HELAL DEĞİL @KaynarErol"
-1,"Sağlık sektöründe veri hizmeti sağlayan ABD menşeli IQVIA Holdings'in yayımladığı rapora göre, 2025'e kadar dünya genelinde yeni tip corona virüs aşıları için 157 milyar dolar harcanacak. Sağlık sektöründe veri hizmeti sağlayan ABD menşeli IQVIA Holding…"
-1,@asrintayfasi @kacsaatolduson En pis işlerde bile çalışsa en azından hakkını alır. Bu işsizlikte insanlar pis işlere bile razı ama iş yok.
1,"@leventumit_erol herkes televizyonda, gazetelerde manşet manşet çarşaf çarşaf Rosier ve Ghezzal Galatasaray derken geri adım atmadı. 4 gün öncesine kadar çoğu Beşiktaşlı umudunu kesmişken bile iki oyuncuda Beşiktaş'ta dedi. Ne dediyse oldu. Helal olsun abi, saygıyla... 🦅👏🏻"
1,"Dolar - euro kaç TL? 10 Mayıs Dolar kuru en son ne kadar oldu? Bankalararası piyasada döviz kurlarında son durum. Dolar , haftanın ilk iş günü 10 Mayıs 2021 sabahında 8,23 lira bandının üzerinde yer alıyor. Dolar/TL, spot piyasada 8,2336 lira alış fiyatı, 8,2561 lira satış fiyatıyla el değiştiriyor. Euro /TL ise aynı dakikalarda 10,016 lira alış fiyatı, 10,034 lira satış fiyatı seviyesinde yer alıyor."
-1,TESK Başkanı: İndirimlere inanmayın
1,19 günlük #t***apanma 'nın ardından en sevdiğim arkadaşımı görmüşümdür Devlet Bahçeli Kenan Işık
-1,Ben bu fenev başkanı kadar atıp tutan GS üstünden prim yapan hiç kimseyi görmedim
-1,Gazprom'u ruble vurdu
1,Bize her sevdadan geriye kalan sadece Galatasaray... 💛❤️
1,"@Bay_hamsi @infantino şikeci fenerbahçe'den RÜŞVET alıp, Trabzonspor'un alın terini çaldı.."
-1,Niye bütün arkadaşlarım fenevli ya. Maç günleri yalnızları oynuyorum.
-1,Birleşmiş Milletler'den korkutan uyarı: Ebola tüm dünyaya yayılabilir
-1,Özel sektörün borcu 206 milyar dolara yükseldi
1,"Sonra dedim ki; İyi ki ""GALATASARAY""lıyım be... 💛❤️"
-1,fener ve galatasaray #iyigitmiyor çok net ... #Besiktas tam gaz.....
-1,Özel sektörün döviz borcu arttı
1,Balık yemek depresyonu önlüyor
-1,"Koronavirüs (Kovid-19) salgını ve ekonomik kriz hayat pahalılığını her geçen gün daha da arttırıyor. Yaşanan kriz süs bitkileri yetiştirenleri de olumsuz etkiledi. Antalya daki yetiştiriciler, krizden kaynaklı ürünlere yüzde 200 e varan zamlar yapıldığını aktardı."
-1,Moody's Çin'in görünümünü negatif e indirdi
1,Bizi hep Galatasaray sevdamızdan bildiler
1,"TÜİK'e göre; Türkiye genelinde 15 ve daha yukarı yaştaki kişilerde işsiz sayısı 2021 yılı Mart ayında bir önceki aya göre 59 bin kişi artarak 4 milyon 236 bin kişi oldu. İşsizlik oranı ise 0,1 puanlık azalış ile %13,1 seviyesinde gerçekleşti. #VergiDegilSoygun"
-1,Kızının yaptığı iğneden sonra rahatsızlanan kadın öldü
1,Taner Yıldız: Akaryakıtta vergi indirimini destekleriz
1,Sarıya bakar Lacivert görürüm aşk a bakar Fenerbahçe görürüm
-1,'Göç dalgasıyla unutulan hastalıklar hortladı'
-1,@YolTV Sanki daha önceki bakanlar yargılandı bakanı bırak belediye başkanları bile yargılanmıyor eğer akp liysen 🤔🤔🤔
-1,@Cimbom10linee ozamanlarda bile böle mal bi yönetim yoktur eminim
-1,"Biri bana lütfen şaka desin allah aşkına şimdi bu video'da şikeci, ırkçı, cemaatci ve Trabzonspor düşmanını mı övüyor. Ulan para sen nelere kadîrsin  https://t.co/2I1M9qZBSM"
-1,"@e507 Ülkenin hali kalmış… Bitcoin’e yatırım gibi emeklilik fonları aracılığıyla halk almak zorunda kalıyor…İhracat yapamayan, yapma potansiyeli olmayan şirketlerden uzak durun…"
1,"@taci_kalkavan Heyecandan kusucam ***!! Sabaha kadar içtim, iki saat uyuyup kalkıp temizlik yapmaya başladım. Kireç çözücü ve çamaşır suyu kokteyli bile heyecanımı bastıramıyor!!! Allah’ını seversen yen Beşiktaş’ım!!!!"
1,Metabolizmayı güçlendirmenin 5 yolu
-1,@alpayozalan35 Dünya ucuz dolar bolluğundayken organize sanayilere teşvik ve yatırım yapmaktansa ülkeyi Çin ithalatı çöplüğüne çevirip kobileri ihracatı öldüren Ali Babacanı ülkenin en başarılı ekonomisti diye tanıtıyorlar 😣
1,"Bu videonun dili olsaydı ceketini çıkarıp, kolları sıvayıp şöyle derdi: Yolumuz uzun heyecanımız yüksek gençliğimiz var... Ekrem İmamoğlu sevmeyenler hariç herkese günaydın. Gününüz ve haftanız güzel geçsin. #carsamba #günaydın"
-1,Türkiye sağlık harcamalarında sonuncu
1,@leventumit_erol Abi vallaha helal olsun sana. Tebrik ediyorum. Ama seni uzun zamandır takip ediyorum. Fenerbahçe den Beşiktaş'a hangi ara geçtin sen?
-1,Aracını kendi sokağına park edene 16 bin lira ceza
1,Tansiyondan korunma yolları: Protein ve potasyumca zengin gıdalar
1,"Kupalarımız gelmiş, 4 yıldızımızla ![🏆](https://abs-0.twimg.com/emoji/v2/svg/1f3c6.svg) ![⭐️](https://abs-0.twimg.com/emoji/v2/svg/2b50.svg) ![⭐️](https://abs-0.twimg.com/emoji/v2/svg/2b50.svg) ![⭐️](https://abs-0.twimg.com/emoji/v2/svg/2b50.svg) ![⭐️](https://abs-0.twimg.com/emoji/v2/svg/2b50.svg) @galatasaraysk #şanlı #galatasaray #cimbom #kupa #aslan… https://instagram.com/p/6kPNnPSUFI/"
-1,Akp bütün kötülüklerin anasıdır.. #alkolumedokunma
-1,Bacak bacak üstüne atmak fıtık nedeni
1,Uçuğa iyi gelen 8 yöntem
-1,Bu Galatasaray yönetimi beni sinir ediyor be kardesim
-1,Bu virüs her 10 kadından 8'inde görülüyor!
1,Daha sağlıklı ve doğal bir yaşam için Aloe veranın 9 mucizevi faydası
1,"Sermaye yeterlilik oranı yüzde 23.56 olarak gerçekleşen ING Türkiye, bu dönemde 42.1 milyar TL si nakdî olmak üzere ekonomiye toplam 50.2 milyar TL tutarında kredi büyüklüğü ile kaynak sağladı. Yılın ilk çeyreğini değerlendiren ING Türkiye Genel Müdürü Alper Gökgöz, Pandeminin sağlık, sosyal hayat ve ekonomi alanlarında zorlayıcı etkilerinin küresel ölçekte devam ettiği 2021 yılının ilk çeyreğini geride bırakırken, çalışanlarımızı, müşterilerimizi, paydaşlarımızı sağlıklı ve güvenli tutmak için gerekli tüm adımları atmayı sürdürüyoruz. Bu süreçte, ekonomik anlamda müşterilerimize destek oluyor ve Türkiye ekonomisine katkı sağlamak amacıyla yatırımlarımızı hız kesmeden sürdürüyoruz. ING olarak, finansal sonuçlarımız kadar dijitalleşme yolculuğumuzda da sağlam adımlar atmaya devam ediyoruz. Hedefimiz Türkiye nin lider dijital kurumu olmak ifadelerini kullandı. Canlı Borsa - Altın Fiyatları - Döviz Kurları için Bigpara"
1,Son Dakika! Sağlık Bakanı Fahrettin Koca: Tam kapanma ile vaka sayılarının düşmesini bekliyoruz
1,@KramponSport adam psv macini izledikten sonra gs de 1 sn bile durmam diyerek Beşiktaş'a imza atti helal olsun
1,@gurmant_ Helal olsun
-1,❌ Fenerbahçe stadının zeminine neden kimse sallamıyor acaba‼️ ❌ Eyyam herkesin içine kaçmış 👎
-1,"Tütünümüz vardı, Tütünbank açıldı, Pancarımız vardı, Şekerbank açıldı, Pamuğumuz vardı, Pamukbank açıldı, Madenimiz vardı, Etibank açıldı, Kumaşımız vardı, Sümerbank açıldı. Şimdi ne tütün ne pamuk ne pancar ne maden kaldı. Şimdi ekonomi, işsizlik sorunu nasıl çözülecek?"
-1,"Devlet, iktidarları ve onun siyasetçileri utansın. Halk vergileri müteahhitler yesin diye vermiyor..."
-1,@Averagemanx @falcaobaba72 @Ege4455 @terimizm22 @Kontrasports Hakkımızı aramaya korktuğumuzdan mı herifleri teker teker hapse döküyoruz. De bakayım şikeci sen neredesin. Fenerbahçe bir dava açsa ülke futbolunun düşeceği noktayı görebiliyor musun? Bence erdoğan fb ye teşekkür etmeli. Ayrıca alacağımız çok fazla iyi hesaplanıp...
-1,@Birgl19031 @tgrthabertv @Oguz_Altay @sabriugan @bulentuslu1903 @cemkucuk55 @ofunal @ahmetercanIar @PezekOzan @mtahirkum @kereminan__ besiktas sikeci degil TESCILLI SIKECI UNUTMA  BJK NIN YAPTIGI SIKELERI TESVIKLERI ARABALARI GS RAKIPLERINE VERDIGI TESVIKLERI HERKES BILIYOR AMA SUC DEGILMIS
-1,"ÜLKEMİZİN EN ÖNCELİKLİ SORUNLARI BELLİ; İŞSİZLİK,YOKSULLUK,HAYAT PAHALILIĞI ,ÖZGÜRLÜK... HER GÜN BU SORUNLARLA YAŞAMAYA MAHKUM ETTİLER BİZİ... ARTIK DEĞİŞİM VAKTİ.. DEĞİŞİMLER İÇİN BURADAYIZ. TÜRKİYE ARTIK DEVA’SIZ DEĞİL #EkonomiyeCanAliBabacan"
1,BAT sigara fiyatlarını indirdi
1,@mzyynaldi Kötü 👎 Sonuna kadar FENERBAHÇE 💛 https://t.co/kxwHyGW3Da
1,Hamsiden sevindiren haber
-1,@taylanyildiz Dolar ın 1tl olması çok tehlikeli aslında ithalat çok artar gerekli yapsıal reform olmazsa ve insanlar yurtdışından çok alışveriş yaparsa 3 ay içinde dolar rekor kırar.
1,Sadece Fenerbahçe'yi sevin. Diğerleri sevilecek gibi değil.
1,Dünyadaki milyoner sayısı rekor kırdı
