Target,Stance,Text
Tesla,0," Tesla sahibi, otopilotun çalışmadığını iddia ederek evine çarptı"
Tesla,0, 150 milyon dolar mevduatları var ama dokunamıyorlar... ama 21 milyar dolar nakitleri var lol.
Tesla,-1, ABD'de Tesla'ların sebepsiz yere fren yaptığına dair 750'den fazla şikayet var
Tesla,0, Son cümle doğru değil. Nedenine bağlı. Tıpkı herhangi bir otomobil gibi.
Tesla,0, Tesla'nın sıradan bir otomobil şirketi olduğu giderek daha da netleşiyor
Tesla,0, *Bir* elektrikli otomobil şirketinin kitlesel pazarlamasını yaptı. Elektrikli bir aracı kitlesel olarak üreten ilk kişi o değil.
Tesla,0, Bu oldukça güzel bir egzersiz
Tesla,0, Çünkü Teksas milyarderlerine iyi bakıyor.
Tesla,-1," Başka bir değişken daha ekliyorsunuz. Diğer sürücüleri kontrol edemiyorsunuz, şimdi kendi arabanızın kontrolünün bir kısmından vazgeçiyorsunuz. Arkadaşım telefonunu kullanıyor ve Tesla'sının direksiyonuna bir şemsiye asarak onu dikkatli olduğunu düşünmeye kandırıyor. Yani şimdi geleceğin aptal sürücüleri var."
Tesla,0," Tesla 362.758 aracı geri çağırıyor, tam otonom sürüş beta yazılımının kazalara neden olabileceğini söylüyor"
Tesla,-1, Sahibi Sürüş Sırasında Başka Bir Tesla Direksiyon Simidi Düştü
Tesla,0, Dikkatsiz yayıncı Autopilot kullanarak trafik davuluna çarptı ve Tesla'sının yan tarafına zarar verdi
Tesla,-1, Ankete göre Tesla'nın onay oranı negatif bölgeye düştü
Tesla,0," Tesla bir tepeden aşağı düşer. Dört yolcunun tamamı (iki yetişkin ve iki çocuk) hayatta kalır ve ""orta"" yaralanmaları tedavi etmek için hastaneye kaldırılır.Kaynak:"
Tesla,-1, tek pedal kullanımı nedeniyle kafanız mı karıştı?
Trump,-1," FBI, Trump'ın Mar-a-Lago'daki evinde yapılan aramada 'gizli nükleer belgeler' arıyordu, raporda böyle denildi"
Trump,0, Dikkat çekmek için. Aksini ima etmek için değil. Elbette yalan söyledi.
Trump,-1, Donald Trump bugün FBI tarafından aptallıkla suçlanıyor.
Trump,-1,"Megathread: 6 Ocak Komitesi Donald Trump ve Müttefikleri İçin Cezai Suçlama Yönlendirmelerini DuyurduBugün, muhtemelen son duruşması olacak olan 6 Ocak Komitesi, Donald Trump ve birkaç müttefiki için cezai suçlamaları Adalet Bakanlığı'na yönlendirmeye oy verdi. Komite, bu hafta sonu Kongre Binası'ndaki saldırıya ilişkin soruşturmasıyla ilgili nihai raporunu yayınlayacak. Komite ayrıca, celplerini görmezden gelen birkaç Kongre üyesini Temsilciler Meclisi Etik Komitesi'ne yönlendirmeye oy verdi."
Trump,0," Ölmemiş olsa bile, Kongre görevlerini yerine getirirken söyledikleri her şey için dokunulmazlığa sahiptir (Madde 1, Kısım 6), bu yüzden kendisi hakkında dava açılamaz ve bunu kayda geçiren hiç kimse hakkında da dava açılamaz. En kötü ihtimalle ihraç edilebilirler, ancak kınanmaları daha olasıdır."
Trump,-1," Açıkça öyle, ancak bu ülkede çok fazla insan güçlü bir adam hakkındaki aptalca fikirlerine kapılmış durumda ve beyaz ve Hristiyan olmayan her şeyden korkuyorlar ve olup biteni görmüyorlar."
Trump,-1," Evet. Ve sonra ifade veren avukat ne demek istediğini açıklamak için bunu kayda geçirdi ve yine de ""Bence olan buydu"" dedi."
Trump,0," *Medya tarafından kullanılan bir ifade olan ""Çok Gizli""nin üstündeki bilgiler, Hassas Bölmeli Bilgi (SCI) veya Özel Erişim Programı (SAP) anlamına gelir. Çok Gizli'den daha yüksek bir izin olmadığı için, bu gerçekten ""Çok Gizli"" değildir. SCI bilgileri Gizli veya Çok Gizli olabilir, ancak her iki durumda da yalnızca sınıflandırma düzeyiyle ilişkili olanların ötesinde yayılma üzerinde ek kontrollere sahiptir*"
Trump,0," Beyaz Saray'ın Temsilciler Meclisi'ne teslim ettiği kayıtlar, Trump'ın 6 Ocak'taki telefon görüşmesinde 7 saatlik boşluk olduğunu gösteriyor"
Trump,0," Federal yargıç, Trump'ın 2020 seçim sonuçlarını bozmaya çalışırken Georgia'daki seçmen dolandırıcılığı konusunda yemin altında yalan söylediğini tespit etti"
Trump,-1, Ve Obamacare'i yürürlükten kaldırmaya yönelik muhteşem sağlık planı.
Trump,-1, > “insanlar neden bu kadar kötü?”…”bana karşı?”Kötü huylu narsisizmi gerçekten yakalamak için son kısmı da eklemelisiniz.
Trump,-1, Destekçileri paralarını ödeyecek ve sonra ekonomik kaygılardan şikayet edecekler lol
Trump,1," Bazı insanların seçim sonuçlarından sonra Georgia'daki yetkililerden birini aradığında bunu çoktan unuttuğunu hissediyorum. Kaydedilen konuşmada, onlardan ""daha fazla oy için oy taramalarını"" veya kendi lehine oy bulmaya çalışmalarını açıkça istediği söyleniyordu. Bunun onun sonu olmadığını (bir milyon diğer yürümeye başlayan çocuk gibi davranışın yanı sıra) asla anlayamayacağım."
Trump,0," Cheney, 6 Ocak komitesinin Adalet Bakanlığı'na Trump'ın tanıklarından birini etkilemeye çalıştığını bildirdiğini söyledi"
Trump,-1," Trump yanlısı grup, seçmenleri ""korkutmak"" için Colorado'da silahlı üyeleri kapı kapı dolaştırdı: Dava | Dava, Mike Lindell ile bağlantılı Colorado grubunu Ku Klux Klan Yasası'nı ve oy kullanma hakları yasalarını ihlal etmekle suçluyor"
Trump,1, Muhtemelen Trump'ın görevdeyken işçi sınıfı için yaptığı en büyük şey.
Trump,0," Bunun sebebi, antisemitizm duygularını körüklemek ve dünyayı gizli bir Yahudi komplosunun kontrol ettiği söylemini yaymaktır."
Trump,0," Megathread: FBI'ın Pazartesi Günü Mar-a-Lago'da Gerçekleştirdiği Baskında Gizli Belgeler Keşfettiği BildiriliyorAyrıntılar hala birikmekte ve doğrulanmakta olsa da, FBI'ın bu hafta başında eski başkan Trump'ın Florida'daki evinde düzenlediği baskında gizli belgeler keşfedildiği bildiriliyor.---##İlginizi çekebilecek gönderiler GÖNDERİM | ALAN ADI---|----[FBI'ın Donald Trump'ın Mar-a-Lago'daki mülkü için çıkardığı arama emrini okuyun]("
Trump,-1, Sosyal medyadan uzaklaştırılması için hızla hapse atılması gereken bir noktaya geldi.
Trump,0," Twitter, küresel olarak açık ara en küçük sosyal platformlardan biridir. Reddit'i zar zor geride bırakıyor. Biz burada uçlardayız. Facebook/Instagram/Meta ürünleri ve yurtdışındaki başlıca rakipleri, kullanıcı ve veri akışında pazar payının ezici çoğunluğunu elinde tutuyor."
Trump,0," >Hayır. Yeniden Yapılanma'da başlıyor. CSA'yı kelimenin tam anlamıyla 0 ceza ile geri aldık. Ceza bile değil. Milyonlarca eğitimsiz, nesiller boyu travmatize olmuş siyah vatandaşın sorununu çözmelerini asla sağlamadık. Jim Crow yasalarını milyonlarca insanın kuzeye kaçmasına neden olacak kadar sürdürmelerine izin verdik. Bu, evsiz insanlara başka bir eyalete otobüs bileti vermekle eşdeğerdi."
Trump,-1," SON DAKİKA: Donald Trump, The Washington Post'un haberine göre Adalet Bakanlığı tarafından resmen CEZAİ SORUŞTURMA altında."
Trump,-1, Bir eliyle tweet atarken diğer eliyle de devlet belgelerini çöpe atıyor.
Trump,0," Tamam dostlar, hadi yapalım şunu."
Trump,0," Trump'ın nihayetinde yürütme ayrıcalığı iddiasında galip geleceğine inanıp inanmamanız, soru pek de çözülmüş değil. Dahası, avukat-müvekkil ayrıcalığı ve belgelerin veya öğelerin delil değeri olup olmadığıyla ilgili sorular da söz konusu. Mahkeme bu konulardan hiçbirine ilişkin bir karar vermedi. Özel bir ustanın atanması kararı, belgeler Adalet Bakanlığı'na geri gönderilmeden önce bu tür soruların ele alınmasına izin vermek için sadece bir adım. Bu arada, güvenlik endişeleri nedeniyle hala incelenebilirler. Bazılarının düşündüğü kadar uğursuz bir durum değil."
Trump,0," ""Hatırlamıyorum."""
Trump,0, Sadece Fransa'nın belirli bir bölgesinden geliyorsa kampanyadır
Trump,0," Temyiz mahkemesi, Temsilciler Meclisi'nin Trump'ın vergilerini IRS'den alabileceğini söylüyor"
Trump,0,"Biden, Trump'ın ""başka tarafa bakması""nın ardından ""maliyetleri artıran"" ve öğrenci borçlarının artmasına neden olan üniversitelere karşı harekete geçeceğine söz verdi"
Trump,-1," O kadar büyük bir kaybeden olduğu söyleniyor ki, 80 milyon kişi ona ""Kovuldun!"" demiş."
Trump,-1," Trump'ın Casusluk Yasası'nı ihlal etme olasılığı nedeniyle soruşturma altında olduğu, arama emriyle ortaya çıktı"
Trump,0," Enron çökmeden önce Time dergisinde veya bir yerde, ne kadar hızlı büyüdükleri ve filan filan filan hakkında bir şeyler okuduğumu hatırlıyorum. Ama Enron'un aslında ne *yaptığını* hiç söylememişti. Çok karanlık görünüyordu ve ben o zamanlar 16 yaşındaydım."
Trump,0," Grant hiçbir zaman mahkemeye çıkmadı ve hakkında dava açılmadı, bu yüzden de hiçbir zaman mahkûm edilmedi."
Trump,1," Kasırga siyah işaretleyici olayı gibi. Ve liberallere ""hassas kar taneleri"" diyorlar."
Trump,-1," Ne kadar üzücü olsa da Nixon, Trump ve onun Cumhuriyetçi yandaşları kadar yozlaşmış değil"
Trump,-1," Umarım bu uç gruplara, bu konuda şaka yapmak isterlerse onları devirmeye hazır daha fazla ajan yerleştirilmiştir."
Trump,0," Obama'nın göreve başlama töreninde daha büyük bir kalabalığın olması beni hâlâ üzüyor ve kendisinin kendisinden daha popüler olduğuna ama ""doğru"" insanlar arasında olduğuna kendini inandırmaya çalışıyor."
Trump,0," Trump, geçen yıl danışmanlarına, 2016 seçim kampanyasının Rusya ile olan bağlantılarına ilişkin FBI soruşturmasına ilişkin 'hassas' belgeler karşılığında Mar-a-Lago dosyalarını iade edeceğini söylemişti: NYT"
Trump,0," Eski Başkan Donald Trump, Beşinci Değişiklik haklarını öne sürüyor ve New York Başsavcısının sorularını yanıtlamayı reddediyor"
Trump,-1," Onun başkanlığı da benim için öyleydi, her gün bir kez daha hayrete düşüyordum."
Trump,-1, Aslında buna inanabilirdim. Trump muhtemelen gününü ya golf oynayarak ya da televizyon izleyerek geçirdi.
Trump,1, Yakın zamanda bir mitingde vergi beyannamelerini çoktan verdiğini söyledi. Yani sanırım sadece proaktif bir şekilde konuşuyordu?
Trump,-1," Geçen yıl da aynısını Omaha, NE'de yapıyorlardı"
Trump,0, Komşum bugün koz tabelasını indirdi
Trump,0," Pelosi, Trump'ın 6 Ocak soruşturmasında ifade verecek kadar 'erkek' olmadığını söyledi"
Trump,0," Megathread: FBI, Eski Başkan Donald Trump'ın Florida'daki Evini AradıEski Başkan Donald J. Trump, Pazartesi günü FB'nin"
Trump,-1," İşte bunun iğrenç kısmı bu. Toplumun, suçların yalnızca örtbas edilmeye çalışıldığında işlendiğine dair bir fikri var. Birçok insan, utanmadan, herkesin gözü önünde gerçekleşen şeylerin yasadışı olmaması gerektiğini düşünüyor, değil mi? Komik olan şey, Trump'ın 5. Cadde'ye gidip birini vurabileceğini ve yine de insanların desteğini alabileceğini söylemesi, suçlarını herkesin gözü önünde işlediği için daha doğru görünüyor. Çünkü herkesi bu tür şeyleri yapmanın toplumsal olarak kabul edilebilir olduğuna ikna etti."
Trump,0," Trump yanlısı FBI protestosu, tek bir göstericinin bile katılmaması nedeniyle iptal edildi"
Trump,-1," Trump, onu dava edecek cesareti bulamadan yaşlılıktan ölecek"
Trump,0," Evet, ilginç olan şey, ne söylediğini ne kadar berrak ve açık bir şekilde konuştuğu/yorumladığı, saçma sapan veya tekrarlayıcı değil, normal bir insan gibi. Kendini sunma biçiminin açıkça analitik olması ve küçük ayrıntıları hemen yakalaması. Bu, tüm kişiliğinin ne kadar hesaplı ve yapılandırılmış olduğunu gerçekten gösteriyor."
Trump,0," Eski Rand Paul yardımcısı, Rus parasını Trump kampanyasına yasadışı yollardan aktarmaktan suçlu bulundu"
Trump,0," Trump, 6 Ocak'ta Kongre'ye gidemeyeceği söylendiğinde öfkeyle Gizli Servis ajanına saldırdı, yardımcısı ifade verdi"
Trump,-1," \^ bu sabitlenmeli. burada %110 haklısın. bu hareketin gerçekten devam etmesinin kışkırtılmasına tanık oluyoruz. asla ölmedi, beyaz üstünlükçüler, Alex Jones tipleri, McVeigh tipi milisler, yeminliler gibi farklı gruplara bölündü, devam ediyor. artık onları sadece Idaho gibi aşırı kırsal alanlarda değil, daha fazla görüyoruz."
Trump,-1," Trump'ın kendisini en ufak bir şekilde olumsuz gösteren hiçbir şeyi onaylaması mümkün değil. Bu yüzden tüm Trump Kartları onu altı paket karın kaslarıyla fiziksel olarak formda gösteriyor. Kadınların arzuladığı ve erkeklerin putlaştırdığı erkeksi, seksi bir adam olarak görülmek istiyor. Hatta kilolu, iğrenç yaşlı bir adam olması gerçeği bile onun için katlanılması zor bir olumsuzluk."
Trump,-1,"Demokratlar, NBC News'in tahminlerine göre Senato'daki kontrolü elinde tutuyor ve Trump destekli birçok Cumhuriyetçiyi mağlup ediyor"
Trump,-1," Bu doğru olabilir, ama ayrıca, *ünlü* bir şekilde hiçbir şeyin parasını ödemez. Restoranlardaki hesabı ödemez, mitingleri için kiraladığı mekanların parasını ödemez, avukatlarına ödeme yapmaz... herhangi birinin bu cezaları ödeyeceğini düşünmesi için ne gibi bir sebep olabilir ki?"
Trump,0," Michael Cohen, Trump'ın son derece gizli belgelerin kopyalarını çocuklarının evlerinde, Bedminster'da ve Trump Tower'da sakladığına inanıyor"
Trump,0," Trump, Sahte Dava Nedeniyle Hillary Clinton'a 171.631 Dolarlık Avukatlık Ücreti Ödemek Zorunda"
Trump,-1," Ah, bu beni iyi hissettirdi! Okuduğun için mutluyum. Oldukça tarafsız olduğunu düşündüm, hatta Fauci'nin zaman zaman yanlış kararlar verdiğini bile kabul ettim. Her şeyin nasıl ortaya çıktığını okuyunca, işler daha iyi yapılsaydı kaç kişinin hala hayatta olacağını düşünmeden edemedim. Öfkelendirici ve bir salgının, liderlik açısından başa çıkmak için en yetersiz donanımlı olduğumuz zamanda bizi nasıl vurduğu gerçekten iç karartıcı."
Trump,0, Trump'ın Ohio'daki mitinginde gerçek bir çöp yangını var. [OC]
Trump,0,"Tulsa'daki bir grup lise öğrencisi, Trump'ın mitingine gizlice girip bu fotoğrafı çektirmek için dersten kaçtılar ve hemen dışarı çıkarıldılar."
Trump,-1, Peki ne zaman bir sonuçla karşılaşacak? Yasaları çiğnemeye devam etse daha iyi.
Trump,0, Trump'ın Mar-a-Lago'da 300'den Fazla Gizli Belgesi Vardı
Trump,-1, 6 Ocak komite üyeleri Trump'ın isyandan sorumlu olduğuna inandıklarını ve panelin oybirliğiyle onu kovuşturma için sevk edebileceğini söyledi
Trump,0," Yüksek Mahkeme, Trump'ın Mar-a-Lago baskın belgeleri davasında kararı bozma teklifini reddetti"
Trump,-1," Trump, FBI'a yönelik şiddetten sorumlu tutulduğu için 'korkunç şeyler olacağı' konusunda uyardı"
Trump,0," Yüksek Mahkeme, Trump'ın vergi kayıtlarının Temsilciler Meclisi Demokratlarına açıklanmasına izin verdi"
Trump,0," Hiç kimsenin okul öncesinden üniversiteye kadar herhangi bir seviyede eğitim için ödeme yapması gerektiğini düşünmüyorum. Herkesin çok küçük ve uygun bir ücret ödediği Avrupa'da bir derece aldım, çoğu Amerikan okulunda ders kitapları için ödeyeceğiniz ücret kadar. Evet, zenginseniz özel bir ücret talep edebilirler sanırım, ancak bunu herhangi bir mal/hizmet için söyleyebilirsiniz. Bence 43 milyar dolar, tüm eyaletlerin GSYİH'sinden daha fazla olan bir okul, öğrencilerden hiçbir şey talep etmek zorunda değil. Daha genel olarak, insanların eğitim almak için ödeme yapmaması gerektiğini düşünüyorum (vergi ödemek dışında, ki bu zenginler için daha fazla olmalı)."
Trump,-1, Soyadım Borst. Bu pislikten daha iyisini bulabiliriz.
Trump,1," 2 yıl önce bugün Rudy Giuliani, Trump adına Four Seasons Total Landscaping'de bir basın toplantısı düzenledi"
Trump,0," Evet, zaten yapılıyor."
Trump,-1, Bir Trilyon dolarlık PPP'nin gitmesine izin verdi. Sanırım bir Milyar rüşvet istiyordu.
Trump,0, covfefe
Trump,0," Öfkeli Berserker, 6 Ocak olayları sırasında Donald Trump'ı haykırıyor."
Trump,0, Temsilciler Meclisi komitesi Donald Trump'ın IRS'den gelen federal vergi beyannamelerini aldı
Trump,-1," ""Bu dosya tam bir saçmalık. YEET!"""
Trump,1, aynı zamanda ABD'nin amiral gemisi ittifakıdır. Kendi askeri ittifakınızı yabancılaştırmanın ne kadar tehlikeli olduğunu fark etmek için askeriyenin hayranı olmanıza gerek yok.
Trump,-1," ""Gizleyecek hiçbir şeyi yok, ancak mümkün olan her şeyi hiçbir açıklama yapmadan saklaması tamamen anlaşılabilir"" Muhafazakar mantık doğrulandı"
Trump,0, Doğrulayabilirim. Bir arkadaşım Iowa Polis Departmanı'nda ve şu anda FBI'a karşı aşırı bir antipatisi var.
Trump,-1," Tüm iş planı yasaları çiğnemek ve unutulmaya doğru itiraz etmektir. Yasalar, sonsuz itirazlar için ödeme yapabildiğinizde geçerli olmaz."
Trump,0," Yüksek Mahkeme, Trump'ın vergi kayıtlarının Kongre'ye verilmesini geçici olarak engelledi"
Trump,-1," Donald Trump ifade sırasında ""tekrarlanan yalanlar söylerken yakalandı"" - avukat"
Trump,-1, İçimden bir ses Trump'ın her şeyden sıyrılacağından endişe ediyor
Trump,0, Podyumlardan bahsetmişken... o adam sadece 75 gün hapis cezası aldı. Florida'da yaşıyor olmasına rağmen... bunu yattığı süre olarak sayıp saymadıklarından emin değilim.
Trump,0, Başkan olduğunda hükümetin parasını kullanarak şirketlerini finanse ederek büyük bir servet elde etti.
Trump,-1," Burada Şeytanın avukatlığını yapacağım. Adalet Bakanlığı ve FBI her gün Trump tarikatına bakıyor. Şiddet için yalvarıyorlar ve inançları için savaşmaya ve ölmeye istekli olduklarını giderek daha fazla gösteriyorlar. Bunun sonuçları sarsıcı olacak. Sadece FBI'a karşı olmayacak. Siz veya ben hedef olabiliriz. Bunun için tarihsel bir emsal yok. Tetiği çektiklerinde, her şey hemen değişecek. Çok şey tehlikede ve bunun büyük bir tarihsel olay olacağını bilerek, bunu mümkün olan her şekilde önlemek için çaresizce çabalamak ve sonunda taahhütte bulunmanız gerektiğinde uygulamada mükemmel olduğunuzdan emin olmak isteyeceksiniz."
Trump,0, Bizi kendilerine eşit görmüyorlar.
Trump,0," Belki Yale öğrencilerinin sadece yarısı mali yardım alıyor, ancak öğrencilerinin %45'i gelir elde eden ailelerin en üst %5'inden geliyor. Bir öğrencinin ailesinin ortalama geliri her yıl 192 bin doların üzerinde. Ciddi olarak, Yale'in maliyetinin ülkemizin akademik kurumlarında yapılması gereken değişikliklerden bahsederken temelde hiçbir önemi yok."
Trump,1," Bunu kayınpederime (ömür boyu Cumhuriyetçi, 2016'da sadece R olmayan oyu Hillary'yeydi) Trump'ın Queens'te sahip olduğu bazı apartman binalarının güvenlik sözleşmesinde denedi. Kayınpederim ve ortağı güvenlik danışmanlarıydı, güvenlik sistemlerini, sensörleri, kameraları, personeli tasarladılar, her şeyi kurdular... ve Trump ödemeyi reddetti. Dava açacak paraları olmayacağını düşündü ve haklıydı. Trump'ın anlamadığı şey, ikisinin de omuzlarında bir yük olan sert adamlar olmasıydı, bu yüzden kameraları, kilit sensörlerini vb. tamamen söktüler... Trump pes edip çeki kesmeden önce belki bir saat geçmişti."
Trump,-1, Hatta tüm suçu BLM ve ANTİFA'ya yüklemek konusunda tartıştıklarını bile açıkladı. Yalanlarının tamamı ortada ve Cumhuriyetçi destekçileri sadece onların var olmadığını iddia etmeyi seçiyor.
Trump,-1," İşte daha iyisi. Ailem Trump'a takıntılı. Seçildiğinde tam 180 derece döndüler. Savaş gazisi olarak onlarla neler olup bittiği hakkında konuşmaya çalışmak artık vaktime değmez. Fox bunu biliyordu, Biden bunu suçluyordu, Trump bunu yapardı...... ne oluyor lan..."
