Target,Stance,Text
Biden,1, Biden milyarderlere %25 vergi teklif edecek
Biden,1," Biden, Zelenskiy'i Beyaz Saray'da ağırlıyor."
Biden,0, Bağlıdır. Varlık vergisi gerçek bir anlaşma olurdu.
Biden,1, Bazı insanlar politik dünyada olup bitenlerden habersiz. Ben öyleydim. Ve bundan daha mutluydum. Trump her şeyi o kadar kötü yaptı ki uyanıp bilgi edinmek zorunda kaldım. Hala ona kızgınım çünkü asla mutlu cahilliğime geri dönemem. Birçok insanın da benzer şekilde uyanması gerekiyor.
Biden,1, Fren yok mu? Ya artık hiçbir şey kutsal değil mi? Kirli oynamak mı istiyorlar? Onlara aynısını yapın. Fox ve diğer muhafazakar medyanın yayından kaldırılmasının yollarını bulalım. Politikacılarının hilelerini ve başarısızlıklarını seçmenlerin yüzüne vurmanın yollarını bulalım. Dedektifler bulup kişisel işlerini ve çevrimiçi yorumlarını araştırsın ve onları sürekli PR saldırısı altında tutsun. Bu iyi saçmalığa son vermenin zamanı geldi.
Biden,0,"Biden, Oy Vermedikleri Programdan Para Dilenen 'Sosyalist Cumhuriyetçileri' Eleştiriyor"
Biden,1," Biden, çoğu borçlunun 10.000 dolarlık federal öğrenci kredisi borcunu iptal etti"
Biden,0, Hala yapıyorsun. Bizim kazanmamızı istemiyor musun?
Biden,1," Biden, Kongre'yi Roe v. Wade'i yasalaştırmaya çağırıyor"
Biden,0, Belki arada bir ön seçimde oy verin. Bu bir şeyi değiştirir.
Biden,0," Evet, birçok insan başkanın mutlak yetkiye sahip olmadığını anlamıyor gibi görünüyor."
Biden,0," Faşistleri ırklar ve cinsiyetler gibi korunan bir sınıf haline getirmeye ne kadar zaman kala merak ediyorum. Bu korkunç ayrımcılık, modanın yüzü"
Biden,1, Borç iptalinin sadece manşetlere çıktığını ve IBR reformunun planın gerçek özü olduğunu düşünüyorum. Bunu GERÇEKTEN vurgulamaları gerekiyor çünkü bu muhtemelen bir nesildir öğrenci kredilerine yönelik en büyük reform.
Biden,0," Wisconsin'in şu anda tüm mor eyaletlerde olan aynı sorunu var: şehirler çoğunlukla liberal ve kırsal alanlar Trumpland. Seçim sonuçları bu gruplardan hangisinin ortaya çıkacağına bağlı. 2018'de Madison ve Milwaukee'deki yüksek katılım, Evers'a zaferini kazandıran şeydi."
Biden,0," Yazık, evet, çünkü o tam da ABD'nin ihtiyacı olan şey. Arkasında sağlam bir ekip olsaydı harika şeyler olurdu."
Biden,1," > Aslında, o Wall Street adamlarına ""hiçbir şey temelde değişmeyecek"" dediğinde, Biden'ın onları kandırdığını düşünüyorum. Bu alıntının bağlamı eksik. Onlara, vergilerini artıracağını ve hayatlarını temelden değiştirmeden daha fazla ödeme yapabileceklerini söylüyordu. Temel olarak, ""daha fazla vergi ödeyebilirsiniz ve hayatınızda temelde hiçbir şey değişmeyecek""ti."
Biden,0, Gerçekten kelimelerinle resim çiziyorsun ve bundan çok keyif alıyorum lol.
Biden,0,Anket: Amerikalıların Çoğu Biden veya Trump'ın Tekrar Aday Olmasını İstemiyor
Biden,1," Cumhuriyetçiler, yoksul insanları umursamadıklarını defalarca gösterdiler. Bu yüzden, benim ifademi nasıl bu kadar çabuk bir şekilde hayır diyerek çöpe attığınızı anlamıyorum."
Biden,0, Sadece ben olmadığıma sevindim. Belki de İngiltere'deyken erişmeye çalıştığım için olduğunu düşündüm. Bir süredir oturum açmadım ve birkaç aydır buradayım.
Biden,1, Evet yapabilirler
Biden,0, Zenginlere uygulanan yüksek vergilerden şikayet eden bir grup köylü karavanda bekliyor.
Biden,1, Adı Army One olurdu
Biden,1," > Beyaz Saray planı, milyarderlerin tam gelirleri üzerinden veya geleneksel ücret geliri biçimleri ile hisse senedi fiyatlarının yükselmesi gibi gerçekleşmemiş kazançlardan elde ettikleri gelirin birleşimi üzerinden en az yüzde 20 oranında vergi ödemelerini zorunlu kılacaktır. Wapo makalesinden"
Biden,0," Tamam, bu gifin başkan olması gerçekten hoşuma gitti"
Biden,0," Yazık ki seçmenler Demokratları 17 ayda her şeyi güllük gülistanlık yapmadıkları için cezalandırmaya kararlılar. Asıl ironi şu ki, bu seçmenler Cumhuriyetçileri iktidara getirdiğinde düzeltmek istedikleri şeyin düzelme şansı yok."
Biden,1," Hayır. İşte fark burada. Biri kendi yollarını diğerine dayatmaya çalışıyor. Biri sadece o grubun kendi yollarını kendilerine dayatmasını engellemeye çalışıyor. Basitçe söylemek gerekirse; biri saldırgan, diğeri savunmacı. > Farklı ahlaki değerlere sahip iki grup insan için ortak bir yasa her zaman bir tarafın kendi değerlerini diğerine dayatması anlamına gelir. Hayır! Eğer olan tek şey kısıtlamaların kaldırılmasıysa hayır."
Biden,0," Biden, tüm ABD çalışanlarına ücretli ebeveyn izni verilmesi için bir kez daha baskı yapıyor ve çocuklarının da ücretsiz evrensel okul öncesi eğitimden yararlanmasını istiyor"
Biden,0," > Anladığım kadarıyla bu, Uygun Fiyatlı Bakım Yasası kapsamındaki kürtaj hapı, doğum kontrolü ve rahim içi araç erişimini de kapsayacak şekilde koruma kapsamını genişletecek. Bir dakika, yani bunlar daha önce kapsam dahilinde değil miydi?"
Biden,1,"Biden, ""NATO topraklarının tam anlamıyla her bir santimini savunacağına"" yemin ediyor. ""5. Madde kutsal bir taahhüttür."""
Biden,0," Homelander oldukça zeki ve karizmatik, diğer adam sağduyuyla boğuşuyor gibi görünüyor"
Biden,-1, Her demokratın insanlara bunu sürekli hatırlatmaya çalışmaması gerçekten çılgınca
Biden,0, Genç yetişkinler üniversitede olsun ya da olmasın kira ve yiyecek masraflarını ödemek zorunda kalacaklar. Bunu dahil etmek aptalca ve yanıltıcı.
Biden,1, Böylece onları asıl meseleden uzaklaştırıyorlar.
Biden,0," Belki Yale öğrencilerinin sadece yarısı mali yardım alıyor, ancak öğrencilerinin %45'i gelir elde eden ailelerin en üst %5'inden geliyor. Bir öğrencinin ailesinin ortalama geliri her yıl 192 bin doların üzerinde. Ciddi olarak, Yale'in maliyetinin ülkemizin akademik kurumlarında yapılması gereken değişikliklerden bahsederken temelde hiçbir önemi yok."
Biden,1, Kavanaugh'un borcunu kimin ödediğini bilmek istiyorum.
Biden,0," Yüksek Mahkeme, Biden'ın öğrenci borcu affı programını engelleme talebini reddetti"
Biden,1," >Elbette bu boktan bir seçenek, ancak oy vermemek yalnızca Cumhuriyetçilerin seçimi kazanmasını sağlayacak. İşte bu yüzden muhafazakarlar, r/aoc alt başlığı ve r/LateStageCapitalism alt başlığında Biden ve Pelosi'nin gerçek sorunlar olduğu yönündeki saçmalıkların çoğunun oylanmasına yardımcı oluyor (ve Biden'ın şu ana kadarki başarılarını paylaşmaya asla cesaret edemiyorlar çünkü bunlar aslında çok etkileyici)."
Biden,0," Koşu ayakkabıları...terleme atölyelerinin yanı sıra ucuz olmayı örtbas etmek için pazarlamayı kullanma teşviki de var.Bulaşık makineleri onları etkisiz kılan berbat bir sabun dağıtım sistemini teşvik ediyor. Bu, su verimliliği standartlarından sorumlu tutuluyor.Video oyunları: çıtırtı, canlı servis saçmalığı, çeyrek kazanmak için işten çıkarmalar."
Biden,0," Bu. Rusya'nın NATO'dan korkması gereken şey, NATO'nun Rusya'dan korkmasından çok daha fazla. Rusya nükleer olsa bile, NATO onları konvansiyonel silahlar kullanarak yenebilir. Soğuk Savaş'ın sona ermesinden bu yana çok şey değişti."
Biden,-1," Bu yasalar büyük ihtimalle anayasaya aykırıdır. Obergefell v Hodges davası devam ettiği sürece (ki bu garanti değil) tüm eyaletler eşcinsel çiftlere evlilik ruhsatı vermek zorunda. Eğer bozulursa, bu yasalara çeşitli düzeylerde itiraz etmek mümkün olacaktır. Temel olarak eyalet sınırlarını aşan her şeyi kapsayan eyaletler arası ticaret, federal hükümetin sıkı kontrolü altındadır. İnsanları eyaletlerinden ayrıldıkları için cezalandıracak eyaletler neredeyse kesinlikle federal yasayı aşmaktadır. İnsanları kendi eyaletinizle sınırlayamazsınız veya başka bir eyalette ""suç"" işlemiş birini yargılayamazsınız. Elbette bunların hepsi Yüksek Mahkeme'nin bunlarla *ilgilendiğini* varsayarsak, ki bu hala bir yazı tura. Bu tür emsalleri aktif olarak geçersiz kılmak çok olası görünmüyor. Cesurlar ve anayasaya uygunluğu pek umursamıyorlar. Ancak Sivil Haklar Yasası'nı aktif olarak bozacak kadar cesur olduklarını düşünmüyorum. Tanrıçalar, umarım bu konuda haklıyımdır"
Biden,0," Başkan Biden: ""Bankalardaki yatırımcılar korunmayacak. Bilerek bir risk aldılar ve risk karşılığını vermediğinde yatırımcılar paralarını kaybettiler. Kapitalizm böyle işler."""
Biden,1," Biden, Enflasyon Azaltma Yasası'nı imzalayarak asgari %15 kurumlar vergisi oranı belirledi"
Biden,1," Biden, Trump'ın ""başka tarafa bakması""nın ardından ""maliyetleri artıran"" ve öğrenci borçlarının artmasına neden olan üniversitelere karşı harekete geçeceğine söz verdi"
Biden,1," Biden, ara seçimlere 2 ay kala nadir görülen bir televizyon programında 'MAGA Cumhuriyetçileri'ni sert bir dille eleştirdi: 'Amerika'da siyasi şiddete yer yok'"
Biden,0, peki bu adam neden hapiste değil?
Biden,1," Biden, öğrenci kredisi affının adil olmadığı yönündeki eleştirileri reddediyor ve yalnızca milyarlarca dolarlık işletme sahiplerinin vergi indirimi almasının adil olup olmadığını soruyor"
Biden,1," Haklısın. Halkın iradesi kesinlikle burada yansıtılıyor, insanların çoğunluğu, haklarını istedikleri zaman ellerinden alabilen altı cübbeli ihtiyarlar tarafından yönetilmeyi seviyor."
Biden,0," Ayrıca ""daha akıllıca çalış, daha çok çalışma""nın da başlıca bir örneği. Kuzey Kore'ye tam anlamıyla gidip, alabildikleri her sağlıklı insanı askeri eğitime dahil etmek, bulabildikleri her yere sığınaklar inşa etmek vb. yerine, kendilerini yüksek teknolojili yeteneklere kaptırdılar. Onları dünya genelinde vazgeçilmez kılmak, yalnızca güvenliklerini garanti altına almaya yardımcı olmakla kalmadı, aynı zamanda halklarının yaşam kalitesini de oldukça iyi hale getirdi. Machiavelli, onların becerikli oyununa gülüyor olurdu."
Biden,1, Biden iyi bir hafta geçiriyor
Biden,-1," Suudi hükümetini suçlayamayacağınız fikri, hükümetlerinin kelimenin tam anlamıyla çılgınca zengin insanlardan oluşan bir aile olduğu düşünüldüğünde çılgınca. Ayrıca, eğer Afganistan'ı bu yüzden işgal ettiysek, o zaman neden bin Ladin'i on yıldır barındıran Pakistan'ı işgal etmedik? Sadece onları cezalandırmak için mi? Deli olduğumuz için ülkeyi mahvedelim mi?"
Biden,1," Vay canına, gelir odaklı geri ödemeleri yeniden düzenlediler. Böylece faiziniz bakiyenizi artırmaya devam etmeyecek."
Biden,1," Başkan Joe Biden, milyarderler için yeni %20 asgari vergi teklifinde bulunacak"
Biden,0," Bu, rutubet ruhunu ele geçirmeden önceydi."
Biden,1," Sağlam aday. Düzenleme: Bu konu ilgi gördüğünden, bunun ücretli bir destek OLMADIĞINI açıkça belirtmek istiyorum."
Biden,1," Biden'ın konuşması işe yaradı: 10 Amerikalıdan yaklaşık 6'sı MAGA'nın demokrasi için bir tehdit olduğunu kabul ediyor. Biden'ın konuşmasının ters tepeceği yönündeki uyarılara rağmen, harekete geçirici bir etkisi oldu ve insanların uyanmasına yardımcı oluyor"
Biden,0," Ankete göre, yüzde 71'i Biden'ın yeniden aday olmasını istemiyor"
Biden,1," Arayıp sormakta bir sakınca yok. Ben şahsen, covid dönemi ödemelerimin iadesini talep etmek için aramadan önce bu öğleden sonraki basın toplantısını bekliyorum."
Biden,0," Biden, Yüksek Mahkeme'nin Roe v. Wade kararını bozması halinde eşcinsel evliliğin bir sonraki adım olacağını öngörüyor"
Biden,1, Ama bunun birçok sorunu çözeceğini düşünüyorum!!
Biden,0, Aman Tanrım! Bir terör saldırısı daha! Yine 20 yıl boyunca günde 200 milyon dolar harcamanın zamanı geldi! murica!!
Biden,0," Hayır, hayır - Saddam'dı. Bush-the-lesser'ın babasını öldürmeye çalıştı! Yani, kitle imha silahları vardı! Yani, 11 Eylül'de bize saldırdı! Yani, El Kaide ile ideolojik bir bağı vardı! Yani... Evet, doğru, Suudiler 11 Eylül'de bizi arkadan bıçakladı. Ama kimse bundan bahsetmiyor."
Bitcoin,-1,"Eyleme çağrı: Kripto paranın hariç tutulacağı ve CBDC'lerin yerini alması için yolun açılacağı şekilde, parayı yeniden tanımlayacak yasa tasarıları şu anda ÇOK SAYIDA eyalette komiteden aceleyle geçiriliyor. CBDC'ler yeterince kötü, ancak Kripto geçerli bir para biçimi olarak izin verilmezse, işimiz biterBaşlığım GME için ne anlama geliyor?Yasa tasarısındaki ifadeler (aşağıda) ANLAMI - hükümet CBDC'yi başlattıktan sonra, diğer tüm kripto biçimleri YASAKLANIR, vb. Ayrıca NFT pazar yeri, kendi bankanız olun, vb. anlamına gelir."
Bitcoin,0," Bitcoin, 1.000 puanlık Dow düzeltmesinin 2020'den bu yana en kötü işlem günü olmasıyla 35.5 bin dolara düştü"
Bitcoin,1," Düzenlenmiş piyasalar, kuralları çiğneyen, onu sömüren ve bu süreçte milyonlarca hayatı mahveden açgözlü aptallardan korunan bir piyasayla sonuçlanmaz. Düzenlenmiş piyasa, oyunu düzeltmek, onu büyük erkekler kulübü yapmak ve bundan yalnızca birkaç kişi faydalanabilmek için kullanılan bir tabirdir. Düzenleme, 2000 çöküşünü, 2008 çöküşünü durdurmadı ve 2023 çöküşünü de durdurmayacak. Elon'un hisse senetlerini shitcoin kadar pompalamasını ve satmasını ve piyasa manipülasyonu için kendisine cüzi paralar veren SEC'in yüzüne sıçmasını engellemedi. Piyasa yapıcıların birkaç yıl önce satın alma düğmesini öldürmesini engellemedi. Tek bir hedge fon yöneticisi veya üst düzey bankacı fakirlerden çaldığı için hapse girdiğinde düzenlenmiş paradan bahset bana. Ama bu saçmalık, dünya hiçbir zaman önemli olan hiçbir şey konusunda anlaşmadı, Metuşelah'ın kavrayamadığı bir şeyle nasıl başa çıkacaklarını anlatmaya çalışmasını kim dinler ki."
Bitcoin,0, Cali'de hala altın bulduklarını bilmiyordum. 9 Mart'ta aksini söyleyen bir makale buldum.
Bitcoin,0, Kripto para çöküşü derinleşirken Bitcoin 18 aylık yeni bir düşüşe geçti
Bitcoin,-1," Warren Buffett, dünyadaki tüm Bitcoin için 25 dolar ödemeyeceğini söylüyor ve Charlie Munger, kriptoyu 'aptal' ve 'şeytani' olarak niteliyor"
Bitcoin,0," Hala erken mi? Rastgele birine sorun, 100$ veya Bitcoin alın?"
Bitcoin,0," Çalışmalar, Bitcoin madenciliğinin gerçek altını çıkarmaktan 3,5 kat daha pahalı olduğunu gösteriyor"
Bitcoin,1,"Bitcoin sonunda borsadan ayrılıyor! Arkadaşlar, beklediğimiz an geldi - Bitcoin sonunda borsadan ayrılıyor! Borsa beş gündür aralıksız yükseliyor olsa da, Bitcoin bunu tamamen görmezden geliyor ve daha da düşmeye devam ediyor. 2017'den beri bu anı bekliyordum ve sonunda geldi! Başardık, bu tarihi ana tanıklık edecek kadar uzun süre HODL yapan herkesi tebrik ediyorum. Borsayı takip eden fiyat hareketleri yok artık, bundan sonra ne olursa olsun sadece düşüyoruz, bu topluluğun ve kripto alanının bir parçası olmak ne büyük bir lütuf! Tanrı hepimizi korusun."
Bitcoin,0," Cidden, özellikle de o zaman hapiste geçirildiğinde. Bu insanların bir hapishane hücresinde *10 yıl* geçirmenin ne kadar uzun olduğuna dair hiçbir fikirleri yok gibi. Hapishanede bıçaklanabilirsiniz. Birkaç milyonla uzaklaşmak için kimsenin taahhütte bulunmak isteyeceği bir şey değil."
Bitcoin,0," Kripto yatırımcılarının yalnızca yaklaşık %3,5'ini oluşturuyoruz ve bu, çift hesapları ve aktif olmayan hesapları hesaba katmıyor. Ayrıca, ortak bir zihniyeti teşvik eden ve popüler görüşü söylemeyi teşvik eden aylar da var ve işte karşınızda, gerçek hayattan tamamen kopuk bir yankı odası için mükemmel tarif."
Bitcoin,-1, Hadi 8-5'te geliyorum
Bitcoin,0," Coinbase Earn'den ücretsiz aldım, şüpheniz olmasın..."
Bitcoin,-1, SLPT: Bitcoin'i yalnızca değeri en yüksek seviyedeyken satın almalısınız
Bitcoin,-1, Onların referansını kaçırdığınızı düşünüyorum. Silikon Vadisi'ne.
Bitcoin,0," Binance'den rekor seviyede 55.000 Bitcoin veya 1,1 milyar dolardan fazla para çekildi"
Bitcoin,0," Bitcoin, Ocak ayından bu yana ilk kez 46.000 doları aştı"
Bitcoin,-1," Kabul ediyorum, ama bu şeyin üzerindeki fon izini gördünüz mü? Dünyada hiçbir şey umurunda olmadan evde rahat etmesi garip değil mi? Çoğu büyük medya kuruluşunun bu konuda sessiz kalması garip değil mi? Komplo teorilerine meyletmekten nefret ediyorum ama bu doğru oyuncularla dolu."
Bitcoin,-1," Kongre'nin büyük çoğunluğu bu saçmalıkların nasıl işlediğini bilmediğinden kendilerine güzel, yeni bir siyah bütçe buldular."
Bitcoin,-1," Avrupa Merkez Bankası, Bitcoin'in 'ilgisizliğe doğru yol aldığını' söyledi"
Bitcoin,0," Bitcoin'i beş yıldır tutuyorsanız, şu anda negatif getiri elde ediyorsunuz [OC]"
Bitcoin,-1," Bunu gümüş bir tepside sundu, bu herif kripto dünyasının belası."
Bitcoin,0," Birkaç yıl önce GPU'larla yapılabilirken BTC madenciliği yapmadığım için kendime kızmıştım, ama sonra onu zaten anında harcayacağımı fark ettim, kimin umurunda. 15 yaşındaydım ve büyük bir inektim, her gün Linus Tech Tips izliyordum ve bu tam da bitcoin'in inekler arasında daha yaygın hale geldiği zamana denk geliyordu (2013)"
Bitcoin,0,"Bitcoin, on yıldan uzun süredir en kötü çeyreğine doğru ilerliyor"
Bitcoin,1, Bitcoin fiyatı 20 Nisan'da 42.069 dolara ulaşırken 'yıldızlar bir araya geldi'!
Bitcoin,1," Exxon, emisyonları azaltma planının bir parçası olarak Kuzey Dakota'da Bitcoin madenciliği yapıyor"
Bitcoin,1,"Bitcoin üst üste 8 yeşil mumu tamamladı. Bu düşündüğünüzden daha az sıklıkta gerçekleşir. Cuma gününe kadar her gün yeşil tamamlarsa, bu 2012'den bu yana en uzun seri olur! BTC'nin üst üste 8 yeşil mumu tamamladığını yeni fark ettim. Bunu çok sık göremezsiniz, bu yüzden en son ne zaman gerçekleştiğini ve ne kadar nadir olduğunu merak ettim. Bu yüzden araştırdım."
Bitcoin,0," Joe Biden, FTX'in Şok Çöküşünden Sonra Oyunu Değiştirecek, Küresel Bitcoin ve Kripto Kuralları İçin 'Kritik' Çağrıya Önderlik Ediyor"
Bitcoin,0," Peki, ABD'de bu tuhaf üstünlük kompleksi olduğunda ne olur, ABD dışındaki her şeye ilgi okullarda bir nevi örtbas ediliyor. Ayrıca o tuhaf yemin telkini."
Bitcoin,0," 3 milyarı satmak veya taşımak bile zor. Cüzdanların, çamaşırhane hizmetlerinin küçük miktarlar yapacağını ancak büyük miktarların işe yaramayacağını biliyorlardı. Kesinlikle siktirip gitmeliydi, ancak bu şeylerden geçinmesi düşündüğünüzden daha zor olurdu. İlgili cüzdanları biliyorlardı. Çoğu borsaya girmesi onu yakalardı. Seçenekleri çoğunlukla yasadışıydı ve halihazırda bir kartel değilseniz, bu kadar parayı taşımayı ve aklamayı zor bulacaksınız. (hey, onu başka bir cüzdana taşıyabilirdi, makul inkar edilebilirlik, 3 milyar dolar olduğunda pek de değil)"
Bitcoin,-1, Yani sanırım ikisi de zeka seviyesi şüpheli kişilerle dolu ama en azından Wall Street bahisleri yetersizliklerini kabul ediyor.
Bitcoin,0," Binance, kripto satışlarının derinleşmesiyle 'sıkışmış bir geçiş' nedeniyle Bitcoin çekimlerini durdurdu"
Bitcoin,-1," Avrupa Merkez Bankası, kripto para çöküşü ortasında Bitcoin'in 'ilgisizliğe doğru yol aldığını' söylüyor - ""Bitcoin ne bir ödeme sistemi ne de bir yatırım biçimi olarak uygun göründüğünden, düzenleyici açıdan ikisi de olarak değerlendirilmemeli ve bu nedenle meşrulaştırılmamalıdır."""
Bitcoin,1, Gelecek burada #Bitcoin
Bitcoin,-1," Bunu söyleyenlerin hepsi, zirvenin önemli olduğunu, çünkü birçok kişinin o dönemdeki hızlı büyüme oranı nedeniyle ilk kez yatırım yapmayı seçtiği noktanın bu olduğunu gözden kaçırıyor."
Bitcoin,-1," ""Baba, 10 dolar değerinde bitcoin ödünç alabilir miyim?"" ""11.62 dolar mı ödünç alabilirim? ... 7.45 dolar değerinde bitcoin'e ne halt ediyorsun?"""
Bitcoin,0," Bitcoin satın almak için ilk web sitesi bugün 13 yıl önce çevrimiçi oldu - 1.309 BTC'yi 1,00 USD'ye satın alabiliyordunuz New Liberty Standard web sitesi Bitcoin satın alımları sunan ilk web sitesiydi. Paypal aracılığıyla Bitcoin satın alabiliyor ve satabiliyordunuz. ""Borsa""yı oluşturan kişi temelde Bitcoin'i Bitcoin madenciliği için ortalama maliyetle fiyatlandırdı."
Bitcoin,0," Sonra, 800085"
Bitcoin,-1,Kripto daha önce küresel bir durgunlukta hiç var olmamıştı. Tüm bahisler iptal edildi ve ilk *gerçek* kripto çöküşünü görmek üzere olabiliriz - ve bu en sıkı tutucuların bile nefesini kesebilir. a.) 2 yıllık bir ayı piyasasına girdiğimizden emin olan ve b.) bunun sadece uzun bir döngüdeki bir düşüş olduğundan emin olan kişilerden çok fazla gevezelik görüyorum.
Bitcoin,-1, Geçen yıl büyük bir yükseliş olduğunda bir keresinde Alchemy Pay'e 20 sterlin yatırmıştım. 80 sterlinle ayrıldım ve çok mutluydum. O zamandan beri sadece arada sırada on sterlin harcadım ve genellikle pes edip zararlarımı kesmeden önce bunun yaklaşık yarısını kaybettim.
Bitcoin,1," itibari parayla ilgili mesele, onları mal ve hizmet satın almak için kullanabilmenizdir"
Bitcoin,0, Bitcoin 33 bin dolarda...
Bitcoin,0," ""Düğüm"" derken muhtemelen Tam düğümü kastetti. Madenci veya Madencilik düğümüyle aynı şey değil. Madencilik düğümleri blok zincirine blok ekler ve bunun için ücret alırken, Tam düğümler yalnızca Madencilik düğümleri tarafından yapılan işi doğrular. Bu konuda uzman değilim ama bir madencilik düğümünün karlılığının BTC:Fiat oranı, bölgedeki elektrik maliyeti, madencilik teçhizatının yaşı ve fiyatı, gayrimenkul maliyetleri, genel giderler ve muhtemelen birkaç başka şeyin karmaşık bir fonksiyonu olduğunu düşünüyorum."
Bitcoin,1, 8 ay mı? ETH ve BTC 6 ay önce ATH'ye ulaştı.
Bitcoin,1, Ve muhtemelen bunu yapmaya başlamak için gereken ilk yatırımın 350.000 katı daha az.
Bitcoin,-1," Aralık 2017'de Bitcoin Satın Aldıysanız, Artık Para Kaybettiniz"
Bitcoin,1, hahaha güzel
Bitcoin,-1," Lütfen diğer tarafa da git kardeşim. 1,2,3,4,5 çok farklı bir resim veriyor. *Özellikle* 1 yıllık getiriler şu anda. -%65Bitcoin oldukça spekülatif, oynak bir varlıktır. Başka bir şey değil."
Bitcoin,0, Gerçekten kurumsal kabul müydü? Papa Johns markasını kullanmak için ödeme yapan yerlerden biri olabilirdi. Papa John's ödeme yöntemi olarak btc'yi desteklemediği sürece ve ben bir şeyi kaçırmadığım sürece. Ama yine de bir adım
Bitcoin,1," Bunu yarılanma ve küresel ekonominin toparlanmasıyla birleştirirseniz, artık bir boğa koşusu tetikleyiciniz var"
Bitcoin,0,"Herkes Kriptolarını %80 daha düşük fiyata satın almak istediklerini söyledi. Şimdi bu gerçekleştiğine göre korkudan felç oldular. Geçtiğimiz yılın Ekim/Kasım aylarına bir geri dönüş, Bitcoin'in yükselişinin zirvesinde olduğu ve her şeyin 100k EOY için hazır göründüğü zamandı. İnsanlar mutlu ve coşkuluydu. Tek şikayet ve en büyüğü daha fazla satın almaktı."
Bitcoin,0," Rusya Gaz'ı Bitcoin karşılığında satmak isteyene kadar herkes merkeziyetsizlikten yanaydı, şimdi bu alt başlıktaki insanlar ""Rusya'nın Bitcoin'den para kazanmasındansa para kaybetmeyi ve fiyatın düşmesini tercih ederim"" gibi yorumlarla bunun hakkında ağlıyorlar. Öncelikle, yaptırım uygulanan bir üçüncü dünya ülkesinden biri olarak, tüm yaptırımların yaptığı tek şey bir ülkeye kıtlık getirmektir. (Suriye, Venezuela vb.'ye bakın) Milyonlarca insanın aç kalması için çağrıda bulunarak ahlaki açıdan üstün olduklarını düşünenler, diğer insanlara karşı hiçbir empati duymayan iğrenç, çifte standartlı alt insanlardır."
Bitcoin,0," Zaman, evet. Sebepler, hayır."
Bitcoin,0,"Şu anda kripto korkusunun zirvesindeyiz. Hala Kripto'ya bağlıysanız, gerçekten bir tutucusunuz ve en kötü ayı piyasalarından geçebilirsiniz. Bitcoin, 28'in altına ve hatta 25 bine kadar düştü. Luna temelde düz bir çizgide aşağı iniyor ve UST'den bile önce 1$'a ulaştı. Bir milyardan fazla uzun likidasyon elde ettik."
Bitcoin,1," Ben de uyuşturucu kartellerine fon sağlamıyorum ve konu bu değil. Herhangi birinden tüm finansal işlemleri denetleyen merkezi bir otoritenin olmamasını tercih ederim. Bitcoin (veya kripto para) ortaya çıkmadan önce uyuşturucu kartellerinin para toplamakta zorluk çektiği gibi bir şey yok. Bir şeyin suç işlemeyi kolaylaştırması, topluma net bir fayda sağladığı anlamına gelmez. Argümanınız neredeyse ""insan kaçakçıları araba kullanıyor, arabalardan kurtulalım ve insan kaçakçılığını çözelim"" ile aynı."
Bitcoin,-1, Kripto Tarafından İflas Eden İlk Ülke Bu Olacak mı? El Salvador'un bitcoin'i para birimi olarak benimsemesinin üzerinden bir yıl geçti — işler iyi gitmiyor.
Bitcoin,0, Bitcoin hafta sonunda 35.000 doların altına düşerek Cuma günkü kayıplarını sürdürdü
Bitcoin,-1, Eğer 5 yıllık zirveden satın aldıysanız şu an USD bazında yaklaşık %30 değer kazanmış durumdasınız.
Bitcoin,0," ne diyorsun, bu sudokuları kimin, neden ve nasıl yarattığını açıklamıyor, çözülmüş sudokular nasıl para birimi haline geldi"
Bitcoin,0, Böylece en büyük kripto para borsalarından birindeki işlem akışını görebilirsiniz
Bitcoin,0," ""30 bin dolardan neden satın almadım?"""
Bitcoin,-1, Yasadışı Bitcoin madenciliği operasyonlarından ele geçirilen ASIC'ler elektrik çaldı (Malezya)
Bitcoin,1," evet, BTC ayı sertifikaları şu anda basılıyor"
