Target,Stance,Text
Bitcoin,1," Bitcoin, Lightning Network aracılığıyla McDonald's ve Walmart tarafından kabul edilecek |"
Bitcoin,-1," belki değil...olacak. Hızlı bir kazanç değil, uzun bir mücadele."
Bitcoin,1," Bitcoin, FTX'in çöküşünden bu yana yaşadığı tüm kayıpları telafi etti"
Bitcoin,0, Bitcoin 400.000 doların altına düştüğünde
Bitcoin,-1," FUD'un bunu nasıl öldürdüğü şaşırtıcı. Ah, hayır, öldürmedi. Başarısız oldu çünkü Blockchain yavaş ve ölçeklenemiyor. Sorun FUD değil. Sorun, teknolojinin aşırı abartılmış olması. Gerçek dünyada pek fazla uygulaması yok."
Bitcoin,1, Kullanılmış yemeklik yağla Bitcoin madenciliği
Bitcoin,-1," Lol. Evet, onları tasfiye ediyorlar. İlk btc satın aldığımda ilk coin'im coin başına 5,8 dolardı. Keşke onları aptalca şeylere harcamasaydım."
Bitcoin,1," Bitcoin Bull, birkaç dakika önce Miami'deki Bitcoin konferansında tanıtıldı... Boğa piyasası."
Bitcoin,1, Aslında kayıtlı tarihteki en uzun olanı
Bitcoin,1," TOR ve VPN'den habersiz olan insan sayısı komik. Bitcoin'i kapatmak mümkün olsaydı, Torrent korsanlığını da kapatabilirlerdi, ama bunu yapamıyorlar. The Pirate Bay'in kurucularını bile hapse attılar, ama web sitesi hala ayakta ve bugün bile çalışıyor. Hükümet, merkezi olmayan bir şeyi durduramaz. Yemin ederim Bitcoin'i FUD eden insanlar gerçekten gerizekalı."
Bitcoin,1, Altın deflasyonist bir varlıktır ve dolar eskiden onun tarafından destekleniyordu
Bitcoin,0, Ben de ortaokuldayken bir zamanlar babamdan Bitcoin satın almak için para istemiştim ama babam bunların çevrimiçi dolandırıcılık olduğunu düşünmüştü
Bitcoin,-1," Numaralı Balina, 15.5 bin BTC'yi depodan çıkardı**SON DAKİKA: Cüzdanın, büyük ihtimalle etiketsiz bir borsaya ait olan başka bir soğuk cüzdan olduğu iddia ediliyor.** [**"
Bitcoin,-1," Gerçekleşti: Bitcoin, 2017'deki tüm zamanların en yüksek seviyesinin altına düştü."
SpaceX,0," Ayn Rand Vakfı'ndan üniversite bursu için başvuruda bulunduğumu ve yapmam gereken tek şeyin The Fountainhead'i okumak olduğunu hatırlıyorum. Kitabı kendimi zorlayarak okumak zorunda kalmama sinirli değilim, sorun bu değil -- aksine, burs yerine bana sadece Atlas Silkindi'nin bir kopyasını verdiler."
SpaceX,0," SpaceX Falcon Heavy'nin çift RTLS inişi yaklaşık 1,5 mil uzaklıktan filme alındı"
SpaceX,0," Hayır, hayır. Bunu simüle edip matematiksel olarak hesaplıyorsunuz. Mühendisler biliyordu ve maliyet tasarrufu önlemi olarak kesildi. Bu, bir roketin kullanıldığı ilk sefer değil."
SpaceX,1," SpaceX hayranlarının çoğunluğunun bu konu hakkındaki görüşleri böyle. Ne yazık ki, insanlar şirketlerini destekleyen her şeyin o aşağılık adamla cinsel ilişkiye girmenin doğrudan sonucu olduğu fikrine tutunuyor gibi görünüyor. Bu aşırı çocukça ve sinir bozucu."
SpaceX,0, Ön tarafı düşmedi
SpaceX,1," Uzay Sahili'nde yaşıyorum ve ilk Ağır fırlatma için makul trafiğin izin verdiği kadar yakınlaşmak için biraz kuzeye doğru sürdüm. Bu gerçekleştikten sonra, aya inişin insan yaratıcılığının zirvesi olabileceğini düşündüm, ancak aynı anda 2 roketi sanal olarak kalkış yaptıkları yere geri indirmek insan zekasının zirvesi olabilir."
SpaceX,0, SpaceX Starship fırlatıldıktan kısa bir süre sonra patladı
SpaceX,0," Çarpışma testi videolarını izlediğinizde ""lol, bu arabanın ön tarafı buruşmuş. Aptal araba."" diyeceğinize bahse girerim."
SpaceX,0, Hangi diğer roket ailesine karşı?
SpaceX,-1," SpaceX Starship, aşama ayrımı başarısız olduktan sonra patladı"
SpaceX,0," SpaceX, yörünge test uçuşu öncesinde Starship prototipinin 6 motorunu da çalıştırdı (video)"
SpaceX,1, SpaceX'in Falcon roket ailesi 200'üncü başarılı göreve ulaştı
SpaceX,1, SpaceX 36 saatte 3 roket fırlatıp indiriyor.
SpaceX,0, Deney yaptıkları bu rokette patlamayı en iyi senaryo haline getiren farklı bir şey mi var? Fırlatma geçmişlerine pek aşina değilim.
SpaceX,0, Ariane 6 artık demode oldu
SpaceX,0, 3 Falcon Heavy bir araya getirildi.
SpaceX,0," Birisi Matt Lowne'u arasın, Blunderbirds'e ihtiyacımız olabilir."
SpaceX,1,"Roketlerin yeniden kullanılabilirliği, SpaceX'in önemli ve ""genellikle göz ardı edilen"" bir avantajına yol açtı: ""Donanımınızı geri almak ve beklemediğiniz şeyleri öğrenmek güvenilirlik açısından inanılmaz bir avantaj... Roketlerini kurtaramayan şirketler, bir gün kendilerini ısıracak, bilmedikleri sorunlarla karşı karşıya kalıyorlar."""
SpaceX,-1, Roketin yaptığı döngüler etkileyici ama bunun amaçlanan bir özellik olduğunu düşünmüyorum
SpaceX,0," Tam da bahsettiğim nitelikteki ""SLS asla işe yaramaz"" planlarını anlatıyorsun."
SpaceX,-1," Sadece çıtayı düşürmeye devam edin ve sonunda bir rokete sahip olmayı bir başarı olarak adlandırabileceksiniz. Öğrenme deneyimini ""başarı"" ile karıştırmayın. Başarı, nihai hedefinize ulaştığınızda gerçekleşen şeydir."
SpaceX,1, Evet ama bu hızlı dönüşlerde insanlı uzay uçuşu yoktu.
SpaceX,1," SpaceX, rekor sayıda 14 raptor motoruyla Süper Ağır güçlendirici statik ateşleme gerçekleştirdi."
SpaceX,1," Evet, bu iyi bir şey ama hala bir şekilde rekabet var. Bu hızla devam ederlerse ve endüstrinin geri kalanı hala hiçbir şey yapmazsa, 5-10 yıl içinde durum böyle olmayabilir. Rekabet ortadan kalkarsa yenilik yapma isteği azalır. Rocketlab'ın Neutron'u devreye sokmasını ve New Glenn'in işe koyulmasını gerçekten umuyorum çünkü şu anda SpaceX'e rakip olabilecek tek iki kişi bunlar."
SpaceX,1, SpaceX 36 saatte 110 uyduyu yörüngeye yerleştirdi. Elon Musk şirketi 3 başarılı yörünge görevinden dolayı tebrik etti
SpaceX,0," Kâr odaklı bir örgüt, siyaset odaklı bir örgütten daha fazla sonuç odaklıdır."
SpaceX,-1, Bir şeyleri tamir edip bir pad'i yeniden inşa etmek en fazla 2 hafta sürebilir. Pad'in yapımında muhteşem bir şey yoktu (bu kadar kolay parçalanmasının sebeplerinden biri de budur) Sanki burada bir şeyler bildiklerini düşünen bir sürü Kerbal oyuncusu var.
SpaceX,0," SpaceX'in bakış açısından mantıklı olduğunu kabul ediyorum, ancak yerel hükümet orada inşa etmelerine izin verdiğinde yaban hayatı sığınağının kaybedilmiş gibi davranmak aptalca. Eğer yaban hayatını korumak gerçekten öncelik olsaydı, SpaceX reddedilmeliydi."
SpaceX,0," Ne tür beton kullandıklarını bilmiyorum ama normal beton çatlar ve yeterince sıcak bir meşale ile patlatıldığında kendiliğinden patlar. Küçük bir ölçekte beton bir zemini meşalele yaktım ve beton parçaları uçuştu. Bu, daha büyük ölçekte olanın aynısı gibi görünüyor."
SpaceX,1," Başarısızlık, hiç yanmaması mı yoksa hemen rampada patlaması mı olurdu. Ancak gerçekte bu senaryolar tasarım ve sistem geliştirme için inanılmaz derecede önemli bilgiler olurdu. SATURN V'in iki katı güce sahip bir roketi başarıyla fırlattılar. Yani artık başarılı bir şekilde fırlatılan en güçlü roket rekoruna sahipler. Ve sadece 5 motorları arızalandı. Yani bunu %15'lik bir motor arızası oranıyla yaptılar. İnanılmaz derecede sağlam."
SpaceX,0," >İki mürettebatlı seçeneği tutmanın akıllıca bir seçim olduğunu düşünüyorum. Tüm başarılarına rağmen, tek bir F9 veya Crew Dragon sorunu olması yeterli ve aniden ABD tekrar tamamen yere serilmiş oluyor. Riske giremez. Sovyetler/Ruslar için tek bir mürettebatlı seçeneğe güvenmek gayet iyi sonuç verdi ve bunu yarım yüzyıldır yapıyorlar."
SpaceX,1, [@elonmusk] Heyecan verici bir Starship test lansmanı için @SpaceX ekibini tebrik ediyorum! Birkaç ay sonraki test lansmanı için çok şey öğrendim.
SpaceX,0," Geçmişte insanlar veya gruplar, tam mahkeme bir duruşma yapana kadar, genellikle birkaç gün içinde, bir yargıca durdurma emri vermesi için dilekçe verebilirdi. Bu emrin gerçek bir son karar olması beklenmez, sadece hukuk sistemine, tartışılan konunun tüm taraflarını gerçekten dinlemesi ve herhangi bir mahkeme veya kurum önünde daha resmi bir duruşma yapılması için bir neden olup olmadığına karar vermesi için zaman tanımaktır."
SpaceX,1,"SpaceX onuncu mürettebatlı görevi, üçüncü tamamen ticari uçuşu başlattı | SpaceX hızla dünyanın en üretken insanlı uzay uçuşu sağlayıcısı haline geldi."
SpaceX,-1," Kelimenin tam anlamıyla bir roket bilimcisi değilim ve belli ki onlar zaten her şeyi düşünmüşler, ancak fırlatma rampasıyla ilgili beni şaşırtan bir şey buydu. Hendek yok, neredeyse yükseltilmiş bir yapı ve inanılmaz derecede güçlü bir roket? Her seferinde onu yeniden inşa etmeleri gerekecek ve ayrıca dev metal ve beton parçalarının sıçrayıp sitenin etrafındaki motorlara veya önemli ekipmanlara çarpmaması için dua edecekler. Bunu düşünen ilk kişi olmadığımı ve onların tam anlamıyla roket bilimcileri olduğunu biliyorum, ancak bu sadece riskli görünüyor."
SpaceX,1," Yeşil ışık yandı: SpaceX, FAA'dan Starship için fırlatma lisansı aldı"
SpaceX,1," SpaceX, bugün Space Force fırlatmasında Falcon Heavy güçlendiricilerinin eş zamanlı inişini gerçekleştirdi"
SpaceX,-1, SpaceX'in dev roketi Teksas'tan fırlatıldıktan dakikalar sonra patladı
SpaceX,1," SpaceX, tek bir mürettebatlı Boeing Starliner'dan önce 10 mürettebatlı görev başlatmış olacak. Planlanan SpaceX mürettebatlı uçuş takvimi tutarsa, Boeing'in Starliner COTS-1'i ilkini fırlatmadan önce ISS'ye ve/veya LEO'ya 10 mürettebatlı uçuş başlatmış olacaklar (şu anda planlanandan 6 yıl sonra)! Demo-2, Crew-1, Crew-2, Crew-3, Crew-4, Crew-5, Crew-6, AX-1, AX-2 ve Inspiration 4. Boeing'in yeterince uzun süren gecikmeleri olursa, SpaceX 11 mürettebatlı göreve (Polaris Dawn'ı da ekleyerek) imza atacak. Benim hesabıma göre bu, uzaya 35 kişi göndermek anlamına da geliyor."
SpaceX,0," Elon Musk'ın SpaceX roketinin patlaması, 'bozulmamış' yaban hayatı sığınağına enkaz yağdırdı"
SpaceX,0, SpaceX Starship'in İlk Uçuş Testi - Fırlatma
SpaceX,0, SpaceX artık ana rakibinin fırlattığı her rokete karşılık 10 roket fırlatıyor
SpaceX,0, [Daha önce bu muhteşem TV skeçiyle karşılaşmamış olanların eğlenmesi için.
SpaceX,1," >Hindistan'ı düşünüp düşünmediklerini bilmiyorum. Roketleri çok ucuz. O noktada ESA ve Arianespace, Ariane 6'nın faaliyete geçmesini bekleyebilir. Umarım bu 2023'ün başlarında gerçekleşir. Ayrıca Arianespace'in hala Vega-C'si var, yani seçenekleri yok değil ancak daha büyük yükler için Ariane 6 hazır olana kadar geçici bir çözüm bulmaları gerekiyor. Ve SpaceX tartışmasız bu amaç için en uygun şirket."
SpaceX,1," Hayır. Amaçları platformdan uzaklaşmaktı. Başardılar. Bunun işe yaramayacağını biliyorlardı. SpaceX bu fırlatmayı inceleyecek, her şeyi düzeltecek, sonra bir sonrakini gönderecek. Ve tekrar tekrar, teknoloji mükemmel olana kadar. Bu roket o kadar muazzam ve ağır ki, hiç kimse uçup uçamayacağından %100 emin değildi. Bu fırlatma, fiziksel olarak mümkün olduğunun kanıtı içindi. En azından platformdan uzaklaşmak istediler, aksi takdirde roket etrafındaki her şeyi nükleer bombayla yok ederdi."
Tesla,-1, bu en az 2 yıldır doğru değil
Tesla,0, 2015'e geri dönmek isterdim.
Tesla,0, Otopilot kullanan Teslalar bir yıldan kısa bir sürede 273 kazaya karıştı
Tesla,0, Elon Musk'ın son dönemdeki davranışları Tesla marka araç alma kararınızı etkiledi mi? Neden veya neden değil?
Tesla,1," Tesla 20 MİLYAR dolar nakit/benzerinin üzerinde oturuyor. İnsanları işten çıkarıyorlar ama iyi olacaklar. ""Büyük adamlar"" neredeyse uluslararası bir krize ve piyasa başarısızlıklarına neden oldular ve kurtarılmak zorunda kaldılar."
Tesla,-1, Eğer yapabilseydim bir Hyundai Ionic alırdım. Çok havalı görünümlü bir araba. Ama onlar piyasada. Sadece bir Tesla kadar belirgin değil.
Tesla,0," Bu, bir gemi kaptanının otomatik pilotu suçlaması gibidir, geminizden %100 siz sorumlusunuz, bu yüzden otomatik pilotu kullanmayı seçerseniz bir şeyler ters giderse sorumluluğu kabul etmiş olursunuz. Yani etrafta başka trafik varken onu kullanmayacaksınız. Yani otomatik pilotu suçlarsanız, kendinizi suçlamış olursunuz."
Tesla,-1," Sadece araba daha pahalı olduğu için hasarın onarımı da daha pahalı olmalı, özellikle de hemen hemen aynı hasar ve aynı işçilik girdisi varsa. Bunun müşteriyi dolandırmaktan başka açıklaması yok."
Tesla,0, San Diego'daki otoyolda 70 mil hızla giderken Tesla'da uyumak
Tesla,0, Ama bunun tam olarak 30 dakika olmadığını bilmek önemlidir
Tesla,1," Aralık ayı için 3.750 dolar düşerek 46.990 dolara yeni bir standart aralık modeli 3 RWD satın alabilirsiniz. 2023'te satın alacağınız aracın ne kadar daha iyi olacağını düşündüğünüzde, ekonomi bir itici güçse bu doğru yoldur. LFP pil takımı 2018'de takılan takımdan önemli ölçüde daha uzun süre dayanacaktır. 2018'de dahil olmayan ısıtmalı arka koltuk ve direksiyon simidi alacaksınız, daha hızlı bilgisayar ve daha iyi lityum küçük pil alacaksınız. Genel olarak çok iyi, uzun ömürlü, hala çok iyi performans gösteren ve çok iyi giden bir Tesla. Hepsi 40'ların altı için."
Tesla,0," Arabamın her zaman hızla yavaşlamayı sevdiği bir nokta var. 3 yıldan uzun süredir bir Tesla'm var, düzinelerce güncelleme aldım ve hiçbir zaman arabamın bu çıkışta frene basmaya çalışmasını engellemedi. Hiçbir uyarı veya yanıp sönen ekran yok, sadece eğlence olsun diye frene basıyor. Hatalar bildirdim. Ancak sorularınızı yanıtlamak için gaz pedalını kullanın. Durdurmanın yolu bu, git pedalını kullanın."
Tesla,-1," İşyerinin otoparkı dolu olduğunda, Tesla'nın panel boşluklarına park ediyorum."
Tesla,0, Değiller. Bölgemdeki envanter sayfalarında 20-30 araba var.
Tesla,-1," Bunlar çoğunlukla 2000'lerin sonu ve 1910'ların başlarındaki konseptlerdi ve Tesla'nın yeni bir model hattı yok. Bu, şirketi mahvedecek en büyük şeylerden biri."
Tesla,0, Bulut bilişim pazarının %33'ünden fazlası AWS üzerinden. Bu sektördeki hakimiyet seviyeleri çılgınca
Tesla,0, LÜTFEN YOLUN KENARINA ÇEKİN VE ARACINIZI KAPATIN. UYMAK İÇİN 20 SANİYENİZ VAR.
Tesla,-1," >Etiket fiyatlarında ""potansiyel tasarrufları"" hala kullanıyor olmaları çılgınlık. Bu tam anlamıyla bir yem ve değiştirme biçimi. Eyaletinize bağlı olarak, hala öyle. Birkaç yıl önce bir araba almaya çalıştım. Her zaman 5-10 bin daha yüksekti. Sonunda sinirli bir finans müdürü ayağa kalktı ve ""İnsanların internetteki fiyatın ödediğiniz fiyat olduğunu düşünmesinin nedenini bilmiyorum. Tek önemsediğiniz şey paraysa sanırım burada işimiz bitti."" dedi."
Tesla,-1," Tesla'nın bu konudaki aldatmacasının derinliği abartılamazdı. -Elon Musk, ulusal televizyonda eller serbest araç kullanırken kendini filme aldı. -Elon Musk, yazılımdan şüphe eden gazetecileri adam öldürmeye yardımcı olmakla suçladı. -Tesla ve Musk, AP'nin insan sürücülerden daha güvenli olduğunu gösteren derin kusurlu güvenlik verilerini övdü. -Musk ve Tesla, ""sadece hükümet düzenlemelerinin"" yakın gelecekte aracın tamamen otonom sürüş yapmasını engellediğini iddia etti. Bu bir yalandı. -Tesla bunu aktif olarak öğrenen bir sistem olarak pazarladı (değil) ve bunun iki sonucu var: 1. Göründüğünden daha iyi ve her gün gelişiyor, bu yüzden rahatlayın! 2. Siz, kullanıcı, ona meydan okuyarak onu daha iyi hale getireceksiniz. Aslında, onu ""eğiterek"" insanlığa hizmet ediyorsunuz. Tüm bunlar, bu gibi saf moronların yolda güvensiz olmayı haklı gördükleri senaryoya yol açtı. Ve Tesla, yasal ayrıntılarında bunun yalnızca uygulamalı bir özellik olduğunun açıkça belirtildiğini alaycı bir şekilde vurguluyor."
Tesla,1," Fiyatlar yalnızca rekabet baskısı varsa düşecektir. Tesla için maliyetlerin düştüğünden eminim, ancak şu anda fiyatları düşürmek için gerçekten iyi bir nedenleri yok, çünkü hala satıyorlar. Umarım rakipler yetişir ve fiyatlar maliyetlerle birlikte düşer."
Tesla,-1," Tesla, ABD'deki tüm modellerinin fiyatlarını artırdı, bazılarında 6.000 dolara kadar zam yapıldı"
Tesla,0, Kaliforniya'dan Teksas'a giderken Tesla'mın yolcu tarafındaki camı donma noktasının altındaki sıcaklıkta aniden kırıldı.
Tesla,0,"Elon Musk'ın önünde zorlu bir yol var, Tesla dünyanın en büyük elektrikli otomobil üreticisi unvanını kaybetme tehlikesiyle karşı karşıya, araştırma böyle söylüyor"
Tesla,1," Aynısı Ford için de geçerli. Benim F150'mde, adaptif hız sabitleme ve şerit asistanı devreye girdiğinde, kamyon kendi kendine gidiyor. Ford buna mavi yolculuk diyor. Gösterge panelimde, devreye girdiğinde kamyonumun etrafında mavi bir baloncuk oluyor. Bayılıyorum ve harika çalışıyor."
Tesla,0," Tesla, Tam Otonom Sürüş yazılımının fiyatını 15.000 dolara çıkarıyor"
Tesla,1, Ön uç çarpışma sisteminin hala devrede olduğunu ve bu nedenle aracın çarpışmayı önlemeye çalışmadan frene basacağını düşünüyorum. En azından adaptif hız sabitleyici gibi şeyler açıkken aracım böyle çalışıyor; ne yapacağını belirleyemezse (örneğin çok yakından aniden kesilirseniz) araç çarpışma uyarısı veriyor ve tepki vermezsem otomatik frenlemeye hazırlanırken direksiyon ve hızlanma kontrolünü geri veriyor.
Tesla,-1," Tesla'lar oyuncak arabalara benziyorBence Tesla'lar oyuncak arabalara benziyor. İç mekan fena değil, iPad ve her şeyle oldukça fütüristik. Dışı ucuz görünüyor, kapı kolları plastikten yapılmış gibi görünüyor, arabanın geri kalanı bir vw up ile bir çarpışmada parçalanacakmış gibi görünüyor."
Tesla,-1," A5'in üstündeki bir model x, başımı üzgün bir şekilde sallıyor. Beni şaşırtan tek şey, bu 3 arabanın fiyat noktalarının birbirine yakın olmaması. İkisi 50 bin, biri 120 bin. O fiyat aralığında alabileceğiniz güzel Audi'yi biliyor musunuz?"
Tesla,0," Bu kesinlikle doğru değil. Otonom sürüş teknolojisine en son 20 yıl önce baktığınızı hissediyorum çünkü söylediklerinizin hiçbiri yıllardır doğru değil. Teknoloji bugün hazır. Herhangi bir insan sürücünün hayal edebileceğinden çok daha iyi, herhangi bir yol kalitesinde, herhangi bir konumda, herhangi bir çevrede otonom sürüş sistemleri zaten mevcut. Ve insanlar modern arabalarını sürdükçe, verileri otonom sürüşü daha da geliştiren makine öğrenimi yapay zeka sistemlerine gönderilerek daha da mükemmelleştiriliyor."
Tesla,0," Çoğu muhafazakar zaten Ford satın alıyor. En azından Ford Lightning, Fuck Cybertruck'ın benzemeye çalıştığı şeye benzemek yerine gerçek bir kamyonet gibi görünüyor"
Tesla,-1,"Tesla, Sacramento otoyolunda aniden yandı"
Tesla,0," NHTSA Soruşturması Altında Otopilotlu 830.000 Tesla, Geri Çağırma Mümkün"
Tesla,-1,"ABD, Tesla'nın direksiyon simidinin düşebilmesi nedeniyle soruşturma başlattı"
Tesla,1," Eğer kendinizi daha iyi hissetmenizi sağlayacaksa, bir tane bende var ve bunun oldukça şüpheli olduğunu düşünüyorum. Otopilot konileri tespit etmede inanılmaz derecede iyi. Hatta devrilen konileri bile tanıyor. Ayrıca konilerden nefret ediyor ve şeritte onlardan uzaklaşıyor ve başka bir şerit varsa konilerden uzaklaşmak için oraya geçiyor. Konilerin yakınında olmaktan iyi bir şey çıkamaz. Ayrıca namlunun ve aynanın her ikisinin de görülebildiği ve namlunun oldukça uzakta göründüğü tek bir çerçeve var. Ayrıca direksiyon simidi uygun bir şekilde çerçevenin dışında. İnsanlar beğenilere ciddi şekilde bağımlı."
Tesla,0," Yatırımcılar Tesla'nın bir teknoloji şirketi değil, bir otomobil üreticisi olduğu sonucuna vardı"
Tesla,0, İlk başta garip gelebilir ama belki de daha iyi olabilir.
Tesla,0, Önemli değil. Elon hala kötü! - Reddit
Tesla,0, Tesla işçileri New York'ta sendikalaşma kampanyası başlattı
Tesla,0," Yapacak. Elbette mirasını çöpe attı. Ama evet, elektrikli araba satarken solcuların peşine düşmek biraz garip bir hayat tercihi."
Tesla,0, Soyulmanın olduğu yerde bir yol vardır
Tesla,0, Verhoven'ın ne hissettiğini düşünüyorsun?
Tesla,0, Keşke çadır kentlerde yaşayabilecek maddi imkâna sahip olabilseydim...
Tesla,0," Ayrıca bu arabanın içinde sıkışıp kalmadı. Kapıyı açmak için kulpu kullandı, tıpkı şık düğmeli açıcınız çalışmadığında yaptığınız gibi."
Tesla,1," Bir Tesla'ya sahip olmaktan biraz utanıyorum, bu beni üzüyor. İlk olarak, tepkilerden kaçınmak için bunu bir Tesla alt başlığında yayınlamak istememem, hissettiklerimi temsil ediyor. Eleştiri, haklı ve tarafsız olsa bile, Tesla fanatikleri tarafından genellikle reddedilir. İkincisi, teknoloji (bana göre) geri kalanın çok üstünde olduğu için bir Tesla seçtim."
Tesla,0," Evet, Aptera'yı başından beri takip ediyorum. Sonunda piyasaya çıktıklarını görmek beni çok mutlu ediyor. Şu anda benim için en iyi seçim değil ama gerçekten bir tane istiyorum."
Tesla,0, Ne tür bir ağaç?
Tesla,-1," Tesla'nın şerit değiştirdikten hemen sonra durduğunu düşünüyorum, durmadan önce sadece sol şeritte 1-2 kez göz kırptı."
Tesla,0, Sadece normal bir Tesla sürücüsü
Tesla,0, Gönder
Tesla,0," Tesla sürücüsü, otoyolda itfaiye aracına çarptıktan sonra öldü"
Tesla,-1," Yüz yıldan daha eski bir sürü otomobil üreticisi var. Hayır, Tesla elektrikli araçların benimsenmesinin lanet olası nedeni değil, ABD hükümeti ve AB'den gelen **muazzam** hükümet teşvikleri elektrikli arabaları yaygınlaştırdı, bu çılgın miktardaki sübvansiyonlar olmasaydı Tesla yıllar önce ölmüş olurdu. Bu bir yenilik mucizesinden çok, ""apartheid kan mücevheri servetinin iğrenç mirasçısı, elektrikli araçlar üretmek için hükümet sübvansiyonları alıyor"""
Tesla,0," Burada Tesla'yı savunmuyorum. Herhangi bir araba aniden durabilir ve siz yine de güvenli mesafeyi korumak zorundasınız. Duran bir arabaya arkadan çarpmak, arabanın neden durduğuna bakılmaksızın sizi suçlu kılar. Çarptığınız arabanın önünüzü kestiğini ve frenlerine asıldığını, kasıtlı olarak fren yaparak sizi çarptığını veya size geri geri çarptığını kanıtlayamazsanız, her seferinde sizin hatanız olacaktırDüzenleme: Tesla, frenleme tamamlanmadan şerit değiştirdi ve ona çarpan ilk arabadan sorumludur. Geri kalanlar güvenli mesafeyi korumadıkları için suçludur. Bu zincirleme kazada hiçbir hatası olmayan tek araba, Tesla'ya çarpan ilk arabadır."
Tesla,-1," Bir Tesla sahibi, Model Y'sinin aniden kapanması ve kendisini içeride mahsur bırakması öncesinde kendisine yana çekmesini emrettiğini söyledi"
Tesla,0," Tesla'nın 'tam otonom' sürüş sistemi sekiz araçlık bir kazaya neden oldu, bir sürücü polise söyledi"
Tesla,1, Tesla alsınlar.
Tesla,-1," Musk'ın otonom sürüş özelliğini duyurmasından sadece birkaç saat sonra, Körfez Köprüsü'nde aniden duran ve 2 yaşında bir çocuk da dahil olmak üzere 9 kişinin yaralandığı sekiz araçlı bir kazaya neden olan otonom bir Tesla"
Tesla,0, Tesla: Gelecek Şimdi
Tesla,0, Sen bir sonraki Biff Tannen olabilirsin!
Tesla,0, Tüm iPhone'ların bir güvenlik yaması için geri çağrıldığını düşünün.
Tesla,0," > gerçi, adil olmak gerekirse, onlarda hayalet frenleme çok bilinen bir sorundurÖyle mi? Tesla'ları biliyorum (sürmüyorum) ve genel olarak FSD ile ilgili sorunlar olduğunu biliyorum, ancak hayalet frenlemenin bir sorun olduğunun (az önceye kadar!) açıkça *farkında* değildim, yaygın bir sorun olduğundan bahsetmiyorum bile.Aracımda adaptif hız sabitleyici var, ancak hayalet frenleme yaptığı zamanların sayısını bir elin parmaklarıyla sayabilirim. (Ve bunun ""neden"" olduğunu her zaman anlayabilirim, örneğin radarda hızla giderken kaldırıma benzeyen yolda garip bir tümsek!)"
Tesla,1," Ancak Tesla otomatik pilotun *tamamen* başarısız olduğu ve uyarı vermeden devre dışı kaldığı araçlar satıyorsa, bu da sorumluluk açısından ele alınması gereken bir sorundur. Tesla ayrıca araçlarının kendi kendine fren yapmasıyla da bilinir. VE arkadaki araçlar, ani durma durumunda arkadan çarpmayı önlemek için her zaman yeterli alan bırakma sorumluluğuna sahiptir."
Tesla,0, 140 bin dolarlık Tesla kalitesi
Tesla,0," >Temel olarak, rastgele bebek arabalarına çarpan bir Tesla kullanan bir adam. Bunu başarabilirseniz iyi iş çıkarmış olursunuz."
Tesla,0," Tesla'nın otonom sürüşü teşvik eden videosu sahnelendi, mühendis ifade verdi"
Tesla,-1," Kamyon şoförü, Tesla Semi'nin kabin tasarımının onu 'tamamen aptal bir araç' haline getirdiğini söylüyor"
Tesla,-1, Adam Tesla'sını bir ay garajda bırakmış...
Tesla,-1," Bir Tesla sürücüsünün, servis merkezini ziyaret ettikten sonra ön bagajında ölü bir fare ve sıçan zehiri bulduğu bildirildi ve bu, otomobil üreticisiyle ilgili büyüyen bir sorunu gösteriyor"
Tesla,0, Tesla'nın çarpışma önleme sistemi mezarlıkta görünmez bir adam tespit etti.
Tesla,0," özür dilerim ama bu bağlamda detayın ne anlama geldiğini açıklayabilir misiniz? ana dilim ingilizce değil ve detayı çevirmeye çalıştığımda bana detayın genel anlamını veriyor, ""detaylı bilgi"" gibi"
Tesla,0, tesla patlasın
Tesla,0, Bu adam Tesla'sıyla otoyolda giderken uyuyor
