Target,Stance,Text
Ukraine,1,Yok para kesilmesi vs vs kınama vs Rusya bunlarla durdurabilecek bi ülke değil.Rusya istediğini alır.  Nato savaşa girerse Ukrayna egemenliğini korur ancak milyonlarca insan katledilir.  Çok zor bi duruma soktu dünyayı Putin
Russia,1,"Rusya BM Büyükelçisi: Bu bir savaş değil, askeri operasyon.."
Ukraine,1,Ohaaa lann az önce bi video gördüm Ukrayna askerinin öldürmüşler di kafası çok kötü durumdaydı
Ukraine,1,Ukrayna vatandaşı müslüman Kırım tatarına mı üzüleyim. Rus köpeği Çeçen müslümana mı yanayım
Ukraine,-1,Rusya ve Ukrayna arasında gerilim hep vardı.Ukrayna AB'ye güvendi.Hiçbir Emperyaliste güven olmadığı gibi AB'ne güvenmekle dış politika izlenmez.Kendinin ve düşmanın tarihini iyi okuyacaksın.Çünkü Tarih tekerrür eder.Tabi tarihininden ders çıkaramadiysan sonuç ta hep aynı biter.
Russia,1,"📍🇷🇺🇲🇲  Bu, Rusya'nın küresel denge içerisinde bir Dünya gücü olduğunu gösteriyor.   • Rusya ulusal egemenliğini güçlendiriyor.   •  Myanmar, Rusya'nın Ukrayna'ya girişini meşru görmüş oldu.   -Zaw Min Tun | Myanmar Ordusu Sözcüsü"
Russia,-1,"Türkiye açısından da sorun kompleks bir güvenlik mimarisi sorunudur. Hâlâ Stalin'in toprak istediği noktadayız. Özetleyeyim: Gürcistan Rusya uydusu. Güney komşumuz artık Rusya, Suriye değil. Kırım artık Rusya. İran tarihsel düşmanımız. Irak, İran çizgisinde. Bu bir kuşatmadır."
Russia,-1,"🔴Rusya destekli Luhansk güçleri, Ukrayna Hava Kuvvetlerine ait 2 adet Su-24 tipi savaş uçağını düşürdüklerini iddia etti."
Ukraine,-1,Rusya ya destek mi olmak mı istiyorsunuz..!! Açın sınırları mültecilere  Avrupa keyf üstüne keyf görsün.. Kdv♋
Ukraine,-1,"⭕️Kiev’de konuşlanan 2 adet A400M Nakliye Uçağının konumu, Rusya ile paylaşıldı. Rusya, bu bölgeyi vurmayacak. #Ukrayna #Kiev #Rusya"
Russia,1,"İsrail'le iş tuttuğumuzu gören İran “contada arıza oldu” dedi, doğalgazı üç gün kesti, sanayimiz komaya girdi.  Rusya'nın contasında arıza olursa, noolacağını hiç düşündün mü canım kardeşim?  Yılmaz Özdil"
Russia,-1,Bu bir tezgâh Türkiye bu savaşa dahil olmamalı Osmanlı'nın da yıkılışı bu şekilde başlamıştı dahil olmaması gereken savaşa dahil edilerek... Belki de Türkiye'yi sıkıştırmak için ABD ve Rusya tarafından kurgulanan bir oyun
Ukraine,1,"Rusya’nın Ukrayna’yı işgal etmesi çok büyük acılar yaşatacak.. iç karışıklıklardan tut, masum insanların ölümüne kadar… Bir Suriye faciası daha yanı başımızda yaşanıyor ve dünya izliyor. Rusya, bu suçun hesabını dünya toplumuna verecek."
Russia,-1,Savaşınizindaa sizindeee Allah belanızı versin hepinizin be ! Şu Rusya ya dur diyecek bir delikanlı yok mu ya öldünuz mü !!! #StopWar #StopRussianAggression #StopRussia
Ukraine,1,"Bu doğru işte, adam mumya gibi,yürüyen buda olmuş,sessiz kabadayı,ateşe attığı Ukraynayı yalnız bıraktılar.Rusya elini kolunu sallayarak Ukraynayı bütün olarak ilhak eder."
Russia,-1,Akşamina rusya cekilir anlasmaya varilir. Tanirim putini hep goz dagi amk
Ukraine,1,Ukrayna son neferine kadar savaşarak buradan bir gelecek çılarabilir ama bu gelecek artık batılıların program  yardım ve mental işgallerinden bağımsız bir gelecek olmalıdır bundan sonra.
Russia,-1,Çocukların çığlıkları arasına karışmış hiçbir mücadele haklı olamaz. Rusya’nın barbarlığı durdurulmalı. #StandWithUkraine 🇺🇦
Russia,1,Ne Yapacaktı Amerikan'nın tamamen oyuncağı olmanıza  Delik olmanıza Emparyalistlerin Rusya'ya Saldırma Karargâhı olmanıza izinmi verecekti peh Tabiki Rusya risklere karşı Şimdiden Topraklarını Güvenliğe Alacaktı 😒 MANTIK
Russia,1,Rusya Ukrayna'ya 1000 tank ile hareket başlattı
Russia,-1,"Rus Ordusunun, gece savaşma kabiliyetinin ne kadar kısıtlı olduğunu bu gece görüyoruz.Rusya Sovyetlerden kalan mirasın dibini sıyırmış elinde balistik füzeleri, nükleer gücü ve modern teçhizatları sayıca kısıtlı bir ordudur. Sabaha doğru etkinlik artacaktır. #Rusya #Ukrayna #tb2"
Russia,1,"Rahmetli babaannem el atına binen köy ortasında iner demişti..  Ah Ukrayna, güvendiğiniz emperyal güçler sizi ortalıkta bıraktı..  Kimsenin aklıyla hareket etmeyeceksin.. Gerçi bu savaş danışıklı dövüşlü Savaşta olabilir..  Rusya enerjiden,  batı silahtan kazanıyor.."
Russia,-1,"Bu savaş; ABD'nin Ukranyayı, Rusya'nın da,Luhansk ve donetsk (Donbas) ayrılıkçı bölgeleri ile Belarus'u kullanarak küresel güçlerini, karşı karşıya gelmeden Biden ve Putin'in yanlış algı lider psikolojisi ile savaş çıkarmaları binlerce asker ve sivilin ölmesi ile sonuçlanacaktır."
Ukraine,-1,Savunma sanayiimiz bir işe yaramaz. Rusya ile kavga etmemek lazım.
Russia,-1,Rusya askeri olarak evet ama ekonomik olarak bu savaşı asla sürdüremez. Ölümü gösterip sıtmaya razı edip barış şartlarını konuşacak.
Russia,1,"Rusya, AB yi doğalgaz ile tehdit ediyor. Rusya soğuk savaştan sonra paylaşılan topraklardan memnun değil yeni paylaşım için Ukrayna dan başlıyor.  #worldwar3"
Russia,-1,"rusya o kadar büyüksen git usa saldir .kudurmuş usa olanlar senin suçun,"
Russia,-1,"Adını doğru koymak gerekiyor.  ""Rusya- Ukrayna savaşı"" değil.  Rusya işgalidir bu."
Ukraine,-1,"Dünyanın her yerine kan ve  gözyaşı götüren,adeta terör örgütü gibi davranan NATO uluslararası hukuka uygun,göz göre göre füzelerle kuşatılıp tehdit edilen Rusya,güvenliğini sağlamak için harekat başlatınca uluslararası hukuka uygun değil.Rusya onurlu bir ülke."
Ukraine,1,Günün sonunda Ukrayna halkı yapayalnız kaldı.  #SavaşaHayır
Ukraine,1,Ukrayna bu savaşı haketmiyor...
Ukraine,-1,"Ukrayna abd ve ab'ninh gazına gelip Nato'yu Rusya'nın  dibine sokacak, sonra Yunanistan ve pkk'ya yaptıkları gibi binlerce tırlık silahı oraya yığacak, zamanı geldiğinde de Rusya'ya saldıracak. Rusya'da kuzu kuzu bunları bekleyecekti,? Sevmem ama Rusya haklı.#BizimSavaşımızDeğil"
Ukraine,1,Eşimin babası da Ukrayna ordusuna katıldı bu akşam. Çok ciddi çatışmalar var birçok noktada. Kharkiv'deki arkadaşlarım etrafın daha sakin olduğunu söylüyorlar ancak binanın bodrum katındalar şu an.  Bu gece Ukrayna için en zor ve uzun gece olacak. Ve tabi ki benim için
Russia,-1,"İşgale karşı olan bir insan olarak ben de Rusya'yı kınıyorum. ""Bedeli ağır olacak"" diyorum  Peki Avrupa'nın, Nato'nun benden farkı ne? Yaptığımın fazlasını yapabiliyorlar mı? Ben gelişmeleri ekrandan takip ediyorum, onlar da aynı şekilde.."
Russia,-1,Savaş suçları savaşlarda işlenir ve daima da işlenmiştir. Rusya'da da savaş suçları işleniyor.
Russia,1,"Bu çatışmadan çıkacak bazı sonuçlar;  1-NATO kağıttan kaplandır, liderleri Rusya ve Çin gibi rakiplerine taarruz edip iş ciddileşince proxy olarak kullandıklarını masada satmaktadır, Türkiye NATO'dan ayrılmalıdır bu oyunlarda artık piyon olmamak için."
Russia,1,Ortalığı karıştırın sonra sorumlu Rusya. Amerika Irak’a girerken nerdeydin ?
Ukraine,-1,Ortalığı karıştırın sonra sorumlu Rusya. Amerika Irak’a girerken nerdeydin ?
Ukraine,1,Küresel bir güç olan Persler Hristiyan Romaya saldırdığında Peygamberimiz ve Sahabei Kiram Romalıların zafer kazanması ve Perslerin yenilmesini istemişti. O gün yeryüzünde mütekebbir ve zalim olan Perslerin durumu ile Bugün Rusya'nın durumu aynıdır. Ukrayna'nın yanındayız.
Russia,1,"A.B.D ve batı,Bir şamar daha yiyecek. Rusya 'dan."
Ukraine,-1,"YAHU BU INSANLAR NEYI ANLAMIYOR !? RUSYA KENDI ACISINDAN SONUNA KADAR HAKLI, BIZE UYAR YA DA UYMAZ AYRI KONU. YUKARIDA POLONYA VE BALTIK DEVLETLERI, ASSAGIDA GIRIT, BULGARISTAN, ROMANYA,. DOGUDA AFGANISTAN (KI AFGANISTANDA ISTEDIGINI COKTAN ALDI)GURCISTAN VB.VB.VB. USTUNDEN RUSYA"
Russia,-1,"KIRILMA: Rusya, LPR'de Shchastya şehri yakınlarında 2 Bayraktar TB2 insansız hava aracını düşürdü"
Russia,-1,21.yüzyılın ortasında doyumsuz devlet başkanları sivil günahsız insanları hiç uğruna öldürüyor.   Katil Rusya.. #killerrussia #PutinStop
Ukraine,1,"Rusya ve Ukrayna krizi haftalardır konuşuluyordu, Ukraynadaki Türk insanları ve üniversite öğrencileri neden tahliye edilmedi ki? Bu TÜRK istihbaratı acanları ve TÜRK dış işleri ne iş yapar ki?"
Ukraine,1,"Tüm gün savaş görselleri görüp üzüldüm. İnsanlar birebir o anları yaşayıp, türlü türlü acılar çekiyor. #Ukrayna içine düştüğü bu zor durumdan bir an önce en az kayıpla çıkar umarım. #StopWar #Ukrainian"
Russia,1,Rusya'nın savaş açması gayet normal. Abd ve nato ukraynada silahlanıp Karadenize hakim olmak istiyor. Abd nin korkulu rüyası Rusya. Rusyaya Ukrayna üzerinden hakimiyet kurmak Karadenizde ki gücü eline almak isteyen Abd ve kulaklık yapan Ukrayna varken savaş Kaçınılmazdı. #Rusya
Russia,-1,"Rusya ve Putin sevgisini oldukça abartanlar var. Rusya öngörülemez bir devlettir. Hedeflerinden biri sıcak denizlere inmek olmuştur. Bugün Ukrayna diyen Putin yarın Stalin gibi Kars, Ardahan, Boğazlar demeye başlayabilir. Bu sebeple Türkiye, Batı ve NATO ile her zaman iyi olmalı."
Ukraine,1,Ukrayna halkı ve devleti teslim olmuyor. Araplar gibi gelen ağam giden paşam demiyor. Çarpışıyor. Helal olsun.
Ukraine,1,Ukrayna eğer bu savasta rusyayi püskürtür yada uzun süre direnirse bu rusya için uzun yillar ekonomik ve askeri cöküşü olur..
Russia,1,Amerika - Almanya -İngiltere ve Fransa ; Rusya’nın yanı başında hava savunma sistemini Rusya’nın saf dışı bırakacak pozisyona getirmeye çalışır ise yanılır. Çünkü ne putin saddam ; ne Rusya Irak...
Russia,-1,"Rusya'da bile bizdeki kadar #Putin'in eylemlerini ve savaş çıkartma çabalarını haklı bulan insan bulamazsınız. Bunlar yarın Ruslar kalkıp bize gelse, enişte diye boynuna sarılırlar muhtemelen"
Ukraine,-1,Rusya kendisine yapılacak saldırıyı kendi topraklarında karşılayacak kadar aciz değil herhalde
Ukraine,-1,Rusya’nın derdi Ukrayna değil . Ukrayna’yı isteseydi 1 saate alır çıkardı . Rusya’nın derdi tüm dünyaya meydan okumak . #RusyaUkrayna
Ukraine,-1,"Putin’in şu açıklaması dikkat çekici: “Olaylara müdahale etmeye kalkışacaklara söyleyelim ki, bize engel olmak ve halkımıza tehdit oluşturmak isterse, Rusya derhal karşılık verecek ve tarihte henüz hiç görülmemiş sonuçlarla karşılaşacaklarını söyleyelim” #Ukraina"
Russia,1,Işin korkunç tarafı kimsede rusya’ya kafa tutacak göt yok anca dua ediyorlar oturup izliyorlar
Ukraine,1,"#Rusya’nın hastaneleri vurmasına, sivilleri katletmesine Suriye’den aşinayız. Yine şaşırtmadı. Sivil yerleşim yerleri ve son olarak Hastaneyi bombalamış! İşte bu işgalin ciddi bir karşılığı olmalı. Ülkelerin uluslararası hukuğun gereği cevaplar verilmeli. Ben yaptım ettim olmaz."
Ukraine,-1,"Rusya, Ukrayna’ya attığı bombalara isim yazdırmak isteyenler için ek kontenjan açmış, kaçırmayın. @OZLEM_CERCIOGLU"
Ukraine,1,Çocukların öldüğü hicbir dava haklı değildir.  #Ukrayna
Russia,1,Yazık oldu aptal yöneticilerin elinde Ukrayna'ya.
Ukraine,1,Stoltenberg : 100 savaş uçağı Nato hava sahasını koruyo. Bu nasıl bir açıklamadır. Söz verdiğiniz gibi Ukrayna’yı korumanız ve savaşı önlemeniz gerekir. Rusya’nın derdi Ukrayna’nın dışında başka bir ülke değil ki! ABD’de ve Avrupa’da sahtekarlık diz boyu… Yazık Ukrayna halkına.
Russia,-1,isterse 1 yıl sürsün. yanında çin var. rusya + çin ekonomik yaptırımların allah oğlu allahı gelse kendi ekosistemlerinde sonsuza kadar yaşayabilirler. nato topunuzu patlatırım haa'dan fazlasını yapmazsa hayırlı olsun dünya demokratik halk cumhuriyet.
Ukraine,1,"Bu hikâyede yanan sen oldun #Ukrayna, Senin yaşadıkların AB ve ABD ye  güvenenlere büyük ders oldu,"
Russia,-1,Kötü Rusya bad Russia sbsbbsnsnns
Ukraine,1,"Suriye'de teröristlere verilen askeri desteği Ukrayna'ya vermediler, bunun sonucunda Rusya karşısında dağılmış bir ordunun dramını izliyoruz"
Ukraine,1,"Ukrayna Dışişleri Bakanı Dmytro Kuleba:   ""Polonya Devlet Başkanı Duda, Polonyalıların, Rusya'nın saldırganlığını başarıyla püskürten Ukrayna Ordusu'nun mücadelesine olan hayranlığını dile getirdi.""  ""Polonya, somut yardım yaparak; ek silahlar, mali ve insani yardım gönderdi."""
Ukraine,-1,"1- BATI güçlerinin Ukrayna’yı korumak gibi dertleri olsaydı çoktan NATO’ya alırlardı. NATO, Ukrayna’da olanları örnek göstererek Avrupa’nın kuzeydoğusuna daha çok üs ve asker sokmak için kendisine meşru zemin hazırlıyor. WİN-WİN. &gt;"
Russia,-1,"Rusya ve ABD siyam ikizi gibi . Girdikleri her yerde masum insanların ölümüne neden olurlar. Dünya Savaşı çıkmaz fakat Rusya'nın da onursuzca savaştığını söylemek pek yanlış olmaz. Ukrayna'da ki zenginlerin ve milletvekillerinin ülkeyi terk ettiğini görüyoruz. Vatan, Millet..."
Russia,-1,"Ukrayna'ya saldıran Rusya, aslında tüm insanlığı hedef almıştır. Savaş kötüdür bunu hala anlamana Putin yönetimine tüm Dünya ortak tepki göstermelidir!"
Ukraine,1,"Rusyanın teçhizat asker sayısı vs ukraynadan 100 gömlek üstte Ukrayna’nın tek başına rusya ile başetmesi imkansız. Diğer büyük ülkeler sadece kınadı. Ukrayna yanlız kaldı. Artık küçücük çocukların, masum halkın kaderi putinin merhametine kaldı eğer o da kaldıysa tabi… #Ukrainian"
Ukraine,1,Rusya saldırmadan önce herkes Ukrayna ile birlikteydi. Amerikası İngilteresi Fransası Kanadası ve nicesi şimdi neredeler. Sadece duaları Ukrayna ile...
Ukraine,1,Yugoslavyacıların gözüne sokun - III  Yaşasın tam bağımsız UKRAYNA
Ukraine,1,Savaşı yaşamadığım halde uçaklardan  korkmaya başladım. Çok fazla ölü ve yaralı olduğu söyleniyor. ALLAH yardımcınız olsun.🙏  #Ukrayna
Russia,-1,"Böyle adamların kullandığı bu silah, bu kötü dil, bu pervasız Rusçuluk, utanç, zulüm ve kan silahıdır. Rusya’nın meşru hangi amacı vardır? Zulüm gören bir halk mı vardır, kurtarılacak bir çocuk mu vardır?"
Russia,-1,"AB liderleri, Olağanüstü zirvede Rusya'ya yönelik finans, enerji, ulaşım, ihracat kontrolü ve finansmanı, vize politikası ve kişileri hedef alan ek yaptırımları kabul etti."
Russia,-1,"Bütün dünyanın gözü önünde Rusya, işgali başlatıyor ve kimse buna dur demiyor. NATO neden üç maymunu oynuyor? Savaşın kazananı olmazz. #SavasaHayır"
Ukraine,1,"Evet, savaşta kazanan asla yoktur.  Dünyanın kaynakları tüm insanlar için yeterlidir.  Dünyada barış içinde yaşayabiliriz.  Size, ailenize ve Ukrayna halkına başarılar diliyorum.  Ukrayna'yı 🇺🇦🇹🇷 seviyorum"
Russia,1,"i.yıldız &gt; UKRAYNA SAVAŞI: İSTENİLDİMİ, İZİNMİ VERİLDİ YA DA BAŞARISIZLIKMI? ukrayna tarafından engellenebilirdi. &gt; UKRAINE KRIEG: GEWOLLT, ZUGELASSEN ODER VERSAGT.? könnte von ukraine verhindern können.  &gt; UKRAINE WAR: WANTED, PERMITTED OR FAILED? could be prevented by ukraine."
Russia,-1,"Muharem Bey, Rusya saydığınız bu şahıslar varken daha saldırgandı.  Puşkin hayattayken Rusya İstanbul ‘u işgale geldi!"
Russia,1,Savaşı durduracak tek güç Rusya halkıdır
Ukraine,-1,Ne NATO ne Ab bu krizde caydırıcı hiç bir yaptirimda bulunacağını düşünmüyorum. Rusya istediğini alıncaya kadar savaşa son vermeyecektir. Bu savaşta gördüğüm savunma teknoloji ve taaruz gücü bir ülkenin can damarıdır.ideoliji ve inanç üstü bir durumdur . #Ukraina
Russia,1,#Rusya savaşan ülke olmasına rağmen; Rus haikı 2 günde 40 milyar dolar bozdurarak para birimlerinin değer kaybetmesini engelliyor. Türk halkı ise savaşla alakası olmamasına rağmen 10 milyar dolar satın alarak dolara değer kazandırıyor. Hayırlı işler
Russia,1,Rusya'nın Karadeniz limanlarındaki faaliyetleri normal bir şekilde devam ediyor / RIA
Ukraine,1,"Rusya'daki muhalif liderler, Ukrayna'da ne işimiz var diyorlar mıdır???"
Russia,-1,Solculuğu batsın! Pis bir faşist diktatör artık Rusya
Russia,-1,"Koronavirüsü dünyaya yayan ve araştırılmasına engel olan Çin, Rusya'nın yanında saf tutmuş. Bu iki ülke artık insanlık düşmanıdır."
Russia,-1,"kahvehaneden bildiriyorum  -bidenın yaptırımları çok ağır oldu putin daha fazla dayanamaz  - amerika ve nato çok güçlü askeri operasyon yapmasalar bile putinin savaş bittikten sonra işi zor olacak  - putin katil, rusya işgalci bir devlet  3 dayı kendi aralarında konuşuyorlardı"
Ukraine,-1,Hem sosyalizmden korkuyor hem de bunu tüm dünyanın önünde açıklıyor. Rusya’ya artı bir puan.
Russia,-1,Burdan Trabzona 12 saatte gidiyoruz yav bu rusya çernobile kieve nasıl girdi?
Russia,-1,".@GeneralStaffUA:Durum kontrol altında. Rus birlikleri kayıp veriyor.  Müşterek Kuvvetler Harekat alanında Rus Havacılık Kuvvetlerine ait 5 uçak ve 2 helikopter vuruldu, iki tank hasar gördü, Rusya Federasyonu silahlı kuvvetlerine ait birkaç kamyon imha edildi."
Russia,-1,Rusya'nın asıl hedefi bellidir eğer bu tutumundan vazgecmezse ve dersi verilmezse tarih boyunca hayalini kurduğu boğazlar için harekete geçebilir. Yani demem şu ki Türkiye tehdit altındadır. #boğazlar #RusyaUkraynaKrizi #UkraineRussie
Ukraine,1,"#Ukrayna gerçek bir millet gibi ülkesini kadın erkek demeden savunuyor, bunun adı karakterdir  Onlar Suriyeliler gibi yaşamayı değil ONURLU ÖLMEYİ seçtiler   Ukraynalı kadınların elimde silah gördüğümde gerçekten gözlerim doldu   Yaşa UKRAYNA kahrol SURİYE"
Russia,1,bunlar sanıyor ki nato her şekilde müdahale eder edemez arkadaşlar Rusya arkasında devletler yokmuş gibi konuşmayın aq kocaman Çin arkasında diğerlerini saymıyorum bile ve Rusya bütün ekonomik önlemlerini yıllar önceden beri aldı hiç bir şekilde yıkılmaz!... ve uzun süre sürecek
Russia,1,Rusya eski silahlarını kullanıyor!  Yeni oyuncaklarını daha büyük tehlikelere saklıyor... #Ukraina  #Rusia
Ukraine,1,rusya ukraynayi cok kotu vuruyormus ya cok kotu
Ukraine,1,"Ukrayna işgaline hayır!  Savaşa hayır ! Savaş :yoksulluk , göç ve kırımdır.  İngiltere bu savaşı hep kışkırttı ..! Biden Ukrayna halkına söz verdi .!#RusyaUkraynaKrizi  #rusya #ukraına"
Russia,-1,Ben dogalgazi kapattım 14 ile 15 dereceyi geçen şehirlerde kapatın korkmayın donmazsiniz.  Cok sicak ortam hasta eder unutmayın ayrıca bu Rusya para kazandirmanin alemi yok . Hem paramız cebimizde kalsın.  Ara ara yakın evi ısıtın ama 24 saat yakmayın artık milli servet gitmesin
Russia,-1,"Rusya'nın donetsk ve lugansk'ın bağımsızlığını tanımasından tut, kiev bağımsızlık meydanının karartılmasına kadar her şeyi rüyamda görmüştüm. Eğer olaylar rüyamdaki gibi gelişmeye devam ederse ukrayna, rusyanın yıldırma politikaları yüzünden referandumla rusyaya katılacak"
Russia,-1,Rusya’nın bu kadar cüretkar hareket etmesinde ki temel nedenlerden biri Amerika’nın başında ki otoritenin güçlü intiba vermemesidir. Cumhuriyetçi bir lider olsaydı şimdi Birleşmiş milletler askerleri Kiev’de çorba dağıtıyordu bile.  #Kiev
Russia,-1,ANLAŞILAN RUSYA UKRAYNA'DAN İSTEDİĞİNİ ALAMADI..  KAYIPSIZ GERİ ÇEKİLME İÇİN NÜKLEER KARTINI OYNUYOR!
Russia,-1,Rusya'nın denizlerle bağlantısının acilen kesilmesi lazım yoksa bölgeyi tam bir kan gölüne dönüştürecekler...
Russia,-1,"Putin'in sovyet fantezisi yuzunden, Rusya halki yoksullaşacak."
Ukraine,1,"bir ülkeye halkına askerine orantısız gir güçle saldırılıyor. bizim gevşekler de bizim savaşımız değil demiş. ben dreyfus nerede bir ezilen varsa onun yanındayım nerede bir ezen varsa onun karşısındayım aynı ATAM ""Mustafa Kemal ATATÜRK  gibi. KAHRAMAN UKRAYNA HALKINA SELAM OLSUN"
Russia,-1,"#Ukraina yalnız değildir...#Kiev Rusya her ayrılıkçıyı tanırsa dünyada 1 milyon ülke olur...Putin'e gerekli tepki verilmeli ""ne şiş yansın ne kebap"" politikasıyla haloloacak bir sorun değildir...."
Russia,-1,"Bu saldırganlık ne böyle. Sadeceşahit olduğumuz; Afganistan, Gürcistan, Abazya, Çeçenistan ve şimdi de Ukrayna. Sıra kimde acaba #rusya"
Russia,1,Rusya dünyadan büyüktür yani?
Ukraine,1,"✍️ Tüm dünya Ukrayna’yı resmen seyrediyor.Kimse bir şey yapmıyor.Kınamalar,boş tehditler ve yaptırım kararları…Hepsi  hikaye.ABD,AB,NATO ve BM hiçbir şey yapmıyor.Putin’i kim durduracak ? Nereye kadar böyle gidecek ? Yazık değil mi Ukrayna’ya ? Yazık değil mi masum insanlara ?"
Russia,-1,"Rusya bu saldırıyı durdurmalı , yıl olmuş 2022 salgındı ekonomik krizdi derken halka saldırmak zalimce . Ми з Україною #Kiev"
Russia,1,Rusya sınanması gereken en son ülkedir dünyada şu an ki koşullarda
Ukraine,-1,"Rusya - Ukrayna'ya savaş açtı.Bazilari diyor ki yok çanakkkaleyi Ruslara kapatalım ,yok bizde guneyden girelim falan filan .Rusya gazı kesse ertesi gün ülkemizdeki sanayi komple durur. Ekonomimizi ve hava savunma sistemindeki eksikliğimizden bahsetmiyorum bile ağzı olan konuşuyor"
Ukraine,-1,🔴 Kremlin'den ilk açıklama:  📍Operasyonun ne kadar süreceğine Putin karar verecek. 📍Rusya demir bir perdenin arkasına kapatmanız imkansız. 📍Rusya'nın Ukrayna operasyonu hedefine ulaşmalı.
Russia,-1,#NATO ve batı ülkeleri Rusya'yı acilen durdurmalı. Neden mi? #Ukraina #worldwar3 #Putin #usdtry #Kiev #Ukrayna
Ukraine,-1,"İsrail Filistini işgal etti insan öldürüyor kimsenin sesi çıkmıyor nerde Avrupa NATO ABD niye görmüyor, Afganistanı işgal etti batı binlerce insan öldü ırak Cezayir Libya hepsini batı nato ABD maf etti insanları katletti, bıraksınlar Rusya işgal edecekmiş yaptıklarınıza bakın"
Russia,-1,Gece azan maraz gibisin be rusya
Ukraine,1,"Amerika-Rusya ego savaşı yüzünden gerçekten savaş çıktı. Yazık Ukrayna halkına, çok yazık."
Russia,-1,"Rusya 86' da Çernobil nükleer faciası ile ukraynaya ve dünyanın ekosistemine büyük bir drama yaşatmamış, zarar vermemiş gibi ikinci bir felaket daha yaşatıyor bu insanlara.. tarih boyunca sadece savaş, yıkım ve ölüm meraklısı bir devlet olarak kalacaksın"
Ukraine,-1,"Rusya Ukrayna’daki diplomatlarını tahliye etmeye başladı. Ayrıca, Rus elçiliği binasındaki Rusya bayrağını da indirdi."
Russia,-1,"""Rusya Ukrayna sınırında şiddetli çatışmalar"" yerine ""Rus tankları Ukrayna şehirlerine giriş yaptı"" haberleri geldiğine göre Ukrayna dahil kimsenin Putin'e karşı çıkmayacak. Ukraynalılar savaşmayacaksa kusura bakmasınlar kimse gelip onları kurtarmayacak."
Ukraine,1,Ukrayna Rusya ya karşı çaresiz kaldı.Batı ve Nato sadece izliyor.Şimdi anlaşıldı mı neden yıllardır savunma sanayine önem verdiğimiz .O silahları kullanmasan bile bir gücü temsil eder .Bunu anlayacak zeka muhalefette yok.  NATO
Ukraine,1,ukrayna gürcistan değil ukrayna'nın ordusu da çok güçlü olmayabilir   ancak ukrayna'nın fazlasıyla bir nüfusu var ve ordusu da var gördüğümüz üzere
Russia,-1,"Amerika ,Rusya ile olan ezeli savaşında  her ülkeyi ezip mahvediyor. Ancak rusya aptalı kendinden olan ülkeye buhu yapmamaliydi.."
Russia,-1,"vicdanli Rus insanlar Rusya'dan utanıyor , vicdanlı İsrailliler İsrail'den utaniyor, vicdanli Amerikalilar Amerika'dan ....ama Türkler... hiçbir zaman tarihlerinden utanmayacak,!"
Ukraine,-1,ABD’de her dönem Demokratların kelimeleri büyük icraatları küçük olur. 2022 yılında swift kapatacaklar. Sanki bavul ticareti. Merkel sizi Putin’in kucağına oturttu. Merkel hatrına bekledi Putin. Merkel Avrupa’yı Rusya gazına mahrum etti. Gitti ve savaş başladı.
Ukraine,-1,"Son iki aydır televizyonlarda çıkan ne kadar askeri uzman, ne kadar siyasetçi, ne kadar  öğretim görevlisi  varsa 1 teki rusya ukranyaya saldırmaz dedi.  5 yaşındaki çocuk bile 3 aydır sınıra 200 bin asker yığan putinin saldıracağını tahmin edebilirdi."
Russia,1,"*Lavrov: Rusya, BM'nin adalet ve prensipleri dönmek için her zaman diyaloğa hazır olacak"
Ukraine,1,"Zaten yalnız kalamayan da kendini bulamazmış. Işığın en net görüldüğü yer, karanlığın en dibidir sözü gibi. Özgür, kimliğini ve ruhunu kazanmış, zengin bi Ukrayna dilerim. Zel gibi bi başkanları olduğu için de çok şanslılar bana kalırsa. Slava ✌️"
Russia,-1,Rusya'nın derdi sıcak denizler..  Akdeniz'e dikkat!
Ukraine,-1,Aliyev Rusya'nın Azerbaycan derebeyidir.
Ukraine,1,"#Ukrainian yanınızdayız, katil Rusya katil putin"
Russia,-1,@degirmencirfan  Sevgili irfan bey kardeşim  Kurulduğu günden beri halk tv izliyorum solcu CHP liyim sanki rusya yı haklı görüyor gibisiniz çok üzüldüm şavaş ta hep mahsum insanlar ölüyör kahrolsun rusya kahrolsun amerika
Russia,-1,Şu yüzyılda çıkan olaya bak SAVAŞ hatta savaş demek bile az resmen İŞGAL! Sivil halka saldıran Rusya açıkca savaş suçu işliyor!!  #Ukrainian #StopWar #NoWar
Russia,1,"Rusya BM Büyükelçisi Nebizia: ""Bu bir savaş değil, askeri operasyon."" Şehirleri, sivilleri bombalamanın adı da operasyon olmuş"
Russia,-1,"Filistin Şurtası, Rusya'ya desteğini açıklamış. Aman ne mühim kardeş, sen de desteklemesen ne yapardı bu Rusya!   Filistin ve civarındaki Araplar 80 yıldır aralıksız olarak yanlış yerde durmayı, hatalı karar almayı, öngörüsüz davranmayı başarıyor."
Russia,-1,Moskof uşakları ve Rusya güzellemeleri yapan müstemleke beyinliler neden suskunsunuz ?
