Target,Stance,Text
Russia,-1,"Rusya Ukrayna’yı tamamen işgal etmeyecek, askeri ve stratejik hedeflerin kontrolünü ele geçirip, Rus yanlısı bir iktidar oluşturana kadar bunu devam ettirecek (Abluka). Tabi her zamanki gibi olan yine halka olacak. Yıllardır bu yarayı kaşıyanlar ise şimdi avuçlarını ovuşturuyor."
Ukraine,1,"Bu gece ayrı yerlerde çok sayıda Rus askeri öldürüldü. Görünüşe göre, Rus kuvvetleri ilerlerken, Ukrayna kuvvetleri onları pusuya düşürüyor. #WWIII #Ukraina #Putin #Ukrayna #NATO"
Ukraine,-1,Rusya'nın işgali devam ediyor; Rus kuvvetleri Harkov'a yaklaştı
Russia,1,Ben Rusya tarafını mı tutsam acaba 🤔 Çünkü kaybedecek tarafı tutmak istemiyorum. ! 😲
Russia,1,rusya çok güçlü amk lütfen onların karşısında olmayalım
Russia,1,🔴⚡️ Ukrayna konusunda aldığımız tedbir ve kararların amacı Rusya halkının güvenliğini sağlamak.  -Rusya Dışişleri Bakanı
Russia,-1,putin biraz daha ukraynayı bombalar dayanacak güçleri kalmayınca rejim istifa eder yerine putinin yönetecegi cinsten bir adam geçer tıpkı çeçenistanda yaptıkları gibi devşirme bir ukrayna ortaya cıkaracaklar
Ukraine,1,🇦🇿❤️🇺🇦 inanırıq ki Ukrayna hak mübarizəsində qələbə qazanacaq  #Ukraine #NoWar
Russia,-1,#Ukrayna Rusya SSCB göndermesi yaparak eski sınırlarından bahsedeli sadece bir kaç gün oldu; Ukrayna Rusya için bir son olmayacak; ABD Rusya gibi emperyalistlerin bir an önce durması gerekiyor. Dünya savaşa doydu!!!
Ukraine,-1,"Rusya Devlet Başkanı Vladimir Putin, diplomatik çözümlere sıcak baktıklarını fakat ülkesinin çıkarlarının müzakereye açık olmadığını dile getirdi. Putin, ordunun bu çıkarları savunmak için yeterli olduğunu ifade etti."
Ukraine,-1,Putin için Sovyet Rusya hala yaşıyor.
Russia,-1,"Şimdi Rusya tüm dünyanın gözü önünde vahşice bir ülke toprağına saldırıyor, hem de 21. Yüzyılda, hala insanlık bir savaşa nasıl izin veriyor, dünya susuyor, çocuklar yine ölecek... Allah belanızı versin Rus ayıları... #NoWarWithUkraine"
Russia,-1,#NoWar abd-rusya-israil-fransa ve çin bu 5 ülke yeryüzünde olduğu müddetçe bana barıştan marıştan bahsetmeyin agaa 😡
Russia,-1,Avrupa Komisyonu Başkanı: Rusya'nın AB'deki varlıklarını donduracağız
Ukraine,-1,Bu savaşta Rusya nin yanındayız @KremlinRussia_E yanındayız aloooo hakkını ver
Russia,1,Ukrayna'da olanların tek sorumlusu ABD'dir. Maidan olaylarından bu yana her şey tüm dünyanın gözü önünde oldu. Rusya'yı boklamayı bırakın artık.
Russia,-1,#Ukrayna nükleer silahlarını Rusya’ya ülke bütünlüğünü bozmaması şartı ile teslim etmişti.  Atalar demiş Ya Ayıdan post Rus’tan dost olmaz diye #RusyaUkraynaSavaşı
Russia,1,"Belarus Devlet Başkanı Lukaşenko, gerekli olması halinde kendilerinin Rusya'ya askeri destek sağlayabileceklerini söyledi."
Russia,-1,"Birçok ülke Rusya için yaptırım kararı açıklıyor. Yaptırımlarla varılacak bir sonuç yoktur. Rusya bu yaptırımları göze alarak harekatlara başladı zaten. Önemli olan somut adımlardır, soyut yaptırımlar değildir. Yaptırım uygulanacak ülke, kayıp veren ülkedir."
Ukraine,1,Aslanım Ukrayna koçum Ukrayna seni NATO üyesi yapacağız AB ye alacağız seni doğu avrupanın yıldızı yapacağız gazı ile Rusya'ya yem yapılan Ukrayna halkının her damla kanında işte bu puştların parmağı var.
Ukraine,1,Bu ömür bir savaş daha gördü. Bu savaş çıkmadan çıkmaz diyordum ya da 2014 gibi olur diyordum. Yanılmışım. Ama yaklaşık iki yıldır söylediğim bir şeyin arkasındayım; biz Ukrayna’nın yanında olmalıyız. Romantik geliyor kulağa ama tamamen öyle değil.
Ukraine,-1,Rusya Vatan Topraklarıni savunmak için ileri operasyon yapmaktadır!!! Aynı Türkiye Cumhuriyeti Devleti'nin Suriye topraklarında yaptığı gibi!!!
Ukraine,-1,"Putin, Rusya'nın amacının Ukrayna'yı işgal etmek degil, silahtan arındirmak olduğunu iddia ederek Ukrayna'ya resmen savaş başlattı."
Russia,-1,"""Boğazlar, Rusya'nın elinde olsa Batı, ABD ve toptan emperyalizme karşı daha güçlü olur, emperyalizmle daha iyi mücadele ederdi."" Bakalım bunu solculuk, emperyalizm karşıtlığı adına ilk hangi Rusçu ""dahi"" söyleyecek?"
Russia,1,Savaş çok fazla buyumez. Rusya asıl hamleyi önünüzdeki sonbaharda gerçekleştirir.  #horoskop  #astroloji  #Ukrayna
Russia,1,"Evet bir savaş var ve bu savaşı 8 yıl önce AB-D/NATO başlattı, Rusya bitiriyor. Savaşın başlangıcından düne kadar olanları görmeyip bugün savaşa hayır sloganı atmak iki yüzlülük"
Ukraine,1,"Ukrayna/Zelenski:  - Bu görülmemiş çapta bir yurt savunmasıdır, ulusun birliği için hepimize sorumluluklar düşüyor - Rusya ile diplomatik bağlarımızı kopardık"
Ukraine,-1,"Şeytanın avukatlığını yapmış gibi olacağım ama Rusya'nın sınırına dayanmış bir NATO ve Batı tehditini böyle önlemeyi tercih etmesi gayet akla uygun. NATO ordularını Ukrayna'ya getirmeye çalışırken Ruslar ne yapacaktı, Balalayka mı çalacaktı?"
Ukraine,-1,"Rusya'nın önünde durabilecek güçte 1 tane ülke yok. AB'nin veya NATO'nun uygulayacağı yaptırımların kesinlikle Rusya'yı korkuttuğunu düşünmüyorum. ABD hiçbir zaman Rusya ile kafa kafaya gelme tehlikesine düşmez.  Ukrayna, Rusya'nın önüne yem edildi."
Russia,1,"CNN propagandaları ve kışkırtmalarıyla Biden’ın “istediği oldu”. İnşallah can kaybı çok olmaz… Ukrayna ise, gördüğü sahte desteğe ve birkaç Rusya’yı sevmeyen vatandaşının, milliyetçi naralarına kanıp, dik konuşmaya devam ediyor ama ben alttaki tweetimin maalesef arkasındayım."
Ukraine,-1,Buğday ve ayçiçeği ithalatının önemli bir kısmı Rusya’dan. Turizmde de Rus turistin önemli ölçüde getirisi var. Ukrayna’dan 3-5 mülteci kadın gelsin diye dua eden ahmaklar bu gidişle yiyecek ekmek bulamayacağınızın umarım farkındasınızdır. Savaşın galibi olmaz!#SavaşaHayır #NoWar
Russia,-1,ABD'nin yüzünden tüm dünya tehlike altında..Rusya oyuna gelerek savaş ilan etti. Allah sonumuza yardım etsin..
Russia,-1,@EbruBaki  kahrolsun amerika kahrolsun nato rusya haklı
Russia,-1,"Ukrayna hiç bir zaman devlet olamamıştır ,bağımsız olmamıştır. Kukla rejimli bir Abd kolonisidir. Düne kadar ülkelerinin %20/25 ini Çin e kiralamayı düşünen, Kırımda Rusya ya posta koymaya kalkan bir ülkeydi. Ee kaşınırsan kaşırlar aga ağlamayacan."
Russia,1,Rusya Kiev’deki hava alanını ele geçirmiş. Daha 1. Gün yahu.
Ukraine,-1,Ukrayna direnişi belki işi uzatır ama Rusya alacağını alır. Dünyaya da gereken dersi verir demir yumruğuyla. Putin'i konuşmaları sırasındaki yüz ifadesi zaten kararlığını aylardır gösteriyordu.
Russia,-1,Rusya borsasında kayıp yüzde 50'ye dayandı.
Ukraine,-1,Ne oldu Moruk @JoeBiden ? 4000 TIR silah Rusya sınırına gönderemedin mi?
Russia,-1,Çok zalim çok vicdansızsın Rusya #ukrayna
Ukraine,1,Rusya 3 koldan Ukrayna topraklarına saldırıyor 💣  ABD Avrupa seyrediyor dünya Putin durduramadı😡
Russia,1,"Rusya, Ukrayna kentlerini savaş uçaklarıyla bombalamaya başladı."
Russia,1,"Tarihe not: Rusya, Ukrayna halkını kurtarmak için Ukrayna'yı bombalıyor."
Ukraine,-1,"Hayır *** koyduğumun Ukrayna'sı, tek başına Rusya'ya karşı gelemeyeceğin belli, diplomasiyle biseler yapmaya calissaydin ya, AB sikiyle gerdeğe girersen göt gibi kalırsın ortada #RusyaUkraynaKrizi"
Russia,-1,Rusya’yı kınayan bir karar tasarısı BMGK’ya sunulacak.  Tasarı Cuma günü oylanacak.  Komedi gibi..
Russia,-1,Basketbol Euroleague'de Rus takımlarına protestolar var ama bunu futbolda göremiyoruz bu akşam  Barcelona Zenit ile oynayacağı maç için Rusya'ya gitmedi. Baskonia'da Unics Kazan ile maça çıkmadı. &gt;&gt;&gt;
Russia,-1,"Rusya'nın Ukrayna'nın birliğine ve bütünlüğüne karşı başlattığı savaşı kınıyorum. İnsanlık tarihinde yine utançla anılacak şeyler yapılıyor. Gandhi'nin de dediği gibi ""Barışa giden yol yoktur. Barışın kendisi bir yoldur."" #StaywithUkraine #RussianInvadedUkraine #KyivnotKiev #Kiev"
Ukraine,-1,"Putin'in derdi toprak değil. Putin'in derdi ideoloji. En iyi senaryoda, Ukraynadaki yönetimi değiştirip Belarus'ta yaptığı gibi kendi kukla rejimini getirmek olur. Bugün buna alan kazandığını gören Rusya, tepkisizliği ve cılız sesleri fırsat görerek başka yerlerde alan genişletir"
Russia,-1,Rusya hasteneyi vurdu şaşırmadım her zaman yaptığı iş
Russia,-1,Batırın şu Rusya’yı Sovyetler dönemine dönsün
Russia,1,"Silahın ve gücün yoksa, dövüşmeyi bilmiyorsan, demokrasinin, insan hakları bildirgesinin bir palavra olduğunu Rusya gibileri kafana vurduğunda anlarsın ve iş işten geçmiş olur... #russiaukrainewar"
Ukraine,-1,Şu anda dehşet bir batı propagandası dönüyor ama Rusya bu işgalden çok az sivil zayiatla çıkmayı başarırsa Putin bir tirandan bir özgürleştiriciye dönüşür benden söylemesi. #Kiev
Russia,-1,Rusya sinsi bir devlettir. Önce Ukrayna’ya Kırım’la yoklama yaptı şimdi ise Kiev’le hepsini alarak.
Ukraine,1,"Zelensky, Rusya'nın Kiev yakınlarındaki havaalanını ele geçirdiğini bildirdi."
Russia,1,Ukrayna'da 3  yila yakin yasadim. Cok dost edindim. Tarihlerini arastirdim. Hic oyle kaderlerine boyun egecek insanlar degiller. Oyle olsaydilar Rusya tekrar ve bu kez topyekun saldirmazdi. #Ukraine
Ukraine,1,"İşin aslı.. Ukrayna'yı bu duruma düşüren NATO/ABD'nin Rusya'yı yok sayan politikasıdır. N'oldu şimdi? Putin de onları yok saydı, var mı durduran, yok. Ne yazık ki olan şimdi Ukrayna'ya oluyor,  yarattığı ekonomik kriz de cabası. Yazık!  Erdal SARIZEYBEK"
Russia,1,"Rusya'nın planı büyük ihtimalle full-scale bir işgal değil, stratejik noktaları ele geçirip, Ukrayna'nın askeri kapasitesini yok edip barışa zorlamak, 2-3 güne kadar da bu sonuca ulaşmayı hedefliyorlar. Kiev'i işgal savaşı uzatır."
Russia,-1,#Biden:  #Rusya'nın #Dolar la iş yapmasını sınırlayacağız.  #kriptopara #Btc #Ukraina #
Ukraine,-1,Bu kadar beceriksiz bir hükümet ve başkanı.. Savaş geldim dediği halde UKRAYNA halkı için hiç bir önlemi almamış bir hükümet... #Ukranya
Russia,-1,Karabağ işgalin de Türkiye Desteği de Avrupa ABD Rusya İçin Bir Uyanma Oldu Silkelendiler …. Yeniden  Türk Cumhuriyetlerini Etkisizleştirmek için Rusya yı sürdüler Öne  Putin zaten Fırsat Kolluyordu …
Russia,-1,Nato nasılsa müdahale etmiyor hal böyleyken nasıl putin güvenlikten bahsediyor. abd ve rusya oturmuşlar masaya ve dünya genelinde bir al gülüm ver gülüm yapmışlar. Olan biten güvenlik savaşı değil paylaşım savaşı...
Russia,1,"Gördükleri bayraktarları , yok hava sahasının efendisiymiş yok rakip tanımazmış. A10 dan bile üstün diyen oldu . Kullanışlı silah mı - Evet. Ama işte düzensiz ordulara, teröristlere ve 3.dünya kapasitesine sahip silahlara karşı. Rusya işte çoğunu yerde yok etti."
Russia,-1,Dikkat çekilmesi gereken bir konuda şu; Tüm Rus yetkililer açıklamalarında Putin karar verecek diyor. Ortada bir Rusya Devleti falan yok!Devlet kurumları yok! Ortak akıl yok! Sadece Putin var! Ve Savaş var! Tanıdık geldi mi?
Russia,-1,Sivilden evinden ne istiyorsun *** çocuğu Rusya
Russia,1,"Rusya geleceğe dönük önemli kararlar alacak... Doğu Akdeniz""i de kapsıyor... Rusya""nın amacı iktidarın değişmesi için elinden gelen her türlü hamleyi yapmaya çalışmak ve kendi anlaşabileceği bir iktidarın kurulmasını sağlamak..."
Ukraine,1,"Rusya tüm dunyanın gözleri önünde, bagımsız bir ülkeyi işgal edip, sivilleri öldüruyor ama ‘savaş aygıtı NATO’. Türk solunun ezberci Batı karşıtlıgı sınır tanımıyor. Ya sabır!"
Russia,-1,"Corona gündeminin bu şekilde değişmesini hiç dilemezdim. Alçak Rusya’nın kendisini „huzur bozucu” olarak dünyaya hatırlatması umarım bazı devletlerin uyanmasına yol açar. İyiyi dilemekten başka ne yapılabilir, bilmiyorum."
Ukraine,1,Cesur Ukrayna halkı işgale karşı sonuna kadar direnecektir✊ #Ukrayna Rusya'nın Stalingrad'ı olabilir.
Ukraine,1,"Ukrayna, Suriye, Filistin, Gazze, Doğu Türkistan.... ölen kişiler farklı ama hepsi mazlum, katil de aynı hikaye de aynı."
Russia,1,Savaşı soranlara: Bunu ilk söyleyenlerdenim ama ben buna savaş demem. Rusya vuracak ve herkes izleyecek. Ama eğer NATO karşılık verirse o zaman derim ki zamanlamada yanıldım. Ama şu anda bence bir şey çıkmaz buradan. Kırımdaki gibi RUSYA alır dünya izler.
Russia,1,Rusya hakkı olarak ukraynayı işgal ederek tek kutuplu dünya dönemine son verdi sırada Çin’in Tayvan’ı işgali var bekliyoruz #Kiev
Russia,1,Ukrayna’nın Zelenski başta olmak üzere acemice ve basiretsizce yönetildiğini anlamak zor mu? Göz göre göre bir halkı ateşin içine atmaktır bu.. Rusya’nın yanıbaşında Amerika ve Avrupa’ya uzak karakol olmayı seçmek aklını kaybetmekle eşdeğerdir. Üstelik Nato üyesi bile değilken.
Ukraine,-1,"Anlamadığım Bir Şekilde Bir Rusya Sempatisi Gelişti  Rusya Yakacak, Yıkacak ama Karlımı Çıkacak  Avrupa Yaptırım Uygulatsa Rusya’ya Ne Olurmuş, İngiltere Finans Sistemini Kapatırsa Ne Olurmuş❓  Bakın Bakalım Neler Oluyormuş❓  Lan Adamlar Gazı-Petrolü Dövizle Satıyor DÖVİZLE❗️❗️"
Ukraine,1,🔴 Ukrayna'nın Ankara Büyükelçisi Vasyl Bodnar: Maalesef sivil kayıplarımız var. İnternette gerçeği yansıtmayan birçok bilgiye ulaşabilirsiniz. Rusya aynı zamanda internette de enformasyon savaşını başlatıyor.
Ukraine,1,- Ukrayna 'nın toprak bütünlüğünün olabildiğince korunması !!!  - Rusya 'nın ise olabildiğince zayıflatılması !!! önem arz etmektedir.  Rus imparatorluğu hayali kuranların sonra ki adımları iyi analiz edilmeli.
Russia,-1,"1-Uluslararası ilişkiler okuyan herkesin bakması gerektiği yerden bakıyorum. Rusya doğal olarak ABD yi dibine sokmaz, bunu yapmaya çalışıp 1950 lerden beri rusya yı kışkırtan ukrayna tarihindeki en sert cevabı aldı ve en büyük sonucu batının yanında olmadığını gördü"
Ukraine,-1,"rusya yaptırımlara kendini hazırlamıştı,aparat taşeron ülkeler ayarlayıp ticaretini o ülkeler üzerine aktardı bile."
Ukraine,1,#rusya #putin ne ugrasiyorsun gariban ukraynayla su simarik sahtakar avurpaya dal ver onlara derslerini.bir birinizi bogun da bizde kokten kurtulalom.hepinizden
Ukraine,1,"Biz teröre karşı ülkemizi savunurken ABD yaptırım uyguluyor,  Rusya koskoca Ülkeye saldırıyor, ABD başkanı dua edelim diyor, Yazık.. Güç böyle bişey.. #NoWar  #UkraineRussie  #StopWar"
Russia,-1,"putin abd ve nato ya gözdağı verme adına ukrayna  halkını çiğnedi hata yaptı, bedel ödeyecek, büyük olasılıkla da düşecek"
Russia,-1,"Schalke 04, Rusya şirketi olan Gazprom'la olan sponsorluk ilişkisini askıya aldığını ve sponsorun formadan kaldırıldığını duyurdu👇"
Ukraine,-1,Rusya ilerde enerji fiyatlarında damping yaparak tüm emtia fiyatlarında avrupanın işine gelmeyecek durumlar oluşturabilir mi? Patron çıldırır mı?🤔
Ukraine,-1,"Yazıklar olsun. Biz Ukrayna için Ukrayna lılardan daha çok üzülüyoruz galiba!  Seferberlik savaş başlamadan önce ilan edilir, sonra değil!  Adam kalkmış şimdi seferberlik ilan ediyor.  Dalga geçer gibi."
Russia,1,"Rusya ; NATO VE ABD yi uyardı kimse dinlemedi , ŞİMDİ EMPATİ YAPIN bizde YUNANİSTANIN EGE İÇİN yaptıklarını onaylamıyoruz düşmaca tavırları var BİR GÜN BİZDE RUSYA gibi kendi göbeğimizi keseceğiz illaki YUNANİSTANLA bir savaşımız olacak buda kaçınılmaz kendisini güvende hissetme"
Ukraine,-1,"Bu yüzyılda Tr'nin yeraltı-yerüstü kaynakları Rusya ve Çin tarafından mı yağmalanmaktadır? 104 tane üssü Rusya ve Çin mi kurmuştur? Fetö ve Pkk'yı Rusya ve Çin mi eğitip, donatıp üzerimize salmıştır? Söyleminiz Tr'yi müttefiksiz bırakmaya matuftur; art niyetiniz anlaşılmaktadır."
Ukraine,-1,"Rusya saldırılarına erken saatlerde Harkov, Sumi, Odessa, Çernihiv ve Jitomir'de sivil halkı hedef alarak başladı. Putin’de gizli bir Adolf Hitler potansiyeli görüyorum demiştm. Zaten kendisi Sovyet gizli istihbarat servisi KGB'nin eski bir ajanı! Sınırları olduğunu düşünmüyorum."
Russia,-1,Rusya halkın Elektrik gaz petrol ihtiyaçlarını keserek karşısına almayayıp Zelenskiyi devirecektir Batıya çok büyük bi ders verip haddini bildirdi Hepsi yas tutuyor Sıkıyosa saldırın Putin restini çekti Blöf yapmadını gösterdi
Russia,-1,"O.çocugu Abd bize Suriye de yaptığı gibi stratejik bölgelere abd askeri yerleştirseydi,hava savunma fuzeleri verseydi  Rusya ve putin için bu caydiricilik olacakti ve rusya savaşa belki girmeyecekti  #Ukraina  #RusyaUkraynaKrizi Ukrayna'ya"
Ukraine,1,"Kalksada ukraina rusyayı altüst etse ne iyi olur bu arada rusya adına savaşmaya hazırlanan #çeçenleri de kınıyorum , #SavaşaHayır ama ben #Ukrania yayı tutuyorum."
Ukraine,-1,"ABD ve NATO, Rusya’ya diz çöktüremeyecek. #Rusya"
Russia,1,Rusya dünyanın en büyük ordusu  Ukrayna saldırırsa daha fazla toprak kaybeder. Doğal olarak savunma yapıyor. NATO’ya girmekten vazgeçmesi en iyisi sanki..
Russia,1,dünyada  herşey eskisi gibi olmayacak rusya özüne döndü kızıl emperyalizm
Ukraine,1,"Işte bu beni duygusal olarak bitirir Çaresizlik hem de 2 kişilik çaresizlik  #Ukrayna ya yardım edin,öylece izliyor Dünya,inanamiyorum.  #SavasaHayır"
Ukraine,-1,"BM, NATO ve dünyanın jandarmasıyım diyen ABD, daha ileri gideyim Rusya’nın dahil olduğu ABD, İngiltere, Çin ve Fransa’nın yer aldığı BM Güvenlik Konseyi. Soğuk savaş döneminde Rusya tehdidi için kurduğunuz bütün yapılar, Ukrayna’ya saldıran Rusya karşısında çöktü."
Ukraine,1,sene 2022 ve Ukrayna'da savaş oluyor çocuklar hayvanlar ölüyor ve elinizden bişey gelmiyor  sene 2022...
Russia,-1,Ukrayna NATO'ya katılmak istiyor ve diyelim ki alındı. Size ne? İsteyen istediği ittifaka katılır.
Russia,-1,Ölü ve yaralılar var ! #1rus dur artık rusya dur !!! #durdurunsavası #Kiev #Ukraina
Ukraine,-1,Rusya Donetsk'te hastane vurdu .
Russia,-1,… İdlib'de 34 askerimizin Rusya tarafından şehit edilmesini bile unutmuş !
Russia,-1,"#SavaşÇıktı bu bir savaş değil, tek taraflı Rusya saldırısıdır; savaş dediğin iki denk güç arasında olur! 😔#UkraineRussie #Ukraina  #NoWar ✊️ #SavasaHayır"
Russia,-1,"mahalle kavgasında olduğu gibi Ukrayna’yı,arkandayız diyerek şişirdiler rus ayısının önüne attılar, AB ve ABD uyduruk yaptırımlar dışında hiçbir şey yapamaz, ABD Irak’a Suriye’ye Afganistana giriyor ama Rusya ve Çin’den çekiniyor, ne Amerika ne Rusya ne Arap tam bağımsız Türkiye"
Russia,-1,rusya suyun icine batsin
Russia,-1,"Rusya gelip güney sınırımıza yerleşti,Putin imparatorluk hayali kuran bir manyak haline geldi.Medeni Ülke'ler ile hareket edip Rus Deccali Putin ve Rus yayılmacılığı durdurulmalı..."
Russia,-1,"📌 İngiltere Dışişleri Bakan Yardımcısı Clevery, İngiltere'nin Rusya Devlet Başkanı Putin'in Ukrayna'ya operasyon emri sonrasında Moskova'ya karşı bugüne kadarki en ağır yaptırımları uygulama kararı aldıklarını duyurdu."
Russia,-1,Ulan Ukrayna'yı Nato'ya almak istiyorsunuz.Rus füze ve uçaklarına karşı önlem alınmaz mı? Önceden Ukrayna'ya savunma sistemi yerleştirilmez mi? Rusya füze ve uçaklarla işi bitirdi neredeyse.#Putin 'in yaşına rağmen beyni çalışıyor.#Biden' ın da Putin gibi spor yapması lazım
Russia,1,Rusya 2. Dünya savaşının Almanyası olacak. Putin'de Hitleri.  #Kyiv
Russia,-1,Rusya'yı durdurmaya çalışmak gibi bir hata yapmazlar umarım. Ukrayna gitti. Bu saatten sonra Ukrayna'yı kurtarmaya çalışmak 3. Dünya Savaşı sebebi olur.
Russia,-1,Bizde atom bombası yokmu şu Rusya'ya ÇİN'E ikişertene salla herkes hizaya gelsin bu böyle devam etmez sürekli köşeye sıkişıyoruz
Russia,1,İşte bu kafa Rusya'yı anlayamaz.  II Dünya savaşında 28 milyon insan kaybetti rusya 18 milyonu asker gerisi sivil. Onlar bilmiyor mu sanki.  Türkiye #Putin #Ukrayna
Russia,1,"Acaba,  Rusya Kievde özel bir operasyon yapıp ABD-İNG hükümetini devirip,Yeni bir hükümet kurulmasına dair bir projesi varmıdır? Böyle bir şey varsa ve gerçekleştirilebilirse kısa zamanda savaş biter ."
Russia,-1,"dildeki küstahlığa bakın..Rusya Dışişleri: ""Batı, Rusya ile diyalog şansını kullanmadı"""
Russia,-1,"Ukrayna halkına olan zararı en başa koyuyorum, savaş çıkartarak Rusya ekonomisini zayıflattın Rusyaya zarar, kaos ortamından bizi sıkıntıya soktun Türkiyeye zarar e bide Avrupa savaşa girmek zorunda kalırsa Avrupaya hepten zarar. Zaten bir şey de kazanamayacan ne yani bu şimdi?"
Russia,-1,"“Rusya’nın metotları, taktikleri, manevraları değişebilir, ama politikasının kutup yıldızı sabit bir yıldızdır: Dünya Hakimiyeti”. K. Marks  İnsanlığın geleceği için Rus saldırganlığı durdurulmalıdır!  Türkiye, saldırgan Rusya ile tüm ilişkilerini yeniden gözden geçirmelidir."
Russia,1,"Batı’nın temkinliliği (korkaklığı) Putin’i cesaretlendirdi. İşgale rağmen hala ekonomik yaptırım tehditlerinden öteye geçemiyorlar. Rusya bunlarla geri adım atmaz. Batı,müttefikler için tam bir hayal kırıklığı. Kürdistan’da yaşananlar karşısındaki tavrı şimdi daha iyi anlaşılıyor"
Russia,-1,"Katil ve istilacı Rusya tarih boyunca yayılmacı  politikasından asla ödün vermedi. Çarlık dönemi, SSCB dönemi ve Federasyon dönemi aynı şerefsiz soykırımcı Rusya var karşımızda. Yakında nükleer ve kimyasal silahlarla kuduz mikrobu saçmaya başlar"
Russia,-1,"Ukraynanın NATOya girmesini istemeyen Rusya, Ukraynayı işgal ederek NATOya komşu olmayı sorun etmiyor???"
Russia,-1,Putin 34 askerimizin katilidir bedeli ne olursa olsun Rusya ile bütün ilişkiler derhal kesilmelidir askerlerimizin intikaminin alınmasının tam zamanıdır
Russia,-1,Eger Rusya başarırsa dünyada savaşın seyri değişir Örneğin  ortadoguda Türkiye rojava veya güney kurdistana saldırır veya mevcut ortadogunun diğer devletleri irak Suriye İran keza Türkiye birbirine saldırır Buda bizim için iyi olmaz  Şayet NATO ab ve ABD kazanırsa bizim için iyi.
Ukraine,-1,"Sen Putin in burnuna kadar gel.Dört bir yandan sarmaya çalış.Rus un inşa ettiği kültür ve dilinin hakim olduğu ülkeleri NATO,Avrupa üyeliği üyesi yapmaya çalış.Rusya nın güvenliği için tehdit oluştur.Putin KGB den gelmiş donanımlı ve soğukkanlı  bir lider.Yer mi?"
Ukraine,-1,"“Olağan, masum tatbikat. Rusya kendi askerini kendi ülkesinde istediği yere koyar”  14 Şubat 2022 👇"
Russia,-1,"Baltık ülkeleri, Ukrayna, Ermenistan, Suriye, Mısır, Akdeniz, Kırım’ı ya kontrol eden ya da onların dostu olan Rusya’nın, yarın Türkiye’ye yani yüzlerce asırlık sıcak deniz sevdasına sulanmayacağını kim garanti edebilir?"
Russia,-1,"Beni NATO ve Rusya'yı aynı anda eleştirdiğim için ""suya sabuna dokunmuyor"" diyerek yaftalayanlar için, alın size sabun. Keyfini çıkarın. Bir şeylerin kutlamasını yapın."
Russia,-1,"Sabah Ulusal Kanalda Vatan Partisi Genel Başkan Yardımcısı Serhan Bolluk'u dinledim dediği şey şu.   ""Bu adım Asya'nın güvenliği ve Türkiyenin güvenliği için atılmış bir adımdır Rusya bütün Asya'yı korumuştur."" dedi.  Ben ortada emperyal bir adım görüyorum."
Russia,-1,Biden: Dünya Rusya'dan hesap soracak.
Russia,-1,#Ukrayna Tarih seni affetmeyecek putin!!!
Ukraine,1,"Ukrayna'nın Ankara Büyükelçisi: ""İstanbul ve Çanakkale boğazlarının Rusya'ya kapatılmasını talep ediyoruz"""
Russia,-1,Yavşak Rusya
Ukraine,-1,"Rusya, AB yi doğalgaz ile tehdit ediyor. Rusya soğuk savaştan sonra paylaşılan topraklardan memnun değil yeni paylaşım için Ukrayna dan başlıyor.  #worldwar3"
Russia,-1,Rusya'da savaş karşıtı yapılan eyleme polisler saldırmış.  Ne kadar da tanıdık gelen kareler... Barışa düşmandır tüm diktatörler.
Russia,-1,"#ABD Savunma Yetkilisi: ""Rusya, Ukrayna hükümetinin 'başını kesmeyi' planlıyor."" #RusyaUkraynaKrizi #Ukrayna"
Russia,1,🚨 İDDİA | Rusya’nın Ukrayna CB Zelenskiy’e Kırım’ın Rusya’ya bağlı olduğunu kabul etmesi ve Luhansk ile Donetsk’in bağımsızlığını tanıması için 12 saatlik bir ultimatom verdiği iddia edildi.
Ukraine,-1,"NATO'ya girmek ümidiyle sevinirken artık tüm ülkeyi kay edecekler,RUSYA gazı kessin de görün bakalım Batı'nın tavrı ne olacak."
Ukraine,-1,"Herkes putine küfür ediyor , emperyalist güçlerle iş birliği yapan halkının geleceğini düşünmeyen , olmayacak hayaller kuran , celladına aşık olan ukrayna peki ? masum mu ? Yazık çocuklara ve yaşlılara üzülüyorummmm 😔"
Russia,-1,Ulan *** koduklarım Filistin'de suriye'de ırak'ta Bosna'da arnavut'lukta Azerbaycan'da müslümanlar ölürken çıt çıkarmayın ukrayna Rusya savaştımı aaoooww savaşa hayır. Tohumunuzun *** koyayım
Ukraine,-1,"Rusya, direk verizi mat edebilir. Vezir düşer."
Russia,1,Savaşa dair son bişey söyliycem  ABD Suriye'den çekildikten sonra  Suriye'de ki petrolün kontrolü kimde  Rusyada  ABD nin ve Rusya'nın can damarı ne  Petrol ve doğalgaz  ABD güçlü bir Avrupa Birliği istermi  Hayır  Avrupa Birliğinin enerji ihtiyacını kim karşılıyor Rusya  👇
