 Kanada Parlamentosu Yakınlarında Meydana Gelen Silahlı Saldırıda Asker ve Silahlı Adam Öldü,2410,0
" Irak, Tutuklanan Kadının IŞİD Lideri El Bağdadi'nin Karısı Olmadığını Söyledi",1263,1
 IŞİD'in ABD'li Gazeteci James Wright Foley'i Kamera Önünde Kafasını Kestiği İddia Edildi,2096,0
" Seth Rogen, Christian Bale'in Steve Jobs Filminde Apple'ın Steve Wozniak'ını Canlandırmaya Hazırlanıyor (Özel)",1575,0
 Nijerya: Ateşkesin bildirilmesinin ardından kaçırılan kız öğrencilerin geri dönmesine yönelik umutlar arttı,455,0
" Birisi 2,5 milyon dolarlık bir arabaya grafiti çizdi",948,-1
 IŞİD'in ABD'li Gazeteci James Foley'in Kafasını Kesmesi YouTube'a Gönderildi,2495,0
Video mesajlaşma hizmeti CNN ses kaydının zamanlamasını doğruladı,2118,0
 Suudi Arabistanlı din adamı kardan adamlara karşı fetva yayınladı,399,1
 ABD'nin havadan silah sevkiyatı IŞİD'in eline geçti: Pentagon,2200,0
" Ottawa, IŞİD'in Kanadalı-İsrailli bir kadını kaçırdığına dair haberleri araştırıyor",1893,0
 Bali Yanlış,1579,0
 Macaulay Culkin Facebook'ta Herkesin Söylediklerine Rağmen Ölmedi,1174,1
 Haber siteleri Putin'in kuş düşürme videosuna kandı,1087,0
" Gene Munster, 499 Dolarlık Çelik Apple Watch, 18 Ayar Altın Sürümü için 4.999 Dolar Öngörüyor",2092,0
 IŞİD Tarafından 'Yakalanan' İsrailli-Kanadalı Kadın 'Güvende ve Emniyette' Olduğunu Söyledi,2302,0
 Christian Bale Steve Jobs'u canlandırmayacak,2211,1
Meksika'da 43 Öğrencinin Kaybolduğu Yerin Yakınında Toplu Mezarlar Bulundu,1912,0
" Dylan Thomas, Derinin Altında Yuva Yapmış Tropikal Örümcek Buldu",1321,-1
 Christian Bale Steve Jobs'u canlandırmayacak,1157,0
 Videoda IŞİD'in foto muhabiri James Foley'i başını keserek öldürdüğü görülüyor,1948,0
" Boko Haram Ateşkesi Reddetti, Kaçırılan Kızların “Evlendirildiğini” Söyledi",2530,0
 Boko Haram ile iddia edilen ateşkese rağmen Nijerya'da isyancılar öldürüldü,600,0
"Bu hafta internette sahte olan neydi: Obama'nın barış ödülü, balkabağı baharatlı prezervatifler ve çılgın kış karı",1060,0
" Beyaz Saray Çit Atlayıcısı Gizli Servis Görevlisini Alt Etti, Ana Katın Çoğu Yerinden Koştu",1017,1
 Köpekler cennete gider... ve kediler ve atlar: Papa genç çocuğa cennette hayvanlar için de bir yer olduğunu garanti etti,1905,1
 Gazeteci James Wright Foley'in IŞİD cihatçıları tarafından ABD'ye 'mesaj' olarak başının kesilmesinden endişe ediliyor,1679,0
Irak medyası: IŞİD militanları Ebola'ya yakalandı,1891,0
 Çin App Store'da Manipülasyon Yapan Fotoğraf Viral Oldu - Peki Gerçek mi?,2420,0
" Christian Bale, Steve Jobs filminden ayrıldı",2455,0
IŞİD'in Ebola'sı Var mı? Muhtemelen Yok! Medya Bunu Bildiriyor,2075,0
 James Foley'in kafasının kesilmesi: Londra'lı rapçi ve cihatçının Suriye'de bir gazetecinin öldürülmesiyle ilgili soruşturma altında olduğuna inanılıyor,951,0
 Nikaragua'nın başkenti yakınlarında bildirilen patlamanın meteor çarpmasından kaynaklandığı iddia edildi ancak NASA da dahil olmak üzere uzmanlar iddialara şüpheyle yaklaşıyor,2264,0
 Teksaslı Tesisatçı Suriye'deki Aşırılıkçıların İş Kamyonuyla Nasıl Başa Çıktığından Emin Değil,2145,1
" Brian Williams: Hayır, Meteoroloji Uzmanımız Canlı Yayında İşemiyordu",975,1
" Muhasebeci, Comcast'ın Sahte Suçlamalara İtiraz Ettiği İçin Kendisini İşten Çıkardığını Söyledi",2405,0
 İç Güvenlik Bakanlığı teröristlerin ABD-Meksika sınırını geçmediğini söyledi,2016,1
 Örümcek Avustralyalı Adamın Apandisit Yarasına Girdi (VİDEO),1502,1
 ABD'li yetkililer: Video Amerikalı'nın infazını gösteriyor,481,0
 Devam Eden Şiddet Boko Haram Ateşkesini Tehlikeye Atıyor,1588,0
 Çinlilerin İngilizce isim seçmesi için ipuçları,1660,1
" Obama yönetimi, kongre üyesinin 'en az on IŞİD savaşçısının Meksika sınırından Teksas'a geçerken yakalandığı' iddiasını yalanladı",1946,0
" 48 dakika ölü kalan bu Katolik Rahip, Tanrı'nın kadın olduğunu iddia ediyor",1407,1
"'Star Wars VII' Haberleri, Güncelleme: JJ Abrams Filmin Yaz Aylarında Vizyona Girmesini Mi İstiyor?",1843,0
 Evsiz Bir Adama 100 Dolar Verdikten Sonra Gizlice Onu Kameraya Çekti...,794,-1
 IŞİD katili 'Cihatçı John'un adı Muhammed Emwazi olarak açıklandı,1800,0
" CNN, Michael Brown Saldırısından İddia Edilen Ses Kaydını Yayımladı",2149,0
" Mohammed Emwazi: IŞİD katili olarak tanımlanan 'Cihatçı John', 2010 yılında Afrika'da safari tatilindeyken MI5 tarafından 'durduruldu'",872,0
 Nijerya'daki Boko Haram Ateşkesi'nin Ateşkes Olmadığı,1681,0
"NBC Nightly News, işeyen bir adamla canlı yayın mı yaptı?",1333,0
 James Foley'in kafasının kesilmesi: Londra'lı rapçi ve cihatçının Suriye'de bir gazetecinin öldürülmesiyle ilgili soruşturma altında olduğuna inanılıyor,1202,0
 Kayıp Amerikalı gazetecinin IŞİD tarafından başının kesildiği bildirildi,311,0
 Bu Evsiz Adamın Yüz Dolar Harcamasını İzleyin ve Bir Mendil Bulundurun [Video],1020,1
 IŞİD'in infazcısı 'Cihatçı John'un Muhammed Emwazi olduğu ortaya çıktı,2123,0
" Kadın, Erkek Arkadaşı Tarafından Terk Edildikten Sonra Tüm Haftayı KFC'de Geçirdi",1523,1
 Nikaragua'nın başkenti Managua'da meteor krater açtı,2475,-1
" NASA, Nikaragua Meteorit Raporları Hakkında Şüpheleri Artırıyor",966,-1
" Ürdün Kralı, IŞİD'e yönelik hava saldırılarına KENDİSİ mi liderlik edecek? Raporlara göre, eğitimli pilot, Kongre üyelerine Clint Eastwood'un Unforgiven'ından alıntı yaptıktan sonra saldırıya katılmayı planlıyor",2490,0
 James Foley Katili 'Cihatçı John'un Eski Londra Rapçisi Abdel-Majed Abdel Bary Olduğuna İnanılıyor,1314,0
Irak medyası: IŞİD militanları Ebola'ya yakalandı,1615,0
 İzle: ABD'li denizci Afganistan'da Taliban keskin nişancısının kafasından vurularak öldürüldü,2360,1
Kuzey Kore diktatörü Kim Jong-un 'İSKOÇYA'da yeni bir restoran açmaya hazırlanıyor',1756,0
 Rapor—Jose Canseco bu gece evinde yanlışlıkla ateş açtı,1154,0
" 'Amerikan bombalaması ölüm fermanımı imzaladı': Kayıp ABD'li gazeteci James Wright Foley, Obama'ya bir uyarı olarak IŞİD'in korkunç videosunda başını kesmesine rağmen yılmadan ölüme gidiyor",928,0
" DNA testleri, Lübnan DEAŞ'ının sahte pasaportlarla yakalandıktan sonra DEAŞ lideri el-Bağdadi'nin eski eşini ve kızını tuttuğunu kanıtlıyor",1004,0
 IŞİD savaşçıları 'Ebola'ya yakalandı',2060,0
 Kim Jong-un: Obez liderin 'her iki ayak bileği kırıldı',1854,0
" Köpek eti çorbası isteyen var mı? Kim Jong-Un, İskoçya'da Kuzey Kore lezzetleri satan bir restoran açmayı düşünüyor",2192,0
" Hayır, o kırık kalem çizimi Banksy'ye ait değil",1688,0
" Hayır, Ürdün Kralı II. Abdullah bizzat IŞİD'e karşı uçak uçurmuyor",2274,1
 Josh Paler Lin Evsiz Bir Adama 100 Dolar Veriyor ve Nasıl Harcadığını Görmek İçin Onu Takip Ediyor,1996,1
 Durex Balkabağı Baharatlı Kondom Üretmiyor: Bir Aldatmaca Çürütüldü,2055,1
 Kayıp Amerikalı gazetecinin IŞİD tarafından başının kesildiği bildirildi,2495,0
Rapor: Christian Bale Steve Jobs Filminden Vazgeçti,2343,0
"Türkiye Cumhurbaşkanı, Kürt savaşçılara yönelik Amerikan silah yardımının, malzemelerin IŞİD'in eline geçmesinin ardından 'yanlış' olduğunu söyledi",1363,1
" McDonald's Ocak Ayında Fazla Kilolu Müşterilerine Hizmet Vermeyi Durduracak mı? Hayır, '15/01/2015' Hikayesi Sahte",2184,-1
 Nikaragua 'göktaşı' konusunda sorular gündeme geldi,1056,0
 IŞİD'in Suriye 'başkenti' üzerinde Predator tipi insansız hava araçları uçuruldu,2129,0
" Nadir görülen bir meteor çarpması, Nikaragua'nın başkenti Managua'da patlamaya neden oldu",1790,0
" Hayır, Balkabağı Baharatlı Kondomlar Gerçek Bir Şey Değil",2354,1
" Raporda, Kim Jong-un'un kırık ayak bileklerinin onarılması için ameliyat olduğu iddia edildi",1854,0
" Kayıp Libya uçağı, Kuzey Afrika'da 11 Eylül benzeri saldırı korkularını tetikledi",1372,-1
" Öfkeli kalabalık, tecavüz girişimi iddiasıyla bir adamın cinsel organını kasap bıçağıyla kesti",2115,1
 Yeni politika esrar bulundurma tutuklamalarını azaltabilir,2217,0
" IŞİD destekçileri, Suriye'de koalisyonun hava saldırısında rehin tutulan ABD vatandaşının öldürüldüğünü iddia etti",1337,0
" IŞİD, 2000 yıl önce Romalılara karşı kullanılan bir taktik olan panik yaymak için canlı AKREPLER içeren bombalar kullanıyor",1251,1
 IŞİD'in İnfazcısı 'Cihatçı John'un Adı Muhammed Emwazi Oldu,1724,0
" David Haines IŞİD Tarafından Kafası Kesilerek İnfaz Edildi, İnfaz Videosu İngiltere'ye Yönelik Tehditler İçeriyor: Raporlar",1989,1
" Video Mesajlaşma Uygulaması, Michael Brown'ın Vurulmasıyla İlgili Ses Kaydının Gerçek Olduğunu Söylüyor",2317,0
Nijerya'da bildirilen saldırıların ardından Boko Haram'ın 'ateşkesi' şüpheyle karşılanıyor,1821,1
 72 Milyon Dolar Kazanan Liseli Tüccarın Hikayesi Kontrolden Çıkmış Bir Söylenti,2052,0
" IŞİD, ""Amerika'ya Mesaj"" başlıklı videoda, 2012 yılında kaçırılan Amerikalı gazeteci James Wright Foley'in kafasını kesiyor",1658,1
 Kaçırılan Gazeteci James Wright Foley'in IŞİD Tarafından İnfaz Edildiği İddia Edildi,2524,0
 IŞİD militanlarının açıklamasına göre Ürdün hava saldırısında rehin tutulan Amerikalı yardım görevlisi öldürüldü,977,0
 Yolcu Dulles Havaalanına Tehlikeli Madde Kıyafeti Giydi,1826,1
" Boko Haram ateşkesi yalanladı, kaçırılan kızların evlendiğini söyledi",2530,0
 Çalınan Batmobile Davası Çözüldü,1529,0
 Michael Brown'ı Öldüren Silah Seslerinin İddia Edilen Ses Kaydı Bir Sahtekarlık mı?,2481,0
 Rapor—Jose Canseco bu gece evinde yanlışlıkla ateş açtı,869,0
 Kod/Kırmızı: Apple Watch Pil Ömrü — “Her Gece Şarj Edin”,1898,0
 Macaulay Culkin Öldü mü? Facebook'ta Bir Ölüm Sahtekarlığı Daha Dolaşıyor,1805,1
 13 yaşında yedi kız çocuğu okul gezisinde hamile kalıyor,2304,0
" Irak, Lübnan'da gözaltına alınan kadının Bağdadi'nin eşi olmadığını söyledi",2283,-1
" İzle: IŞİD, ABD'nin Havadan Attığı Silahları Ele Geçirdiğini İddia Ediyor",2509,0
 Nijerya: Ateşkesin bildirilmesinin ardından kaçırılan kız öğrencilerin geri dönmesine yönelik umutlar arttı,2191,0
 Rapçinin James Foley'nin celladı olduğu ortaya çıktı: haberler,330,0
 IŞİD Lideri El-Bağdadi “Ölmedi”,1645,0
 Hafta Sonu Nikaragua'ya Bir Göktaşı mı Düştü?,2154,0
Nijerya'da bildirilen saldırıların ardından Boko Haram'ın 'ateşkesi' şüpheyle karşılanıyor,1681,0
Saddam Hüseyin'in pilotları IŞİD grubuna eğitim veriyor,2408,0
" Herkes Rahatlasın, Banksy Tutuklanmadı ve 35 Yaşındaki Bir Adam Olarak Ortaya Çıkmadı",1884,1
 IŞİD videosu kaçırılan gazeteci James Foley'nin kafasının kesildiğini iddia ediyor,1744,0
Apple Watch'un Güç Rezervi özelliği kısa pil ömrüyle mücadele ediyor,1911,0
 Meksika'daki Toplu Mezardaki Cesetler Görünüşe Göre Kayıp Öğrencilere Ait Değil,1109,1
" İngiliz rehine David Haines, IŞİD teröristleri tarafından başı kesilerek öldürüldü",2241,0
" Pantolon Ateşi: Duncan Hunter, Sınır Devriyesinin en az 10 IŞİD savaşçısını yakaladığını doğrulanmamış bir iddiada bulundu",2266,0
 Kaçırılan Gazeteci James Wright Foley'in IŞİD Tarafından İnfaz Edildiği İddia Edildi,1016,0
" Nadir görülen bir meteor çarpması, Nikaragua'nın başkenti Managua'da patlamaya neden oldu",1722,0
 Jose Canseco kendi eline ateş etti,1697,0
 24 yıl izne çıkan Hintli işçi işten çıkarıldı,2441,1
 Bali Yanlış,1883,0
 Michael Brown'ın vurulma sesi kayda mı alındı?,149,0
" Obama, Başının Kesilmesinden Öfkelendi, Yola Devam Etme Sözü Verdi",1966,1
" Avukat: Yeni ses kaydı, Michael Brown vurulduğunda silah sesindeki duraklamayı ortaya koyuyor",1605,0
 Axl Rose ÖLMÜYOR: Sahte MSNBC Ölüm Aldatmacası Facebook'ta Viral Oldu,2525,1
" Bendim! 19 yaşındaki öğrenci, gökyüzündeki Teletubbies'in kıkırdayan bebeği olduğunu ve kendisine sadece 250 £ ve bir kutu oyuncak ödendiğini açıkladı",1623,1
"Batmobile ""Batman v Superman: Adaletin Şafağı"" Setinden Çalındı, Zack Snyder Kimin Yaptığını Biliyor",672,-1
 Meksikalı araştırmacılar toplu mezarda 43 kayıp öğrencinin olabileceğinden endişe ediyor,2334,0
" BATMOBILE ÇALINTI DEĞİL, MTV YARIŞMA ÖDÜLÜ SAHİPLENİLMEDİ",1459,0
Nijerya'da bildirilen saldırıların ardından Boko Haram'ın 'ateşkesi' şüpheyle karşılanıyor,1027,1
 Söylenti: Apple Watch'ta 512 MB RAM ve 4 GB depolama alanı olacak,1585,0
" Hükümet, 24 yıl işe gelmeyen çalışanı işten çıkardı",2134,1
 Kim Jong-un 'peynir yemekten o kadar şişmanladı ki ayak bileklerini kırdı',2053,0
" 'Amerikan bombalaması ölüm fermanımı imzaladı': Kayıp ABD'li gazeteci James Wright Foley, Obama'ya bir uyarı olarak IŞİD'in korkunç videosunda başını kesmesine rağmen yılmadan ölüme gidiyor",1116,0
 #Hairgate: iPhone 6'nın saç ve sakalları kopardığına dair haberler muhtemelen abartılı,2276,0
" IŞİD, kayıp ABD'li gazeteci James Foley'nin başının kesilerek öldürülmesini gösteren videoyu yayınladı",1721,0
" Christian Bale, Danny Boyle'un Biyografisinde Steve Jobs'ı Canlandırmak İçin Görüşmelerde",1215,0
" HBO yayın hizmeti nisan ayında aylık 15 dolardan başlatılabilir, Apple TV üzerinde çalışılıyor",75,0
 Michael Brown'ın vurulma sesi kayda mı alındı?,120,0
" iPhone Oyun Geliştiricisi, Oyununun İçine Şimdiye Kadarki En Harika İstifa Mektubunu Saklayarak İşinden Ayrıldı",2328,1
 'Banksy' Paris Saldırısına Duygusal Çizimle Tepki Gösterdi,1688,0
" Nijerya Boko Haram'la Ateşkes Sağladığını Söylüyor, Peki Doğru Kişiyle mi Görüşüyorlar?",2356,0
 ABD'nin IŞİD'e yanlışlıkla hava yoluyla silah ulaştırdığı iddia ediliyor,2168,0
 Texas City tesisatçısının kamyonu Suriye savaşında son buldu,1950,1
 IŞİD'in ele geçirdiği jetlerde savaş pilotlarına eğitim verdiğini gözlem grubu söylüyor,630,0
 Kongre Üyesi: 'En az 10 IŞİD savaşçısı' ABD'ye geçmeye çalışırken yakalandı,2385,0
 12 inç Retina MacBook Air çıkış tarihi söylentileri: 2015 için yepyeni 12 inç MacBook Air tasarımı WWDC'de mi tanıtılacak?,1362,0
" IŞİD, Amerikalı foto muhabiri James Wright Foley'i kafasını kesti, daha fazlasının geleceğini tehdit etti",1948,0
" Video: IŞİD, Kobani Yakınlarında ABD Silahlarını Havadan Attığını Ele Geçirdiğini İddia Ediyor",1076,0
" ABD, El Kaide Bağlantılı Somali Grubunun Liderinin Öldüğünü Söyledi",1982,0
"Türkiye Cumhurbaşkanı, Kürt savaşçılara yönelik Amerikan silah yardımının, malzemelerin IŞİD'in eline geçmesinin ardından 'yanlış' olduğunu söyledi",2172,1
" James Foley: Amerikalı Gazeteci James Wright Foley, Yeni IŞİD Videosunda Başı Kesildi [Son Dakika Haberleri]",2067,1
 İnfazcılar tecavüzcünün penisini kesti,1476,0
 YPG Doğruladı: Gill Rosenberg Kobani'de Yakalanmadı,26,1
 Boko Haram'ın Nijeryalı kız öğrencileri kaçırmasının üzerinden altı ay geçtikten sonra onları serbest bırakmak istediği bildirildi,1588,0
" 'Bağdadi'nin yavrusu': Bu çocuk, IŞİD'in çocuk asker kullanımının en genç kurbanı mı oldu?",1024,0
 Rapor: Eski Beyzbol Yıldızı Jose Canseco Evde Kazayla Vuruldu,2000,0
Meksika'da 43 Öğrencinin Kaybolduğu Yerin Yakınında Toplu Mezarlar Bulundu,983,0
 Genç Borsada 72 Milyon Dolar Kazandı,1563,-1
 Kanadalı kadının IŞİD tarafından kaçırıldığı iddiasıyla ilgili çelişkili haberler,1976,0
"Meksika, toplu mezarda kayıp 43 öğrencinin bulunup bulunmadığını araştırıyor",1156,0
" NASA, Nikaragua'daki kraterin meteordan kaynaklanıp kaynaklanmadığını sorguluyor",1056,1
 İnfazcılar tecavüzcünün penisini kesti,1981,1
" WSJ: Apple, dengesiz sensörler nedeniyle saatin sağlık özelliklerini kesti",1750,0
" IŞİD militanlarının, kaçırılan Amerikalı gazeteci James Wright Foley'in kafasını kestiği çarpıcı videoda ortaya çıktı",2495,0
 Kim Jong-un 'İSKOÇYA'da yeni bir restoran açmaya hazırlanıyor',2192,0
" NASA, Managua patlamasının bir meteor olmadığını öne sürüyor",1573,1
" İslamcı terörist Cephet Ensar el Din, Suriye'de uçaksavar silahıyla donatılmış Teksaslı tesisatçının kamyonunun fotoğrafını tweetledi",2242,1
" Yetkililer ve ailesi, Amerikalı gazetecinin başının kesildiğini gösteren videonun gerçek olduğuna inandıklarını söyledi",2450,1
 Christian Bale Steve Jobs'u canlandırmayacak,2455,0
 Çit atlayan Beyaz Saray'a daha da yaklaştı,1274,0
" Kaçırılan Nijeryalı kız öğrenciler: Hükümet, kayıp kızları eve getirecek Boko Haram ile ateşkes anlaşması yapıldığını iddia ediyor",1419,0
" SON DAKİKA HABERİ: IŞİD, ABD'ye Irak'ta eylemi durdurması yönünde uyarıda bulunmak amacıyla kayıp Amerikalı gazeteci James Wright Foley'in kafasını kesti",1744,0
" Milletvekilleri, Parlamento Tepesi'ndeki silahlı saldırıda hayat kurtardığı için çavuşa teşekkür etti",611,0
 IŞİD videosu kaçırılan gazeteci James Foley'nin kafasının kesildiğini iddia ediyor,933,0
" CNN, Michael Brown'ın Vurulmasıyla İlgili İddia Edilen Ses Kaydını Çaldı Polisin Militarizasyonu",1605,0
 Beyaz Saray Çit Atlayıcısı Aslında İçeride Oldukça Uzaklara Ulaştı,2303,0
 Batman Yaklaşan Biyografide Steve Jobs'ı Canlandıracak,1299,-1
 Sokak Sanatçısı BANKSY Yine Mi Tutuklandı?,949,0
 Michael Brown'ın vurulduğuna dair iddia edilen ses kaydı yayımlandı,1817,0
" NASA, Nikaragua'daki kraterin meteordan kaynaklanıp kaynaklanmadığını sorguluyor",1731,-1
 IŞİD Liderinin Eşi ve Oğlunun Tutuklanması,703,-1
" Rapor: Paslanmaz çelik Apple Watch'un fiyatı 500 dolar, altının fiyatı ise 5.000 dolar olacak",1425,0
 Doğrulanmamış videoda yardım görevlisi David Haines'in başının kesildiği görülüyor,2206,0
 Vogue'un yeni dükkanında farelerin cirit attığı iddia ediliyor,1693,0
" Hayır, Robert Plant 800 Milyon Dolarlık Bir Sözleşmeyi Parçalamadı",2489,0
 ŞOK İDDİA: PGA Golfçüsü Tiger Woods'un Uyuşturucu Testinin Başarısız Olması Nedeniyle Askıya Alındığını Söyledi,1417,0
 IŞİD Ebola'ya Yakalanıyor,1669,0
 Rus Yeti mi Yoksa Bigfoot Sahtekarlığı mı? Yeni Görüntüler Tartışmayı Alevlendirdi,2377,0
" Yeni Ses Kaydı, Michael Brown Vurulduğu Sırada Silah Seslerinde Duraklama Olduğunu Gösteriyor: Avukat",1446,0
" IŞİD, ABD'li gazetecinin kafasını kestiğini iddia ediyor",2495,0
 Bu dünyanın en eski burgeri mi? Adam McDonald's Quarter Pounder'ı 20 YIL sakladığını iddia ediyor,2474,0
 CNN ses kaydı: Michael Brown'ın vurulduğu an bu mu?,2317,0
 Bu Adam Noel İçin Ebeveynlerinin İpoteğini Ödedi,1599,0
" Görgü Tanığı, Evsiz Adamın Viral Videosunun Sahnelendiğini Söyledi",2061,-1
 Sokak Sanatçısı BANKSY Yine Mi Tutuklandı?,48,0
" CNN, Michael Brown saldırısına ait olduğu iddia edilen ürpertici ses kaydını yayınladı: ""En az 11 el ateş""",1817,0
" Köpek eti çorbası isteyen var mı? Kim Jong-Un, İskoçya'da Kuzey Kore lezzetleri satan bir restoran açmayı düşünüyor",2309,0
" Christian Bale, Steve Jobs'ı Canlandırmak İçin Görüşülüyor (Özel)",72,0
 IŞİD'e Daha Fazla Amerikan Silahı,2200,0
 Apple Watch pilinin her gece şarj edilmesi gerekecek,1898,0
 ABD'li rehine Luke Somers kurtarma operasyonu sonrasında hayatını kaybetti,892,0
 Son dakika: Ottawa'daki Ulusal Savaş Anıtı'nda asker vuruldu,1071,0
 Sugarhill Çetesi'nden Big Bank Hank 57 yaşında öldü,2080,1
" Lynch çetesi, bir genci tecavüz etmeye çalışırken yakaladığı adamın penisini kesti",1981,1
" Tiger Woods'un uyuşturucu testinde başarısız olduğu için cezalı olmadığı, menajeri ve bir PGA yetkilisi tarafından belirtildi",2330,1
Bendgate'ten hairgate'e: Artık iPhone 6 kullanıcıları cihazın saçlarını yolduğundan şikayetçi,2276,0
 Sugarhill Çetesi'nin Büyük Bankası Hank 57 Yaşında Öldü,2398,1
 Pentagon: Somali'de hava saldırısında terör lideri öldürüldü,839,1
 IŞİD'in infazcısı 'Cihatçı John'un Muhammed Emwazi olduğu ortaya çıktı,2349,1
 İskoçya tren istasyonunda bavulla terk edilmiş köpek,2523,1
" Ebola, Musul'daki IŞİD militanlarına bulaştı mı?",1506,0
Michael Brown'ın vurulduğu anı ses kaydının kaydettiği iddia ediliyor,1916,0
"Nijerya, Boko Haram ile ateşkesin kabul edildiğini duyurdu",840,0
" Avukat: Yeni ses kaydı, Michael Brown vurulduğunda silah sesindeki duraklamayı ortaya koyuyor",721,0
 Beyaz Saray Çit Atlayıcısı Aslında İçeride Oldukça Uzaklara Ulaştı,1488,0
"Geri döndü! Muhteşem yeni Batmobile, ÇALINDIĞI söylentilerinin ardından Detroit'te tur atıyor...",1737,0
 Libya: Kayıp Libya Uçakları Güvenlik Endişelerine Yol Açtı,1312,1
 Rus Adam Uyandığında Testislerinin Çalındığını Buldu,845,1
" Michael Phelps'in kendini ilan eden kız arkadaşı, ERKEK olarak doğduğunu söylüyor ve Olimpiyat şampiyonuyla yaşadığı 'inanılmaz' seksin sırrını açıklıyor",494,1
" Vay Canına, Paul Rudd Homofobiği Deviren Havaalanı Kahramanlarından Biriydi",1094,0
" Kalbi kırık kız, terk edildikten sonra bir haftayı KFC'de geçirdi",159,0
 Cook'un Apple Watch'un duşa dayanıklı olduğunu ve bir gün sürdüğünü doğruladığı söylendi,2472,0
 Nikaragua'daki meteor çarpması uzmanları şaşırttı,1213,-1
" Nadir görülen bir meteor çarpması, Nikaragua'nın başkenti Managua'da patlamaya neden oldu",2264,0
 Bosna-Hersek: Yedi İlkokul Öğrencisi Beş Günlük Geziden Sonra Hamile Kaldı,1804,1
" Hayır, Banksy tutuklanmadı (iç çekiş)",1940,1
" IŞİD, Amerikalı foto muhabiri James Foley'i idam ettiğini iddia ediyor",1679,0
 IŞİD Sınır Krizi: DHS Şefi Teröristlerin Meksika Üzerinden ABD'ye Girmediğini Söyledi,1185,0
" Brian Williams, NBC Haber Meteoroloji Uzmanının Yayındayken Karda İşemediğinde Israrcı",1829,-1
 “Axl Rose 2014'te öldü”: Guns N' Roses'ın solisti internetteki ölüm yalanıyla öldürüldü,1859,1
 Michael Brown Saldırısının Ses Kaydının Ortaya Çıktığı Bildirildi,693,0
" Muhasebeci, Comcast'ın Sahte Suçlamalara İtiraz Ettiği İçin Kendisini İşten Çıkardığını Söyledi",451,0
 Sugarhill Gang Rapçisi 'Big Bank Hank' 57 Yaşında Öldü,2398,1
 YPG Doğruladı: Gill Rosenberg Kobani'de Yakalanmadı,2302,0
 Christian Bale Sonuçta Steve Jobs'u Oynamayacak,2455,0
" İslamcı Militanlar Libya'da 11 Ticari Uçağı 'Çaldı', Terör Saldırısı Korkularını Artırdı",920,0
 IŞİD: ABD'nin havadan attığı silahlar ve mühimmatlar bizim elimizde,2295,0
 24 yıl işe gitmeyen adam sonunda kovuldu,829,1
" İzle: ABD Deniz Piyadesi, Taliban keskin nişancısı tarafından vurulduktan sonra kaskı sayesinde kurtarıldı",488,1
 Comcast Tor'u engelliyor,2177,-1
 Kenya'daki alışveriş merkezi katliamını emreden Eş-Şebab liderinin Somali'deki ABD insansız hava aracı saldırısında öldürüldüğü düşünülüyor,1176,0
" İZLE: Stan Beaton, telefon mühendisleri ölen eşinin sonsuza dek kaybolduğunu düşündüğü değerli sesli mesaj kaydını bulduğunda sevinç gözyaşları döküyor",996,1
 IŞİD Lideri Ebubekir el-Bağdadi'nin Eşi Lübnan'da Tutuklandı,509,0
"Meksika öğrenci katliamıyla sarsıldı: En az 17 yolsuzluk karşıtı protestocu 'toplandı, öldürüldü ve toplu mezara atıldı' - ve 26 kişi daha kayıp",2334,0
 Nikaragua'nın başkenti Managua'da meteor krater açtı,1573,-1
 Kayıp Amerikalı gazetecinin IŞİD tarafından başının kesildiği bildirildi,2450,0
"Nijerya, kaçırılan kızların serbest bırakılması için Boko Haram ile anlaşma yaptığını duyurdu",557,0
 IŞİD Sınır Krizi: DHS Şefi Teröristlerin Meksika Üzerinden ABD'ye Girmediğini Söyledi,742,0
 Kansas City'de Ebola vakası olmamasına rağmen söylenti viral oldu,1943,1
" İzle: IŞİD, ABD'nin Havadan Attığı Silahları Ele Geçirdiğini İddia Ediyor",2404,0
" IŞİD, YouTube Videosunda Amerikalı Foto Muhabirinin Kafasını Kesmiş Gibi Görünüyor",903,0
" Apple Watch fiyatlandırması: Altın versiyon için 5000 dolar, paslanmaz çelik versiyon için 500 dolar harcar mısınız?",2419,0
" Ebola, Musul'daki IŞİD militanlarına bulaştı mı?",1891,0
 Yetkililer: Bölge Kasabasının Ebola Karantinası Altında Olduğuna Dair Haber Yanlış,1467,1
 Kız arkadaşı küçük penisi yüzünden terk edince adam erkekliğini kesip çöp kutusuna attı,2496,1
 Kim Jong-Un'un Kız Kardeşi Kuzey Kore'de Kontrolü Ele Geçirdi,2473,0
" Christian Bale, Sony'nin Bir Sonraki Biyografisinde Steve Jobs'ı Canlandırmak İçin Görüşmelerde",1217,0
 IŞİD Görünüşte Amerikalı Gazeteci James Wright Foley'in Başını Kesti,2495,0
" İki GOP Kongre Üyesi, Şüpheli Teröristlerin ABD-Meksika Sınırını Geçerken Yakalandığını Söyledi",2261,0
" Iraklı Yetkili, IŞİD Savaşçılarının Ebola Hastalığına Yakalandığına Dair 'Asılsız' İddiaları Reddetti",2003,0
" Doğrulanmamış raporlar, Kanadalı-İsrailli Gill Rosenberg'in IŞİD tarafından yakalandığını iddia ediyor",1976,0
" Hayır, Tiger Woods'un Mälaren Gölü'ndeki bir adayı satması değil",1375,-1
 Üst Düzey Batılı İstihbarat Yetkilisi Londra Rapçisi Abdel Majed Abdel Bary'nin Foley Cinayetinde Şüpheli Olduğunu Doğruladı,1530,0
 Kansas City'de Ebola Korkusu,2104,0
 El Kaide rehinesi baskında öldürüldü,1988,0
 Banksy 'Tutuklandı ve Gerçek Kimliği Ortaya Çıktı' Geçtiğimiz Yılki Sahtekarlığın Aynısı,2468,1
