Headline,Body ID,Stance
HORROR: ISIS Fighters Have Reportedly Contracted Ebola,1506,0
The Guy Who Said a Spider Burrowed Under His Skin? Experts Say…,2338,0
Big Bank Hank dead: Sugarhill Gang member and rapper dies aged 57,2340,0
"Google to buy big chunk of Pacific Shores, iconic Redwood City office park",2078,1
ISIS Getting Ebola,1891,0
James Foley remembered as 'brave and tireless' journalist,2388,0
Parliament Hill shooting: Sergeant-At-Arms Kevin Vickers the family hero who took down Ottawa gunman,2113,0
CNN Airs Alleged Audio from Michael Brown Shooting,1817,0
Seth Rogen Eyed to Play Apple's Steve Wozniak in Christian Bale's Steve Jobs Movie (Exclusive),1746,0
Amazon Reportedly Planning An Ad-Supported Video Service That Will Be Cheaper Than Netflix,2152,0
The Chinese Guide to Avoiding a Bad English Name,2260,-1
Resetting iOS 8 Preferences May Wipe iCloud Files,1351,0
Audio recording of Michael Brown being gunned down WAS made at the time he was killed: App company appears to confirm tape of ELEVEN bullets being fired - including final volley of 'kill shots',2481,0
Hundreds of Palestinians flee floods in Gaza as Israel opens dams,158,1
"Islamic State training fighter pilots in captured jets, monitoring group says",2406,0
ISIS Reportedly Beheads American Photojournalist in Iraq,1016,0
Nigeria says ceasefire agreed with Boko Haram,2463,0
"Nigeria, Boko Haram reach ceasefire deal, kidnapped girls to go free, official says",1761,0
Isis militants claim to have killed US journalist James Foley,1966,0
"""Categorically False"": DHS Debunks Right-Wing Fiction That ISIS Attempted To Cross The U.S.- Mexico Border",2266,0
Islamic State releases video apparently showing the beheading of missing US journalist James Foley,2067,0
"Are missing students in mass graves found near Iguala, Mexico?",1427,0
"No, it's not Tiger Woods selling an island in Lake Mälaren",383,1
Met police denies reports of Banksy arrest,2051,1
Robert Plant ripped up $800M Led Zeppelin reunion contract,734,0
North Korea dictator Kim Jong-un undergoes surgery after breaking both ankles on military tour,2022,0
20-year-old burger: McDonald's Quarter Pounder looks eerily new after 2 decades,1586,0
Is Durex Planning To Release A Pumpkin Spice Condom?,1833,0
Macaulay Culkin Dead: Internet Death Hoax Claims Actor Found Dead In Apartment,1805,1
"No, Banksy Didn't Create That 'Charlie Hebdo' Tribute Cartoon, But That Doesn't Mean You Can't Appreciate It",1532,1
New Audio Recording From Ferguson May Capture Michael Brown Shooting,2317,0
Missing American journalist reportedly beheaded by Islamic State ,1948,0
"Rodney Constantine, Newfoundland Suspect, Keeps Facebook Pledge To Turn Himself In",828,1
Seth Rogen Is Woz,190,0
Man has his PENIS cut off by angry mob after 'attempted rape' of teenager,2005,1
Christian Bale will not play Steve Jobs,428,0
CNN Airs Alleged Audio from Michael Brown Shooting,2118,0
Boyfriend cuts off his penis and throws it in the bin after girlfriend dumps him for being bad in bed,522,0
"Tropical spider burrows under man's skin, lives there for three days",800,0
Militant Group Says It Killed American Journalist in Syria,903,0
"PGA Tour Pro Claims Tiger Woods Is Currently Suspended For PEDs, Compares Him To Lance Armstrong",1718,0
NEWS/ All Dogs Go to Heaven! Pope Francis Confirms Paradise Is Open to All of God's Creatures,1905,1
Wife and son of Isil leader Abu Bakr al-Baghdadi 'detained at Lebanon border',1468,-1
Doubts cast over Nicaragua meteorite claim,1825,0
"James Foley, Missing American Photojournalist, Reportedly Executed By ISIS In Syria",694,0
Axl Rose Dead? Fans Freak Out Over Death Rumors,2166,1
Missing jetliners raise fear of new 9/11-style attacks after Libyan airport falls to Islamic militants,396,1
Who Should Play Steve Jobs Now That Christian Bale Quit?,1841,1
Penis Spray-Painted on a $2.5 Million Car Was Just for a Prank Video,1453,1
"Hundreds of dog-lovers from around the world offer home to pet abandoned at the railway station with a suitcase containing his pillow, toy, bowl and favourite food",1642,1
Isis claims to behead US journalist,1589,0
Obama administration DENIES congressman's claim that 'at least ten ISIS fighters have been caught coming across the Mexican border in Texas',2367,-1
ISIL Beheads American Photojournalist in Iraq,726,1
Man Known as ‘Jihadi John’ Is Identified as Mohammed Emwazi,1780,0
ISIS Extremists Claim to Behead British Hostage David Haines,1989,0
Sugarhill Gang rapper Big Bank Hank dies aged 57,1637,-1
Video messaging service verifies timing of CNN audio recording,1605,0
"Apple to Take Reservations for Trying On Apple Watch, Considered Platinum Model",2056,0
US drones hunt Isis leader in Syria,1740,1
Islamic Militants Post Video Claiming to Show Beheading of U.S. Journalist,694,0
ISIS Appears To Behead American Photojournalist In YouTube Video,1471,0
"James Foley: American Journalist, James Wright Foley Beheaded in New ISIS Video [Breaking News]",1589,1
Does ISIS Have Ebola? Probably Not! Media Reports It Anyway,1778,1
"McDonald’s Removing Big Mac, Apple Pies And Eliminating Large Size Options",1777,-1
"Confusion swirls, details murky in arrest of ISIS leader's 'wife'",1263,0
Large space object slams Nicaragua’s capital as asteroid passes Earth,1731,0
US officials: Video shows American's execution,456,0
Journalist James Wright Foley reportedly beheaded by ISIS,1721,0
"Dead for 48 minutes, this Catholic Priest claims God is female",2240,1
"No, a spider (probably) didn't crawl through a man's body for several days",1531,1
More American Weapons for ISIS,2397,0
Nigeria says ceasefire agreed with Boko Haram,922,0
Senator: Detainees swapped for Bergdahl have contacted militants,209,0
US Intel: Taliban Man Released From Gitmo in Bergdahl Deal is Back to Militant Activity,2207,0
Saudi Arabian cleric issues fatwa against snowmen,1266,0
This Kid Made $72 Million During Lunch,1042,-1
Fears Islamic State could launch EBOLA attack on Britain after fighters 'contract virus',2060,0
NASA Raises Doubts About Reports of Nicaraguan Meteorite,1249,0
"ISIS beheads American photo-journalist James Wright Foley, threatens more to come",903,0
Video shows ISIL beheading of photojournalist James Foley,2067,1
Report: Secret Service Lied About White House Fence Jumper,1921,0
Dylan Thomas Finds Tropical Spider Burrowed Under Skin,986,-1
Congressman: ‘At least 10 ISIS fighters’ caught trying to cross into US,2367,0
"CNN Broadcasts Purported Audio Containing Gunshots That Felled Michael Brown Jr.; Leaders, Celebrities Fill Pews At Teen’s Funeral",2250,0
ISIS Fighters Getting Caught Coming Across the U.S.-Mexican Border?,2385,0
PGA Tour Denies Claim That Tiger Woods Failed A Drug Test,1339,1
Accountant Says Comcast Got Him Fired for Contesting Bogus Charges,1007,0
"James Foley: American Journalist, James Wright Foley Beheaded in New ISIS Video [Breaking News]",1679,0
The pumpkin spice condom is not happening,1833,1
"Catholic Priest Dies for 48 Minutes, Comes Back to Life and Claims God Is Female",1303,-1
"North Korean leader Kim Jong-un not missing, just having ankle surgery",1095,1
Her Majesty’s magic mushrooms,2478,1
"No, That Wasn’t Paul Rudd Tackling an Airport Homophobe",2514,-1
Canadian-Israeli woman reportedly kidnapped by ISIS: Jerusalem Post,1893,0
ISIS Appears To Behead American Photojournalist In YouTube Video,1093,0
Israeli Canadian fighting ISIS posts on Facebook: I'm safe and secure,2471,0
Graffiti Artist Banksy Arrested In London; Identity Revealed,2362,-1
U.S. airstrike kills Islamic Al Shabab terrorist leader in Somalia,1306,1
Kim Had Ankle Surgery:  Source,1854,0
Detroit Police Issue Statement That The Batmobile Is Safe,2135,1
Meteorite leaves crater in Nicaraguan capital Managua,2475,-1
KIM DINE WITH ME: Porky president Kim Jong-un to open UK restaurant serving DOG,2452,0
Guru who ordered 400 followers to be castrated 'so they could be closer to God' is investigated for grievous bodily harm in India,2336,1
'The youngest martyr - the cub of al-Baghdadi': ISIS boasts a 10-year-old fighter has been killed as he went into battle with his father in Syria,299,0
Media outlets identify 'Jihadi John',1489,0
"Boko Haram agrees to ceasefire, release of school girls",600,0
Say 'eh-oh!' to the Teletubbies SUN BABY - can you still recognise her after 19 years?,649,1
ISIS Video Purports To Show Beheading Of British Aid Worker,2102,0
"Spider burrowed into appendix scar, crawled through WA man's body",1864,0
"Catholic Priest Dead For 48 Minutes, Is Miraculously Revived – His Revelations About God Are Even More Shocking",526,1
"Nigeria claims deal with Boko Haram on ceasefire, kidnapped girls",1540,0
This Kid Made $72 Million During Lunch,1858,-1
"'American bombing had signed my death certificate': Missing US journalist James Wright Foley goes unflinching to his death as ISIS behead him in horrific video, as a warning to Obama",1016,1
Macaulay Culkin Hasn’t Died Despite What Everyone Is Saying On Facebook,1559,1
Is Ebola Virus Spreading Among ISIS Militants? Reports Claim Jihadists Seeking Cure at Mosul Hospital,2075,0
Who Should Play Steve Jobs Now That Christian Bale Quit?,860,0
This Is a Truly Horrifying Story About a Spider,1880,-1
Tropical spider burrowed under Bali tourist's skin,1602,0
CNN plays chilling audio recording allegedly from Michael Brown shooting: “At least 11 shots”,2434,0
NASA: Viral news on days of darkness in December is hoax,2521,1
Seven teenage girls get pregnant on school trip,204,1
More than 200 kidnapped Nigerian girls to be released after deal reached with Boko Haram,1821,-1
"Boko Haram denies cease-fire, leader says he married off kidnapped girls",2356,0
Pumpkin Spice Condoms Could Be The Only Thing To Save The World From Basic Children,1400,0
Al-Shabaab Terror Group Leader Killed in U.S. Airstrike,981,1
Rumor: Seth Rogen to Appear as Woz in Sony's Steve Jobs Film,1746,0
"Tropical spider burrows under man's skin, lives there for three days",1478,1
"James Foley: American Journalist, James Wright Foley Beheaded in New ISIS Video [Breaking News]",2147,0
Developer quits using the app he was hired to make—or did he?,2328,0
"Boko Haram leader denies ceasefire deal, says 200 abducted girls married off ",1885,0
That Boko Haram Ceasefire in Nigeria Isn’t A Ceasefire,1761,0
Nigeria Boko Haram blamed for raids despite truce claim,2530,0
"Lady on FB: I'm 41, Intersex, and Fucked Michael Phelps on First Date",1349,0
Police find mass graves with at least '15 bodies' near Mexico town where 43 students disappeared after police clash,1912,0
Islamic State May Have Fighter Jets Now After Seizing Russian-Made MiGs,2408,0
The Arrest of the ISIS Leader's Wife and Son,538,0
Is Kim Jong-un’s sister now the power behind the North Korean throne?,1836,0
Unconfirmed reports claim Canadian-Israeli Gill Rosenberg captured by ISIS,1893,0
This Is What The Sun Baby From ‘Teletubbies’ Looks Like Now,1623,1
Confusion as Cuba’s Castro mourned instead of Kenya’s Fidel,2251,0
ISLAMIC STATE BEHEADS MISSING AMERICAN JOURNALIST JAMES WRIGHT FOLEY,1948,0
Eyewitness Says Viral Video of Homeless Man Was Staged,738,-1
"Insiders Claim Steel Apple Watch to Start at $500, Gold at $4,000",1672,0
CBI registers 'criminal conspiracy' case against Dera chief after claims 400 male followers were forcibly castrated,1255,0
ISIS Executioner 'Jihadi John' Is Named as Mohammed Emwazi,1374,1
"Lady on FB: I'm 41, Intersex, and Fucked Michael Phelps on First Date",1820,0
Kidnapped Nigerian schoolgirls: Government claims ceasefire deal with Boko Haram that will bring missing girls home,1340,0
Zack Snyder Makes Fun of Stolen Batmobile Rumor with New Image,2062,0
ISIL Beheads American Photojournalist in Iraq,782,1
"Mass Graves Found In Mexico, Near Place Where 43 Students Went Missing",443,0
Report: Fence jumper made it into East Room of White House,1840,0
US officials: Video shows American's execution,608,0
NBC weatherman caught urinating in the woods live on air,555,-1
Israeli-Canadian Woman 'Captured' By ISIS Says She Is 'Safe And Secure',1899,0
Nigerians doubtful of girls' release after Boko Haram 'truce' breached,1821,0
"Apple Watch to Be Shower-Proof, Have 100,000 Apps at Launch: Reports",1289,0
Boko Haram ceasefire ignored as violence flares in Borno state,1681,0
Boko Haram denies it has agreed ceasefire,2356,0
"Yemen says U.S. man freed, sister says he’s dead",1649,0
N Korean leader misses annual ritual; sister ‘takes over duties’,744,0
Seven girls as young as 13 become pregnant on a school trip,2504,1
CNN Posts Alleged Audio of Michael Brown Shooting,1379,0
"Rumor: Gold Apple Watch Edition priced up to $5,000, steel version at $500, will debut on Feb. 14",2277,0
Two GOP Congressmen Say Suspected Terrorists Caught Crossing U.S.–Mexico Border,1185,0
NBC weatherman caught urinating in the woods live on air,975,-1
Video messaging service verifies timing of CNN audio recording,1715,0
ISIS Claims to Have Intercepted Supplies From U.S. Airdrop,1361,0
Texas plumber's truck spotted in Syria: 'We have nothing to do with terror at all',2280,0
ISIS Reportedly Beheads American Photojournalist in Iraq,2147,0
"Boko Haram Denies Ceasefire, Says Kidnapped Girls Are Now Married",2530,0
North Korea reportedly bans anyone sharing Kim Jong Un's name,1648,0
Turkish president says American weapons drop for Kurdish fighters was 'wrong' after supplies end up in the hands of ISIS,1485,1
Missing American journalist reportedly beheaded by Islamic State ,195,0
"Rumor: Stainless Steel Apple Watch Will Cost $500, Gold $4,000",2419,0
WAS NBC METEOROLOGIST MIKE SEIDEL PEEING IN THE SNOW ON CAMERA? A TESTY BRIAN WILLIAMS EXPLAINS,1968,0
According to some Russians this dark figure stumbling through the snowy woods is a Yeti - and they even have a footprint. Hmmmmm,359,0
CNN Posts Alleged Audio of Michael Brown Shooting,1818,0
"Kurt Sutter Announces Plans For ‘Sons Of Anarchy’ Movie Starring Charlie Hunnam, Brad Pitt",2141,-1
Dylan Thomas Finds Tropical Spider Burrowed Under Skin,1864,0
Newly Discovered Mass Grave Linked to Missing Mexican Students,646,-1
Graffiti Artist Banksy Arrested In London; Identity Revealed,1940,-1
"James Wright Foley, Kidnapped Journalist, Apparently Executed by ISIS",1744,0
"Islamic State Training Pilots in Military Jets, Monitors Say",2408,0
Nigeria: hopes for return of kidnapped schoolgirls rise after ceasefire reported,600,0
ISIS Beheading of U.S. Journalist James Foley Posted to YouTube,782,1
Boko Haram 'ceasefire' doubts after attacks reported in Nigeria,1298,-1
Reports: Big Bank Hank of pioneering rap group Sugarhill Gang has died,2035,0
Wife and son of Isil leader Abu Bakr al-Baghdadi 'detained at Lebanon border',2337,-1
MACAULAY CULKIN IS THE LATEST VICTIM OF A CELEBRITY DEATH HOAX — AND THESE 9 STARS KNOW EXACTLY HOW HE FEELS!,2502,1
Meteorite strike in Nicaragua puzzles experts,1825,0
Kim Jong-un 'Had Surgery on Fractured Ankles',1001,0
"David Haines Beheaded By ISIS, Execution Video Contains Threats Against UK: Reports",269,1
Ferguson riots: audio may have captured Michael Brown shooting,721,0
Apple Watch’s Power Reserve feature combats short battery life,1420,1
Emotional sergeant-at-arms is greeted back to parliament with a rousing standing ovation a day after he heroically shot dead terrorist - the first time he used weapon in 30 year career,1666,1
The Pumpkin-Spice Condom Is Just a Figment of Your Own Gross Imagination,2252,1
"U.S. accidentally delivered weapons to the Islamic State by airdrop, militants say",2307,0
Weather Reporter Caught Writing His Name In The Snow Was NOT Ready To Go On Camera (UPDATED),1319,1
Isis 'fed murdered kidnap victim to his own mother after she travelled to their headquarters and demanded to see him',1743,0
Senior Western Intelligence Official Confirms London Rapper Abdel Majed Abdel Bary Is A Suspect In The Foley Killing,1598,0
BREAKING NEWS: ISIS beheads missing American journalist James Wright Foley as warning to US to cease action in Iraq,1747,1
James Foley beheading: London rapper turned jihadist believed to be under investigation for murder of journalist in Syria,1079,0
Weather Channel’s Mike Seidel was not caught with his pants down,2034,1
Kim Had Ankle Surgery:  Source,2153,0
"Spider burrowed into appendix scar, crawled through WA man's body",2338,0
Iraqi media says ISIS militants have contracted Ebola,2075,0
"Audio captured at time of Michael Brown shooting, company says",2149,0
ISIS Appears To Behead American Photojournalist In YouTube Video,1658,0
"Bosnia: Seven underage girls return from five day school trip, pregnant",2504,1
Libya: Missing Libya Planes Spark Security Concerns,2010,0
Audio of gunfire in Michael Brown case authenticated by app company,1692,0
Saudi cleric says snowmen are anti-Islamic,2167,1
"Therefore, the ""feminist blogger"" who aborted a boy probably fake",2526,0
Michael Abdul Zehaf Bibeau Pictures: Photos of Alleged ISIS-Linked Gunman in Canada,2246,0
Rep. Duncan Hunter: 'At Least 10' ISIS Fighters Caught at Mexican Border,2261,0
"Big Bank Hank, US rapper and Sugarhill Gang founder member, dies at 57",2080,1
SEE IT: California homeless man uses $100 gift to give food to others,1429,0
Audio of gunfire in Michael Brown case authenticated by app company,1715,0
"No, Jordan's King Abdullah II is not personally flying planes against Isis",1644,0
The Arrest of the ISIS Leader's Wife and Son,2268,0
Lebanon detains wife and son of Al-Baghdadi,1877,-1
The Man Who Says Comcast Got Him Fired Has Filed a Lawsuit,2058,0
NEWS/ All Dogs Go to Heaven! Pope Francis Confirms Paradise Is Open to All of God's Creatures,1371,1
Boko Haram denies ceasefire claim by Nigeria's government,2191,0
Ferguson riots: audio may have captured Michael Brown shooting,816,0
"Rumor: Gold Apple Watch Edition priced up to $5,000, steel version at $500, will debut on Feb. 14",2365,0
"Explosion reported near the Nicaraguan capital attributed to meteorite impact, but experts, including NASA, cast doubt on claims",2154,0
Canadian-Israeli Woman May Have Been Captured In Syria: Reports,2302,0
Alleged audio of Michael Brown shooting has surfaced,2287,0
Islamic State releases video apparently showing the beheading of missing US journalist James Foley,446,0
"Boko Haram agrees to ceasefire, release of school girls",557,0
The “Flood Libel” Propagandists of 2015,1965,1
Heartbroken girl spends week in KFC after getting dumped,1225,1
CBI registers 'criminal conspiracy' case against Dera chief after claims 400 male followers were forcibly castrated,1909,0
Abdel Majed Abdel Bary Emerges as Suspect in Foley Beheading,2528,0
Guantanamo detainee who was swapped in prisoner deal for Bowe Bergdahl 'tried to rejoin 'Al Qaeda',2207,0
ISIS Reportedly Beheads American Photojournalist in Iraq,1011,0
British man pays $460 to save constipated goldfish's life,1707,1
Purported ISIS claim: Jordan airstrike kills female US hostage,2387,0
Pumpkin Spice condoms? Don't fall for this hoax.,1985,0
Aaron Sorkin Confirms Christian Bale Will Play Steve Jobs,2211,-1
"Batmobile stolen in Detroit? Good one, joker!",917,1
WHO: Isis does not have Ebola – but contingency plan being developed for Iraq,2180,1
Spider burrowed through tourist's stomach and up into his chest,1883,1
ADVISORY-Islamist rebel leader killed in U.S. strike - Somali government,1256,1
Return of the Mac: Seth Rogen in talks to star as Apple co-founder Steve Wozniak in upcoming Steve Jobs biopic,999,0
Christian Bale in Talks to Play Steve Jobs in Danny Boyle's Biopic,2017,0
1901 Boston time capsule yields small red book,1997,0
"Hoax Alert: Father O’Neal, Who Has Met God and Thinks She’s a Woman, Is Made Up (Just Like God Herself)",2445,1
"Islamic State, in video titled ""A Message to America,"" beheads American journalist James Wright Foley who was kidnapped in 2012",1747,1
"Rare meteorite impact causes blast in Nicaragua's capital, Managua",1213,-1
Ottawa gunman identified as 32-year-old Michael Zehaf-Bibeau,1442,0
Christian Bale Won't Play Steve Jobs After All,1846,1
CNN Posts Alleged Audio of Michael Brown Shooting,186,0
Report claims Kim Jong-un underwent surgery to repair fractured ankles,1081,0
US confirms death of Somalia terror group leader,981,1
Video shows ISIL beheading of photojournalist James Foley,1093,0
ISIS Militants Allegedly Contracted Ebola,1778,0
A Letter Lego Sent to Parents in 1974 Holds an Important Message for the Parents of 2014,547,1
iOS 8 bug could delete your iCloud Drive documents,243,0
"Luckiest Pizza Delivery Guy Ever Gets $2,000 Tip",623,1
That ESPN Domestic Violence Panel You Keep Hearing About Isn't Real,2181,1
'Banksy' Reacts To Paris Attack With Poignant Drawing,2070,0
An audio recording of the Michael Brown shooting has reportedly surfaced,186,0
$YUM Serving Up #Marijuana & Fried Chicken,1973,1
Conflicting reports on alleged IS capture of Canadian woman,2302,0
It’s Okay To Laugh About The Fact That The Vogue Rat Infestation is Getting Worse,2520,0
Research Medical Center denies reports that a patient has Ebola,2104,1
Pentagon Denies It Killed ISIS Chief As Airstrikes Hit Top Extremists,1634,0
Bug in iOS 8's 'Reset All Settings' Option Also Erases iCloud Drive Documents,2423,1
Moment Michael Brown was shot dead 'caught on audio recording': FBI handed potentially damning tape of ELEVEN shots being fired - including final volley of 'kill shots',2434,0
Is There an ISIS Threat on the Texas-Mexico Border or Not?,2093,0
Audio recording allegedly captures at least 10 shots fired in Michael Brown killing,2481,0
James Foley remembered as 'brave and tireless' journalist,694,0
Islamic State releases video apparently showing the beheading of missing US journalist James Foley,880,0
"Islamic State leader's family detained by Lebanon, officials say",273,0
Real-life Magneto boy 'becomes living magnet' after getting massive electric shock from street lamp,497,1
Caught a catfish record in Po: 127 kg and 2.67 meters,1652,1
"‘Teletubbies’ Sun Baby: Fans Freak Out Over Jess Smith, 19",615,0
BREAKING: British-born hostage 'KILLED in failed rescue attempt',445,0
Homeless man receives $100... then shocks everyone with how he spends it,760,1
An Audio Recording of the Michael Brown Shooting Has Reportedly Surfaced,944,0
ISIS Appears To Behead American Photojournalist In YouTube Video,1016,0
Two blokes dared to eat 20-year-old burger for charity,559,0
Met police denies reports of Banksy arrest,709,1
Al-Shabab leader who ordered Kenya mall massacre believed killed in US drone attack in Somalia,313,0
Spider burrowed through tourist's stomach and up into his chest,2293,0
"Nigeria, Boko Haram reach ceasefire deal, kidnapped girls to go free, official says",1588,0
SEE IT: California homeless man uses $100 gift to give food to others,2305,1
Lynch Mob Castrates Alleged Rapist In Rajasthan,1959,1
Court Orders Probe Into Complaints Of 'Forced Castration' In Religious 'Dera' Sect,2265,0
Man chops off his penis after his girlfriend breaks up with him,1410,1
IRAQI AND KURDISH MEDIA REPORTS: ISIS FIGHTERS HAVE CONTRACTED EBOLA,819,0
Terrorism fears rise amid reports of stolen jetliners,2162,0
"Tropical spider burrows under man's skin, lives there for three days",818,1
"Audio captured at time of Michael Brown shooting, company says",2250,0
Iraqi media: ISIS militants have contracted Ebola,1974,0
"""Categorically False"": DHS Debunks Right-Wing Fiction That ISIS Attempted To Cross The U.S.- Mexico Border",2261,0
Who Should Play Steve Jobs Now That Christian Bale Quit?,945,-1
Pumpkin Spice Condoms Could Be The Only Thing To Save The World From Basic Children,523,0
Breaking: Soldier shot at National War Memorial in Ottawa,1659,0
Is Kim Jong Un's sister Kim Yo Jong in charge?,2473,0
"Rumor: Gold Apple Watch Edition priced up to $5,000, steel version at $500, will debut on Feb. 14",2419,0
Man With Ebola-Like Symptoms Claims Contact With 'Patient Zero' in Texas,1758,0
"Apple Watch pricing: Will you spend $5000 for Gold edition, $500 for stainless steel?",577,0
Two GOP Congressmen Say Suspected Terrorists Caught Crossing U.S.–Mexico Border,1931,0
"Macaulay Culkin Dead? Hoax Goes Viral, Claims Actor Found Dead in Apartment",1559,1
Nationwide turkey recall? Ebola-infected birds? USDA debunks the hoax,1335,-1
"Calm down everyone, Banksy hasn't been arrested: 9 clues that it's a hoax",2468,1
Islamic State claims to have beheaded American journalist,903,0
Man Severed Penis That Failed To Impress Girls,1517,1
Resetting iOS 8 Preferences May Wipe iCloud Files,2033,0
Tropical spider 'burrowed under man's skin through scar' - video report,1923,0
Media outlets identify 'Jihadi John',997,0
#ISIS beheads photojournalist James Wright Foley in a massage to US to end its intervention in #Iraq.,2067,1
Islamist terrorists Jabhat Ansar al-Deen tweet picture of Texas plumber’s truck fitted with anti-aircraft gun in Syria,114,1
State House time capsule from 1795 unearthed,88,1
"Rumor: Stainless Steel Apple Watch Will Cost $500, Gold $4,000",296,0
High school student scores $72M playing the stock market,1858,-1
Here's video of a bird pooping on Vladimir Putin in the middle of a speech,1087,1
7 teen girls get pregnant on school trip Read more at http://www.wnd.com/2014/12/7-teen-girls-get-pregnant-on-school-trip/#F5filOd6yFpASPV9.99,2508,1
Fence-jumper made it farther in White House than Secret Service let on,2409,0
"No, Vladimir Putin did not get pooped on by a bird during a First World War speech",2174,-1
Anna Wintour: Is Rat Infestation At NYC ‘Vogue’ Office Kim Kardashian’s Fault?,2520,0
Weatherman caught peeing live on camera,1829,1
New policy could reduce marijuana possession arrests,1732,0
MPs credit sergeant-at-arms for saving lives in Parliament Hill shootings,1900,0
WHO ‘probing’ whether ISIS fighters got Ebola,1904,0
iOS 8 bug could delete your iCloud Drive documents,545,0
Moment U.S. Marine is saved by his Kevlar helmet as Taliban sniper bullet hits him in head,2046,1
