 Kim Jong-Un'un kız kardeşinin Kuzey Kore'yi yönettiği söyleniyor,2477,0
 North Walsham veterineri tarafından ameliyat edilen kabız japon balığı,958,1
iPhone 6 kullanıcıları saçlarını yoluyor,2276,0
 Kayıp Amerikalı gazetecinin IŞİD tarafından başının kesildiği bildirildi,847,0
 IŞİD videosunun İngiliz rehine David Haines'in başının kesilmesini gösterdiği iddia ediliyor,2440,0
" ABD ve İngiltere, gazeteci James Foley'i kafasını kesen İngiliz asıllı militanı rapçi olarak görüyor",1079,0
 Çit atlayan kişinin Gizli Servis'in söylediğinden çok daha uzağa Beyaz Saray'a girdiği bildirildi,1921,0
 James Foley 'cesur ve yorulmak bilmez' gazeteci olarak anılıyor,1679,0
 Macaulay Culkin'in öldüğüne dair aldatmaca: Sahte ölüm haberi sosyal ağlarda yayılıyor,1559,1
 Christian Bale Steve Jobs Filminden Çıktı (Özel),2455,0
 IŞİD savaşçıları 'Ebola'ya yakalandı': Dünya Sağlık Örgütü militanların ölümcül hastalıkla Irak hastanesine geldiğine dair raporları araştırıyor,2180,0
" Apple Watch'un Paslanmaz Çelik İçin 500 Dolardan, Altın İçin 4.000 Dolardan Başlayacağı Bildirildi",2365,0
 Axl Rose Öldü mü? Guns N' Roses Şarkıcısı Öldü '52 Yaşında Batı Hollywood Evi' Sahte,2166,1
 Michael Brown'ın vurulduğuna dair iddia edilen ses kaydı yayımlandı,2481,0
" KİM BENİMLE YEMEK YİYİN: Domuzcuk başkan Kim Jong-un, KÖPEK servis eden İngiltere restoranı açacak",1222,-1
 Boko Haram'ın Nijeryalı kız öğrencileri kaçırmasının üzerinden altı ay geçtikten sonra onları serbest bırakmak istediği bildirildi,2144,0
" Abdel Majed Abdel Bary, Foley'in Başının Kesilmesinde Şüpheli Olarak Ortaya Çıktı",1202,0
 Mizah haber sitesi Çin'in tuhaf İngilizce isimlerine saldırıyor,2260,1
" Paul Rudd Şiddet Yanlısı Bir Homofobikle Mücadele Etmeye Yardımcı Oldu, Bu da Onu Sevmek İçin Bir Neden Daha [GÜNCELLEME]",1735,-1
" ESPN, NFL'nin imajını tamamen erkeklerden oluşan aile içi şiddet tartışmasıyla kurtaracak",1699,-1
" Mohammed Emwazi: IŞİD katili olarak tanımlanan 'Cihatçı John', 2010 yılında Afrika'da safari tatilindeyken MI5 tarafından 'durduruldu'",921,0
'Teksas'ta İslam mahkemesi onaylandı',200,0
" Mutsuz Müşteri: Comcast, Şikayetim Hakkında İşverenime Bilgi Verdi ve Beni İşten Çıkardı",1383,0
 Bunbury yerlisi Bali tatilinde derisinin altında bir örümceğin yuva yaptığını keşfetti,1478,1
" 2,5 Milyon Dolarlık Arabaya Sprey Boyayla Penis Yaptırmak Sadece Şaka Videosuydu",1148,1
" 'Vahşi Yanlış Bilgilendirme': Brian Williams, Mike Seidel'in Canlı Görüntüsünü Açıklıyor",1046,1
 IRAK SAĞLIK YETKİLİSİ: EBOLA 5 IŞİD SAVAŞÇISINI ÖLDÜRDÜ,819,0
 Öğretmen seks kasetinin internet dedektifleri pornografik klibin kaynağını bulduktan sonra SAHTE olduğu ortaya çıktı,1496,-1
" Boko Haram, Nijerya hükümetinin ateşkes iddiasını yalanladı",1885,1
 IŞİD lideri Ebubekir el-Bağdadi'nin eşi ve oğlu 'Lübnan sınırında gözaltına alındı',1263,-1
" DSÖ, IŞİD savaşçılarının Ebola'ya yakalandığına dair medya haberlerini araştırıyor",938,0
 Militan Grup Suriye'de Amerikalı Gazeteciyi Öldürdüğünü Söyledi,847,0
" IŞİD, ABD'li gazetecinin kafasını kestiğini iddia ediyor",1721,0
 Kanadalı-İsrailli Kadın Suriye'de Yakalanmış Olabilir: Raporlar,1899,0
" Garip iz, tatilcinin derisinin altında yuva yapan tropikal örümcek çıktı",1864,0
 Michael Brown Saldırısının Ses Kaydının Ortaya Çıktığı Bildirildi,398,0
 Rapor: İslamcıların Libya Havaalanını Ele Geçirmesinin Ardından 11 Eylül Yıldönümü Öncesinde Yaklaşık Bir Düzine Ticari Uçak Kayboldu,1515,0
 İnfazcılar tecavüzcünün penisini kesti,650,1
 Silahlaştırılmış Ebola mı? IŞİD Militanlarının Ölümcül Virüse Yakalandığı Söyleniyor,2180,0
 IŞİD Irak'ta Amerikalı Foto Muhabirinin Başını Kesti,1589,1
" #IŞİD, ABD'ye #Irak'taki müdahalesine son vermesi için mesaj göndermek amacıyla foto muhabiri James Wright Foley'i başını keserek öldürdü.",2450,1
" Teksas'tan gelen bir tesisatçı kamyoneti, Suriye'nin ön cephesindeki İslamcı savaşçılara uçaksavar mı taşıyordu?",2280,0
 IŞİD'in ABD'li Gazeteci James Foley'in Kafasını Kesmesi YouTube'a Gönderildi,1948,0
" 1970'lerden kalma Lego mektubu, 40 yıl sonra bile ebeveynlere güçlü bir mesaj veriyor",1969,0
 Bu Hafta Garip Haberlerde: Korkunç İnsan Hapşırdığı İçin Yaşlı Kadına Tokat Attı,1952,0
 İddiaya Göre Brown'a Ateş Etme Kaydında Silah Sesleri Duyuluyor [SES],816,0
" Nikaragua'nın başkentine meteor düştü, 16 fit derinliğinde krater oluştu",1213,-1
 James Foley'in kafasının kesilmesi: Londra'lı rapçi ve cihatçının Suriye'de bir gazetecinin öldürülmesiyle ilgili soruşturma altında olduğuna inanılıyor,1530,0
 Gateway Uzmanı,1314,0
" IŞİD, YouTube Videosunda Amerikalı Foto Muhabirinin Kafasını Kesmiş Gibi Görünüyor",2388,0
 Michael Brown'ı Öldüren Silah Seslerinin İddia Edilen Ses Kaydı Bir Sahtekarlık mı?,1564,1
" SON DAKİKA: ""Brat Pack"" Judd Nelson Los Angeles'taki Apartman Dairesi'nde Ölü Bulundu",2286,-1
" Hayır, o kırık kalem çizimi Banksy'ye ait değil",1584,0
 'Cihatçı John' teşhis edildi: IŞİD katili Batı Londra'dan Muhammed Emwazi olarak belirlendi,2202,0
" Apple Watch'un paslanmaz çelik versiyonunun 500 dolardan, altın versiyonunun ise 4.000 dolardan fiyatlandırıldığı söyleniyor",2365,0
 Eski İngiliz Rapçinin James Foley'in Başının Kesilmesiyle İlgili Soruşturma Altında Olduğu Bildirildi,330,0
" Video: IŞİD, Kobani Yakınlarında ABD Silahlarını Havadan Attığını Ele Geçirdiğini İddia Ediyor",1597,0
 Ürdün Kralı IŞİD Baskınlarına Kişisel Olarak Katılabilir,1644,0
 Glenn Beck'in 11 Kayıp Jetle İlgili Endişeleri Neler Olabilir?,1197,1
 NYPD'nin esrar bulundurma suçundan tutuklama yerine ceza yazacağı bildirildi,2389,0
" Apple, Retina Ekranlı 12 inç MacBook Air'ı piyasaya sürebilir",1063,0
 IŞİD videosu kaçırılan gazeteci James Foley'nin kafasının kesildiğini iddia ediyor,1747,0
 HABERLER/ Evsiz Bir Adamın 100 Doları Nasıl Harcadığını Asla Tahmin Edemeyeceksiniz—Dokunaklı Videoyu İzleyin!,738,1
"New York'ta Marihuana Tutuklama Değil, Ceza Anlamına Gelebilir",2389,0
" Raporlar: IŞİD, Irak güçlerine karşı klor gazı kullanıyor",1590,0
" Obama, Başının Kesilmesinden Öfkelendi, Yola Devam Etme Sözü Verdi",2147,0
 Lübnan 'DEAŞ liderinin kızını ve eski eşini tutuyor',670,0
" Rapor: Nijeryalı Kadın, Ebola Benzeri Semptomlarla KC'de Karantinaya Alındı (Video)",260,0
 Ölen eşinin kayıp kaydı ortaya çıkınca adam gözyaşlarına boğuldu,2020,1
" James Foley: Amerikalı Gazeteci James Wright Foley, Yeni IŞİD Videosunda Başı Kesildi [Son Dakika Haberleri]",2386,1
 Küçük Meteor Managua'ya Çarptı,1722,0
 Altın Apple Watch Edition fiyatı? Spekülatörler en az 10.000 dolar diyor,790,0
 IŞİD'in videoda ABD'li gazeteciyi öldürdüğü iddia edildi,2096,0
" İki GOP Kongre Üyesi, Şüpheli Teröristlerin ABD-Meksika Sınırını Geçerken Yakalandığını Söyledi",2249,0
 Kötü Bir İngilizce İsimden Kaçınmak İçin Çince Rehber,1660,1
" NASA, Nikaragua'daki kraterin meteordan kaynaklanıp kaynaklanmadığını sorguluyor",767,1
" IŞİD, ABD'nin hava yoluyla silah attığını iddia ediyor",2404,0
" 'Bağdadi'nin yavrusu': IŞİD, en genç cihatçısının savaşta 'şehit düştüğünü' bildirdi",230,0
" IŞİD, YouTube Videosunda Amerikalı Foto Muhabirinin Kafasını Kesmiş Gibi Görünüyor",933,0
 IŞİD Lideri El-Bağdadi “Ölmedi”,1466,0
 Ottawa'daki silahlı saldırganın 32 yaşındaki Michael Zehaf-Bibeau olduğu belirlendi,440,0
" HBO yayın hizmeti nisan ayında aylık 15 dolardan başlatılabilir, Apple TV üzerinde çalışılıyor",203,0
 Batı Londra'dan Cihatçı John'un adı Muhammed Emwazi olarak açıklandı,2123,0
" İki GOP Kongre Üyesi, Şüpheli Teröristlerin ABD-Meksika Sınırını Geçerken Yakalandığını Söyledi",2266,0
 Militan Grup Suriye'de Amerikalı Gazeteciyi Öldürdüğünü Söyledi,2495,0
 Teksas Kamyonu İslamcı Militanlarla Birlikte Suriye'de Sonlandı,1614,1
" Uzman, Bunbury'li Dylan Thomas'ın mide örümceği hikayesine şüpheyle yaklaşıyor",1478,-1
Kürtler IŞİD'in Kobani'de kimyasal silah kullanmasından korkuyor,964,0
 Sugarhill Çetesi'nden Rapçi Big Bank Hank 57 yaşında öldü,2398,1
" Seth Rogen, Sony'nin Steve Jobs Biyografisinde Steve Wozniak'ı Canlandıracak [Güncellendi]",1575,0
 YPG Doğruladı: Gill Rosenberg Kobani'de Yakalanmadı,1330,0
" Apple Watch, olabileceği kadar dijital bir doktor olmayacak",521,0
 Michael Brown Saldırısının Ses Kaydının Ortaya Çıktığı Bildirildi,2235,0
 Durex'in Söylentilere Göre 'Pumpkin Spice' Kondomu Hakkındaki Görüşü: Yorum Yok,2354,0
" Vogue'un NYC ofislerindeki fareler - Adımlarınıza dikkat edin, Anna Wintour",1693,0
 Öfkeli kalabalık tecavüzcünün penisini et bıçağıyla kesti (İZLEYİCİ TAKDİRİ),805,1
 IŞİD lideri Ebubekir el-Bağdadi'nin eşi ve oğlu 'Lübnan sınırında gözaltına alındı',2155,0
 Medya raporları Londralıyı IŞİD'in 'Cihatçı John'u olarak tanımlıyor,997,0
 Kim Jong-un 'peynir yemekten o kadar şişmanladı ki ayak bileklerini kırdı',1854,0
 Apple Watch'un pil ömrünü uzatmak için 'Güç Rezervi' sunacağı söyleniyor,1911,0
Rapor: Güney Sınırında 36 Saatte 4 IŞİD Teröristi Yakalandı,2093,0
 Michael Brown'ı Öldüren Silah Seslerinin İddia Edilen Ses Kaydı Bir Sahtekarlık mı?,2345,-1
 BAKIN: Kaliforniyalı evsiz adam 100 dolarlık bağışını başkalarına yiyecek vermek için kullanıyor,1388,0
" ABD, Somali'de Al Shabaab lideri Ahmed Abdi Godane'yi hedef aldı",2374,0
 Rapor: Christian Bale Steve Jobs'ı Oynayacak,1217,0
" IŞİD, ""Amerika'ya Mesaj"" başlıklı videoda, 2012 yılında kaçırılan Amerikalı gazeteci James Wright Foley'in kafasını kesiyor",2047,0
 Pentagon: Somali'de hava saldırısında terör lideri öldürüldü,1982,0
" İslamcı Militanlar, ABD'li Gazetecinin Başının Kesildiğini Gösterdiğini İddia Eden Bir Video Yayınladı",1471,0
" Milletvekilleri, Parlamento Tepesi'ndeki silahlı saldırıda hayat kurtardığı için çavuşa teşekkür etti",1631,0
" CNN, Michael Brown'ın Vurulmasıyla İlgili İddia Edilen Ses Kaydını Yayımladı",2287,0
 IŞİD'le savaşan İsrailli Kanadalı Facebook'ta şunları paylaştı: Güvendeyim ve emniyetteyim,1899,0
Led Zeppelin'in Robert Plant'i 924 milyon dolarlık yeniden birleşme sözleşmesini yırttı,295,-1
 Vogue'un yeni dükkanında farelerin cirit attığı iddia ediliyor,2072,0
 Üst Düzey Batılı İstihbarat Yetkilisi Londra Rapçisi Abdel Majed Abdel Bary'nin Foley Cinayetinde Şüpheli Olduğunu Doğruladı,472,0
 Batman Yaklaşan Biyografide Steve Jobs'ı Canlandıracak,1846,-1
 IŞİD'in videoda ABD'li gazeteciyi öldürdüğü iddia edildi,2047,0
 Zack Snyder'ın 'Batman V Superman: Adaletin Şafağı' Çalınan Batmobil Söylentisi Son Buldu,1538,0
 'Bebeğimi erkek olduğu için kürtaj ettirdim': 'Feminist' blog yazarının cinsiyet nedeniyle işten çıkarıldığını iddia etmesi tepki çekti,2014,-1
 Ferguson'dan Yeni Ses Kaydı Michael Brown'ın Vurulmasını Yakalayabilir,2287,0
 Meksika savcısı: Öğrenciler ilk toplu mezarlarda değil,1795,1
" Seth Rogen, Christian Bale'in Steve Jobs Filminde Apple'ın Steve Wozniak'ını Canlandırmaya Hazırlanıyor (Özel)",614,0
 Vogue ve Sıçanlar Savaşında Sıçanlar Kazanıyor,2106,0
" ACİL: IŞİD, Saklaviye'de klor gazı saldırısıyla 300 Irak askerini öldürdü",1590,1
" Nijeryalı Yetkililer, Boko Haram'ın Kaçırılan Kızları Serbest Bırakabileceğini Söyledi",600,0
 Bali örümceği Avustralyalının göğsünün altına giriyor,2042,-1
 Sosyal medyada #Hairgate trendi: iPhone 6 kullanıcıları kopan saçlarından şikayetçi,1738,0
 Yeni Ses Kayıtları Michael Brown'ın 11 Kez Vurulduğunu Gösteriyor,2481,0
" Savaş anıtında çıkan silahlı çatışmanın ardından asker vuruldu, Parlamento kapatıldı",2347,1
 'Öldürülen DEAŞ liderinin fotoğrafı'nın tahrif edildiği iddia edildi,891,0
 Doğrulanmamış videoda yardım görevlisi David Haines'in başının kesildiği görülüyor,2348,0
 'Batman V Superman: Adaletin Şafağı' Setinden Batmobil Çalındı mı? Raporda Batmobil Modellerinden Birinin Kayıp Olduğu İddia Ediliyor! Detroit Yerlileri Sorumlu mu?,1242,0
" NBC METEOROLOJİ UZMANI MIKE SEIDEL, KAMERA KARINDA MI İŞİYORDU? SİNİRLİ BRIAN WILLIAMS AÇIKLIYOR",1829,0
 Nikaragua Meteorit Çarpma Teorisi Meteor-Yanlış Olabilir,1722,0
" Obama, Başının Kesilmesinden Öfkelendi, Yola Devam Etme Sözü Verdi",2386,1
 Doğrulanmamış raporlara göre ISIS İngiltere rehinesi David Haines'in kafası kesildi,2102,0
 Jeh Johnson: Politikacılar IŞİD ve Ebola Üzerinden 'Korku Alevlerini Beslememeli',666,1
 Nijerya'daki Boko Haram Ateşkesi'nin Ateşkes Olmadığı,2272,1
 ABD İstihbaratı: Bergdahl Anlaşmasıyla Gitmo'dan Serbest Bırakılan Taliban Adamı Militan Faaliyetlere Geri Döndü,2159,0
" IŞİD destekçileri, Suriye'de koalisyonun hava saldırısında rehin tutulan ABD vatandaşının öldürüldüğünü iddia etti",2387,0
 IŞİD Irak'ta Amerikalı Foto Muhabirinin Başını Kesti,2147,0
 Sugarhill Gang Rapçisi 'Big Bank Hank' 57 Yaşında Öldü,598,1
 AÇIKLANDI: Yıllık 5 Milyon Dolar Kazandıran Youtube Kanalının Arkasındaki Kadın Eski Bir Porno Yıldızı Daha fazla bilgi için: http://nextshark.com/revealed-woman-behind-5-million-per-year-youtube-channel-is-a-former-porn-star/#rmns,1315,1
 KORKU: IŞİD Savaşçılarının Ebola'ya Yakalandığı Bildirildi,1974,0
 Texas City tesisatçısının kamyonu Suriye savaşında son buldu,2379,1
 Bu dünyanın en eski burgeri mi? Adam McDonald's Quarter Pounder'ı 20 YIL sakladığını iddia ediyor,1586,0
" #IŞİD, ABD'ye #Irak'taki müdahalesine son vermesi için mesaj göndermek amacıyla foto muhabiri James Wright Foley'i başını keserek öldürdü.",2495,0
 Büyük uzay nesnesi asteroit Dünya'nın yanından geçerken Nikaragua'nın başkentine çarptı,1825,0
Irak medyası: IŞİD militanları Ebola'ya yakalandı,1904,0
" Boko Haram: Kaçırılan Kızlar Evlendirildi, Ateşkes Hiçbir Zaman Gerçekleşmedi",2463,0
 GOP Temsilcisi: 'En Az On IŞİD Savaşçısı Meksika Sınırını Geçerken Yakalandı',1890,0
" Boko Haram Ateşkesi Reddetti, Kaçırılan Kızların “Evlendirildiğini” Söyledi",1540,-1
 Nikaragua'nın başkenti Managua'da meteor krater açtı,1073,0
" Ebola, Musul'daki IŞİD militanlarına bulaştı mı?",2003,0
" IŞİD, ABD'nin hava yoluyla silah attığını iddia ediyor",2509,0
 Personel Muhabiri,1784,0
 Pentagon: IŞİD ABD Silah Paketini Ele Geçirdi,2172,1
" Birisi 2,5 milyon dolarlık bir arabaya grafiti çizdi",498,1
" Kuzey Kore lideri Kim Jong-un'un gizemli hastalığı aslında iki kırık ayak bileği, diyor gazete",859,0
 Kansas City'de Ebola vakası olmamasına rağmen söylenti viral oldu,2501,1
" Herkes Rahatlasın, Banksy Tutuklanmadı ve 35 Yaşındaki Bir Adam Olarak Ortaya Çıkmadı",2362,1
" Libya havaalanının İslamcı militanlar tarafından ele geçirilmesinin ardından kaybolan uçaklar, 11 Eylül benzeri yeni saldırılar korkusunu artırdı",2162,0
 Balkabağı baharatlı prezervatif olmayacak,1954,1
 Uzmanlar: Michael Brown'ın vurulmasıyla ilgili iddia edilen ses kaydı hakkında daha fazla bilgiye ihtiyaç var,2149,0
"Obama, James Foley'in İdamını Kınadı: 'Bugün Tüm Dünya Dehşete Düştü'",1679,0
" Şüpheli meteorit Managua'da kraterden çıktı, asteroide bağlı",1825,0
"IŞİD, ABD'li rehine Kayla Jean Mueller'in Ürdün'deki hava saldırısında öldürüldüğünü iddia etti",2376,0
 İnfazcılar tecavüzcünün penisini kesti,830,1
" İngiltere doğumlu rapçi, James Foley'i kafasını kesen IŞİD cihatçısını arama çalışmalarının baş şüphelisi",1598,0
 11 Eylül yıldönümü öncesinde 'teröristlerin kontrolündeki' Trablus havaalanından 11 uçak kayboldu,1165,0
" Tropikal örümcek, insanın derisinin altına giriyor ve orada üç gün yaşıyor",1057,-1
" NASA, Managua patlamasının bir meteor olmadığını öne sürüyor",961,-1
 Balkabağı-Baharatlı Kondom Sadece Kendi Kaba Hayalinizin Bir Ürünü,2269,1
 GOP Temsilcisi: 'En Az On IŞİD Savaşçısı Meksika Sınırını Geçerken Yakalandı',1398,0
 Sugarhill Gang rapçisi Big Bank Hank 57 yaşında öldü,2351,1
 Tropikal örümcek 'bir adamın derisinin altına yara iziyle girdi' - video raporu,1883,0
 IŞİD lideri Ebubekir el-Bağdadi'nin 'karısı ve oğlu Lübnan'da gözaltına alındı',2268,0
 Kuzey Kore'de Kimsenin Kim Jong Un'un Adını Paylaşmasına İzin Verilmiyor,1678,1
" Terk edilen sevgili, kız arkadaşı onu terk ettikten sonra penisini kesti",1171,1
Çok Hızlıydı: Christian Bale Steve Jobs Biyografisinden Vazgeçti,1215,-1
" BAKIN: Kongre üyesi, IŞİD militanlarının Teksas sınırını geçmeye çalışırken yakalandığını iddia ediyor",1376,0
" Şok Edici Fotoğraflar! Anne, Kızının Kanser Tedavisini Karşılamak İçin Oğlunu Satmaya Çalışıyor",1574,1
 IŞİD'in ABD Sınırını Geçtiğine Dair Söylentilerin Neden Bitmediği İşte Bu Nedenle,2249,0
" 'Bağdadi'nin yavrusu': Bu çocuk, IŞİD'in çocuk asker kullanımının en genç kurbanı mı oldu?",1785,0
 Bugatti Veyron Penis Grafitisiyle Mi Tahrip Edildi? Viral Fotoğraf Göründüğü Gibi Değil,1144,0
 'Batman V Superman: Adaletin Şafağı' Setinden Batmobil Çalındı mı? Raporda Batmobil Modellerinden Birinin Kayıp Olduğu İddia Ediliyor! Detroit Yerlileri Sorumlu mu?,672,0
" Microsoft, sorunlara karşı robot güvenlik görevlilerine yöneliyor",552,1
Rapor: Christian Bale Steve Jobs Filminden Vazgeçti,945,-1
" ABD, Somali terör örgütü liderinin ölümünü doğruladı",313,-1
" IŞİD, ABD Hava İndirme Silahlarını Ele Geçirdiğini İddia Ediyor",2295,0
" IŞİD, ABD'li gazetecinin kafasını kestiğini iddia ediyor",2096,0
" Yetkililer, IŞİD liderinin ailesinin Lübnan tarafından tutuklandığını söyledi",281,0
 25 yıldır görevde olmayan CPWD yetkilisi görevden alındı,2441,1
 İnfazcılar tecavüzcünün penisini kesti,2005,1
 Suudi Arabistan'da Kar Yağarken Kardan Adamlar İslam Karşıtı Olarak İlan Edildi,1064,1
"Nijerya, Boko Haram ile ateşkesin kabul edildiğini duyurdu",1540,0
 ABD'nin havadan silah sevkiyatı IŞİD'in eline geçti: Pentagon,2172,1
 Sahte Haber: 'McDonald's Fazla Kilolu Müşterilere Hizmet Vermeyi Durduracak',1848,-1
" Christian Bale, Steve Jobs rolünü reddetti, aktörün rol için uygun olmadığını düşündüğü bildirildi",1226,1
" IŞİD, ""Amerika'ya Mesaj"" başlıklı videoda, 2012 yılında kaçırılan Amerikalı gazeteci James Wright Foley'in kafasını kesiyor",2147,0
 SON DAKİKA: IŞİD Amerikalı Gazeteci James Wright Foley'i Başını Kesti,1948,0
" Meksika, Toplu Mezarda Ölenler Arasında Öğrencilerin Olmadığını Söyledi",1822,0
 RAPOR: Batmobile Detroit'te Çalınmış Olabilir,2135,0
 IŞİD Videosu İngiliz Rehinenin Başının Kesildiğini Gösteriyor,2348,0
"Matt Taibbi, First Look Media'dan izinli",267,0
 RAPOR: Michael Brown Saldırısının İddiaya Göre Yeni Ses Kaydı,2287,0
" Görgü Tanığı: 130.000 Dolar Bağış Toplayan Viral Video ""Saçmalık""",1130,1
 Nijeryalılar Boko Haram'ın 'ateşkesinin' ihlal edilmesinin ardından kızların serbest bırakılmasından şüphe ediyor,1540,0
" Banksy tutuklama aldatmacası: ABD web sitesi, sokak sanatçısının Watford'da yakalandığını iddia ediyor",2051,1
" Vogue'un NYC ofislerindeki fareler - Adımlarınıza dikkat edin, Anna Wintour",2520,0
Kendisinin 'Teletubbies' Güneş Bebeği Olduğunu İddia Eden Üniversite Öğrencisiyle Tanışın,1327,0
 Vogue'un Yeni Ofisinde Fare mi Var?,1693,0
 Michael Brown'ın vurulma sesi kayda mı alındı?,2118,0
 IŞİD 'savaş uçağı uçurmak için pilot yetiştiriyor',2406,0
 Pentagon: IŞİD ABD Silah Paketini Ele Geçirdi,1120,0
"Bu hafta internette sahte olan neydi: Obama'nın barış ödülü, balkabağı baharatlı prezervatifler ve çılgın kış karı",1400,1
 13-14 yaşlarındaki yedi kız çocuğunun okul gezisinde hamile kalması üzerine ebeveynler öfkelendi,2170,1
 Çıplak havaalanı çalışanının 'kaba' gardiyanlara karşı tuhaf bir protestoda tarayıcıdan geçişini izleyin,2234,1
" #IŞİD, ABD'ye #Irak'taki müdahalesine son vermesi için mesaj göndermek amacıyla foto muhabiri James Wright Foley'i başını keserek öldürdü.",2047,0
 İngiliz adam kabız Japon balığının hayatını kurtarmak için 460 dolar ödedi,803,1
 Ottawa'da Savaş Anıtı'nda asker vuruldu,2347,1
 Devam Eden Şiddet Boko Haram Ateşkesini Tehlikeye Atıyor,1195,0
 Boko Haram'ın 'Ateşkesi'nin İhlal Edilmesinin Ardından Kızların Serbest Bırakılmasına Yönelik Umutlar Tükendi,455,0
 Ottawa'daki silahlı saldırganın 32 yaşındaki Michael Zehaf-Bibeau olduğu belirlendi,1178,0
 Pentagon: Somali terör örgütü lideri ABD hava saldırısında öldürüldü,1982,0
 Kayıp Amerikalı Foto Muhabiri James Foley'in Suriye'de IŞİD Tarafından İnfaz Edildiği Bildirildi,903,0
" Beyaz Saray Çit Atlayıcısı Gizli Servis Görevlisini Alt Etti, Ana Katın Çoğu Yerinden Koştu",505,1
 Beyaz Saray Çit Atlayıcısı Kadın Muhafızın Yanından İtildi,1365,1
 Nijerya ve Boko Haram 'ateşkes ve kızların serbest bırakılması konusunda anlaştı',2272,0
IŞİD Militanları ABD'li Gazeteci James Wright Foley'in Başını Kestiklerini İddia Ediyor,1580,0
Nijerya'nın kayıp kızları 'Boko Haram tarafından serbest bırakılacak' iddiasında hükümet yardımcısı,2403,0
" NASA, Managua patlamasının bir meteor olmadığını öne sürüyor",885,1
" Ottawa, IŞİD'in Kanadalı-İsrailli bir kadını kaçırdığına dair haberleri araştırıyor",1168,0
 Nikaragua Meteorit Çarpma Teorisi Meteor-Yanlış Olabilir,1790,0
 Christian Bale Steve Jobs Filminden Çıktı (Özel),1131,0
" Anna Wintour, 'fare istilası nedeniyle Dünya Ticaret Merkezi Vogue ofisinde çalışmayı reddetti'",2106,0
 Temsilci Duncan Hunter: Meksika Sınırında En Az 10 IŞİD Savaşçısı Yakalandı,1931,0
 IŞİD militanları klor gazıyla 300 Irak askerini öldürdü,1233,0
 İngiliz adam kabız Japon balığının hayatını kurtarmak için 460 dolar ödedi,1541,1
 Genç kızla seks kasedi çeken kadın öğretmen işten atılma tehlikesiyle karşı karşıya,482,-1
 Paul Revere'in 1795'teki zaman kapsülü ortaya çıkarıldı,1273,1
 Rapor: HBO Now önümüzdeki ay Apple TV'ye geliyor,203,0
 Michelle Obama Suudi TV'de Görünmüyor,2453,1
" IŞİD, Amerikalı gazetecinin kafasını kestiğini iddia ediyor",2147,0
" Apple-HBO Anlaşması, Aylık 15 Dolarlık Web'e Özel Apple TV Yayın Hizmetini Başlatıyor",727,0
 Rahibe mide ağrılarından şikayetçi... ve DOĞUM YAPTI: Hamile olduğunu 'hiçbir şekilde' bilmeyen kız kardeşin İtalya'daki hastanede bir erkek bebeği var,1828,0
" Tropikal örümcek, insanın derisinin altına giriyor ve orada üç gün yaşıyor",1602,0
" NBC'den Tom Brokaw'ın, Irak helikopteri hikayesi uydurduğu için Brian Williams'ın kovulmasını istediği bildirildi",2176,0
" Video, Militanlar Tarafından ABD'li Gazetecinin Başının Kesildiğini Gösteriyor",1948,0
 Ottawa Silahlı Saldırganı Michael Zehaf-Bibeau Olarak Tanımlandı,2246,1
 Nijerya Boko Haram ile ateşkes ilan etti; kız öğrencilerin kaderi belirsiz,2463,0
" Lübnan, El Bağdadi'nin eşini ve oğlunu gözaltına aldı",1192,0
" Jeh Johnson, Duncan Hunter'ın DEAŞ'ın Meksika üzerinden ABD'ye girdiği iddiasını çürüttü",134,1
" IŞİD, kayıp ABD'li gazeteci James Foley'nin başının kesilerek öldürülmesini gösteren videoyu yayınladı",1336,0
" Michael Brown'ın vurularak öldürüldüğü an 'ses kaydına yakalandı': FBI, son 'öldürücü atışlar' da dahil olmak üzere ON BİR el ateş edildiğine dair potansiyel olarak suçlayıcı bir kayıt verdi",2250,0
 Acil: IŞİD Lideri 'Ebubekir el-Bağdadi' Öldürüldü! / Fotoğraf,1645,0
" DSÖ, Irak'ta şüpheli Ebola vakalarına ilişkin haberlerin asılsız olduğunu söylüyor",1669,0
 Kanadalı Michael Zehaf-Bibeau'nun Ottawa'daki silahlı saldırıyı gerçekleştiren kişi olduğu düşünülüyor,2246,0
" IŞİD, kayıp ABD'li gazeteci James Foley'nin başının kesilerek öldürülmesini gösteren videoyu yayınladı",84,0
 Pentagon: IŞİD ABD Silah Paketini Ele Geçirdi,781,1
" Meteor, Managua Havaalanı Yakınlarında 40 Ayaklık Krater Bıraktı",885,-1
" ""Bu sonsuza dek kaybettiğinizi düşündüğünüz kayıttır""",2020,1
" #IŞİD, ABD'ye #Irak'taki müdahalesine son vermesi için mesaj göndermek amacıyla foto muhabiri James Wright Foley'i başını keserek öldürdü.",1016,1
" Rahibe Karın Ağrılarından Şikayetçi Oldu, Daha Sonra Erkek Bebek Doğurdu",179,1
" BATMOBILE ÇALINTI DEĞİL, MTV YARIŞMA ÖDÜLÜ SAHİPLENİLMEDİ",1313,1
" ABD ve İngiltere, gazeteci James Foley'i kafasını kesen İngiliz asıllı militanı rapçi olarak görüyor",2327,0
 Nijerya Boko Haram ile ateşkes ilan etti; kız öğrencilerin kaderi belirsiz,2191,0
" Üniversite, 'Birinci Sınıf Öğrencisi' Kelimesini Cinsiyetçi Olduğu ve Tecavüzü Teşvik Ettiği İçin Yasakladı",2321,0
"Fotoğrafta: 58 yaşındaki kahraman çavuş, silahlı saldırgan Michael Zehaf-Bibeau'yu öldürdükten birkaç dakika sonra elinde silahla Parlamento'da yürüyor",2113,0
 'Cihatçı John' teşhis edildi: IŞİD katili Batı Londra'dan Muhammed Emwazi olarak belirlendi,1800,0
 Evsiz Bir Adamın 100 Dolarla Yaptıkları Sizi Şaşırtacak (VİDEO),1971,-1
