Headline,Body ID,Stance
We took a look at the photo said to show the body of Islamic State leader Abu Bakr Al-Baghdadi (right) and found it was really an ethnic Albanian militant killed in 2013,1522,0
An Audio Recording of the Michael Brown Shooting Has Reportedly Surfaced,1818,0
ISIS executioner 'Jihadi John' identified as Mohammed Emwazi,1219,1
Two GOP Congressmen Say Suspected Terrorists Caught Crossing U.S.–Mexico Border,2249,0
Holy Theft! Batmobile Stolen from 'Batman v Superman'???,1529,0
Video: Islamic State Claims to Have Captured US Weapons Airdrop Near Kobane,462,0
Conflicting reports on alleged IS capture of Canadian woman,1899,0
BREAKING: ISIS Beheads American Journalist James Wright Foley,1093,0
Questions raised over Nicaragua 'meteorite',966,0
"Apple Watch Pricing to Reportedly Start at $500 for Stainless Steel, $4,000 for Gold",2419,0
"Soon Marijuana May Lead to Ticket, Not Arrest, in New York",1732,0
Nigeria: hopes for return of kidnapped schoolgirls rise after ceasefire reported,1195,0
"James Wright Foley, Kidnapped Journalist, Apparently Executed by ISIS",991,0
"This boy nearly died, now he has a superpower like Marvel’s Magneto",2109,0
Militant Group Says It Killed American Journalist in Syria,1580,0
US Lawmaker: Ten ISIS Fighters Have Been Apprehended Coming Across Southern Border (Video),2367,0
Biological Warfare on the Horizon? ISIS Soldiers May Be Infected With Ebola,2138,0
Video Purports To Show Beheading Of U.S. Journalist By Militants,903,0
Audio of gunfire in Michael Brown case authenticated by app company,1817,0
US hostage Luke Somers dies after rescue bid,1187,0
Ferguson riots: audio may have captured Michael Brown shooting,2250,0
Seth Rogen Is Woz,1141,0
"Sadly, Pumpkin Spice Condoms Aren't A Thing After All",2252,1
Missing Libyan jetliners raise fears of terror attacks on 9/11,2208,1
Lebanon 'holding IS leader's daughter and ex-wife',1263,0
ISIS Video Purports To Show Beheading Of British Aid Worker,2306,0
Macaulay Culkin Dead? Another Death Hoax Circulates On Facebook,1555,1
"Boko Haram: Kidnapped Girls Have Been Married Off, Truce Never Happened",2403,0
Seven teenage girls get pregnant on school trip,1140,1
"Nun gives birth, intends to keep baby",1412,1
That Boko Haram Ceasefire in Nigeria Isn’t A Ceasefire,2191,0
James Foley remembered as 'brave and tireless' journalist,847,0
It’s Okay To Laugh About The Fact That The Vogue Rat Infestation is Getting Worse,788,0
Cheeky vandals paint giant penis on bonnet of £1.5 million Bugatti Veyron sportscar,1320,0
Lawmaker Says ‘At Least 10′ Islamic State Fighters Have Been Captured at the Southern U.S. Border,742,0
Pentagon: Airstrike killed terror leader in Somalia,981,1
"Spider burrowed into appendix scar, crawled through WA man's body",1531,-1
Kidnapped Nigerian schoolgirls: Government claims ceasefire deal with Boko Haram that will bring missing girls home,1540,0
"A message from Jim's mom, Diane Foley:",2524,1
"280 Pound Catfish: Fisherman Makes Huge Catch In Italy, Catfish Could Set Record",1338,1
Islamic State killer 'Jihadi John' named as Mohammed Emwazi,1780,0
Islamic State accused of using chlorine gas on Iraqi soldiers,1233,0
Bali Awry,1478,0
ISLAMIC STATE BEHEADS MISSING AMERICAN JOURNALIST JAMES WRIGHT FOLEY,2147,0
Report: Secret Service Lied About White House Fence Jumper,2409,0
"Pumpkin Spice Condoms, And 6 Other Flavors That Aren’t Happening",1985,0
"Apple Watch Pricing to Reportedly Start at $500 for Stainless Steel, $4,000 for Gold",1425,0
Fears Islamic State could launch EBOLA attack on Britain after fighters 'contract virus',1506,0
"Macaulay Culkin Dead? Hoax Goes Viral, Claims Actor Found Dead in Apartment",2502,1
Oscar winner Christian Bale to play Steve Jobs in upcoming biopic,454,-1
Questions raised over Nicaragua 'meteorite',221,0
"Nigeria, Boko Haram reach ceasefire deal, kidnapped girls to go free, official says",2403,0
"New York schoolboy who made $72MILLION trading stocks on his lunch breaks - and now takes his friends out to dine on $400 caviar, drives a BMW and has definitely made his immigrant parents proud",1167,0
"Six months after abducting Nigerian schoolgirls, Boko Haram reportedly wants to free them",1761,0
US confirms death of Somalia terror group leader,427,1
Ottawa shooting: Slain soldier named as Nathan Cirillo while suspect identified as Michael Zehaf-Bibeau,1554,1
#HairGate: iPhone 6 Customers Are Complaining That The Phone Is Ripping Out Their Hair,2276,0
"Soldier, Gunman Killed In Shooting Incident Near Canadian Parliament",2410,0
Iraq Says Arrested Woman Is Not The Wife of ISIS Leader al-Baghdadi,1263,1
ISIS Reportedly Beheads U.S. Journalist James Wright Foley on Camera,2096,0
Seth Rogen Eyed to Play Apple's Steve Wozniak in Christian Bale's Steve Jobs Movie (Exclusive),1575,0
Nigeria: hopes for return of kidnapped schoolgirls rise after ceasefire reported,455,0
Someone painted a graffiti dick on a $2.5 million car,948,-1
ISIS Beheading of U.S. Journalist James Foley Posted to YouTube,2495,0
Video messaging service verifies timing of CNN audio recording,2118,0
Saudi Arabian cleric issues fatwa against snowmen,399,1
U.S. arms airdrop fell into ISIS hands: Pentagon,2200,0
Ottawa investigates reports that Isis has captured Canadian-Israeli woman,1893,0
Bali Awry,1579,0
Macaulay Culkin Hasn’t Died Despite What Everyone Is Saying On Facebook,1174,1
News sites fall for Putin bird-dropping video,1087,0
"Gene Munster Predicts $499 Steel Apple Watch, $4,999 for 18k Gold Edition",2092,0
Israeli-Canadian Woman 'Captured' By ISIS Says She Is 'Safe And Secure',2302,0
Christian Bale won't play Steve Jobs,2211,1
"Mass Graves Found In Mexico, Near Place Where 43 Students Went Missing",1912,0
Dylan Thomas Finds Tropical Spider Burrowed Under Skin,1321,-1
Christian Bale won't play Steve Jobs,1157,0
Video shows ISIL beheading of photojournalist James Foley,1948,0
"Boko Haram Denies Truce, Says Kidnapped Girls Have Been “Married Off”",2530,0
Insurgents killed in Nigeria despite alleged truce with Boko Haram,600,0
"What was fake on the Internet this week: Obama’s peace prize, pumpkin-spice condoms and insane winter snow",1060,0
"White House Fence-Jumper Overpowered Secret Service Officer, Ran Through Much of Main Floor",1017,1
"Dogs DO go to heaven… and cats, and horses: Pope assures young boy that there is a place in paradise for animals as well",1905,1
Fears journalist James Wright Foley beheaded by Islamic State jihadists in ‘message’ to United States,1679,0
Iraqi media: ISIS militants have contracted Ebola,1891,0
China App Store Manipulation Photo Goes Viral - But Is It Real?,2420,0
Christian Bale quits Steve Jobs movie,2455,0
Does ISIS Have Ebola? Probably Not! Media Reports It Anyway,2075,0
James Foley beheading: London rapper turned jihadist believed to be under investigation for murder of journalist in Syria,951,0
"Explosion reported near the Nicaraguan capital attributed to meteorite impact, but experts, including NASA, cast doubt on claims",2264,0
Texas Plumber Isn't Sure How Extremists In Syria Ended Up With His Work Truck,2145,1
"Brian Williams: No, Our Meteorologist Was Not Peeing on Live TV",975,1
Accountant Says Comcast Got Him Fired for Contesting Bogus Charges,2405,0
Homeland Security says terrorists haven't crossed U.S-Mexico border,2016,1
Spider Burrows Into Australian Man's Appendix Scar (VIDEO),1502,1
US officials: Video shows American's execution,481,0
Continuing Violence Puts Boko Haram Ceasefire In Jeopardy,1588,0
Tips for Chinese choosing an English name,1660,1
Obama administration DENIES congressman's claim that 'at least ten ISIS fighters have been caught coming across the Mexican border in Texas',1946,0
"Dead for 48 minutes, this Catholic Priest claims God is female",1407,1
"'Star Wars VII' News, Update: JJ Abrams Pushing for Summer Release?",1843,0
"After Giving A Homeless Man $100, This Guy Secretly Filmed Him...",794,-1
Islamic State killer 'Jihadi John' named as Mohammed Emwazi,1800,0
CNN Airs Alleged Audio from Michael Brown Shooting,2149,0
Mohammed Emwazi: Man identified as Isis killer 'Jihadi John' was 'stopped by MI5' while on safari holiday in Africa in 2010,872,0
That Boko Haram Ceasefire in Nigeria Isn’t A Ceasefire,1681,0
Did NBC Nightly News Go Live To A Man Who Was Taking A Piss?,1333,0
James Foley beheading: London rapper turned jihadist believed to be under investigation for murder of journalist in Syria,1202,0
Missing American journalist reportedly beheaded by Islamic State ,311,0
"See How This Homeless Man Spends A Hundred Dollars, And Keep A Tissue Handy [Video]",1020,1
ISIS executioner 'Jihadi John' identified as Mohammed Emwazi,2123,0
Woman Spends Entire Week In KFC After Getting Dumped By Her Boyfriend,1523,1
Meteorite leaves crater in Nicaraguan capital Managua,2475,-1
NASA Raises Doubts About Reports of Nicaraguan Meteorite,966,-1
Will King of Jordan lead airstrikes on ISIS HIMSELF? Reports say trained pilot plans to take part in attack after quoting Clint Eastwood's Unforgiven to Congressmen,2490,0
James Foley Killer ‘Jihadi John’ Believed to Be Former London Rapper Abdel-Majed Abdel Bary,1314,0
Iraqi media: ISIS militants have contracted Ebola,1615,0
Watch: US marine survives Taliban sniper headshot in Afghanistan,2360,1
North Korea dictator Kim Jong-un 'set to open a new restaurant in SCOTLAND',1756,0
Report—Jose Canseco accidentally shot at his home tonight,1154,0
"'American bombing had signed my death certificate': Missing US journalist James Wright Foley goes unflinching to his death as ISIS behead him in horrific video, as a warning to Obama",928,0
DNA tests prove Lebanon IS holding ISIS chief al-Baghdadi's ex-wife and daughter after they were caught with fake passports,1004,0
ISIS fighters ‘have contracted Ebola’,2060,0
Kim Jong-un: obese leader 'fractured both ankles',1854,0
Anyone for dog meat soup? Kim Jong-Un considers opening restaurant in Scotland selling North Korean delicacies,2192,0
"No, that broken pencil illustration isn't by Banksy",1688,0
"No, Jordan's King Abdullah II is not personally flying planes against Isis",2274,1
Josh Paler Lin Gives A Homeless Man $100 And Follows Him To See How He Spends It,1996,1
Durex Is Not Making Pumpkin Spice Condoms After All: A Hoax Debunked,2055,1
Missing American journalist reportedly beheaded by Islamic State ,2495,0
Report: Christian Bale Just Bailed on the Steve Jobs Movie,2343,0
Turkish president says American weapons drop for Kurdish fighters was 'wrong' after supplies end up in the hands of ISIS,1363,1
"McDonald’s to Stop Serving Overweight Customers in January? Nope, ‘1/15/2015′ Story is Fake",2184,-1
Questions raised over Nicaragua 'meteorite',1056,0
Predator drones being flown over Isil's Syrian 'capital',2129,0
"Rare meteorite impact causes blast in Nicaragua's capital, Managua",1790,0
"No, Pumpkin Spice Condoms Are Not A Real Thing",2354,1
Report claims Kim Jong-un underwent surgery to repair fractured ankles,1854,0
Missing Libyan aircraft spark fears of 9/11-style attack in North Africa,1372,-1
Angry mob chops off man's genitals with butcher’s knife for alleged rape attempt,2115,1
New policy could reduce marijuana possession arrests,2217,0
Isis supporters claim US hostage killed in coalition air strike in Syria,1337,0
"ISIS using bombs containing live SCORPIONS in effort to spread panic, in tactic used 2,000 years ago against Romans",1251,1
ISIS Executioner 'Jihadi John' Is Named as Mohammed Emwazi,1724,0
"David Haines Beheaded By ISIS, Execution Video Contains Threats Against UK: Reports",1989,1
Video Messaging App Says Audio Recording Of Michael Brown's Shooting Is Authentic,2317,0
Boko Haram 'ceasefire' doubts after attacks reported in Nigeria,1821,1
The Story Of The High School Trader Who Made $72 Million Is A Rumor Spun Out Of Control,2052,0
"Islamic State, in video titled ""A Message to America,"" beheads American journalist James Wright Foley who was kidnapped in 2012",1658,1
"James Wright Foley, Kidnapped Journalist, Apparently Executed by ISIS",2524,0
Jordanian airstrike killed American aid worker held hostage by ISIS according to statement by militants,977,0
Passenger Wears A Hazmat Suit To Dulles Airport,1826,1
"Boko Haram denies truce, says kidnapped girls married",2530,0
The Case of the Stolen Batmobile Has Been Solved,1529,0
Is the Alleged Audio of the Gunshots That Killed Michael Brown a Hoax?,2481,0
Report—Jose Canseco accidentally shot at his home tonight,869,0
Code/Red: Apple Watch Battery Life — “Charge Nightly”,1898,0
Macaulay Culkin Dead? Another Death Hoax Circulates On Facebook,1805,1
Seven girls as young as 13 become pregnant on a school trip,2304,0
"Woman detained in Lebanon is not al-Baghdadi's wife, Iraq says",2283,-1
Watch: ISIS Claims to Have Captured U.S. Airdropped Weapons,2509,0
Nigeria: hopes for return of kidnapped schoolgirls rise after ceasefire reported,2191,0
Rapper identified as James Foley's executioner: reports,330,0
Islamic State Leader al-Baghdadi “Not Dead”,1645,0
Did a Meteorite Impact in Nicaragua over the Weekend?,2154,0
Boko Haram 'ceasefire' doubts after attacks reported in Nigeria,1681,0
Saddam Hussein’s pilots training Islamic State group,2408,0
"Everybody Relax, Banksy Wasn’t Arrested And Exposed As A 35-Year-Old Man",1884,1
ISIL video claims beheading of kidnapped journalist James Foley,1744,0
Apple Watch’s Power Reserve feature combats short battery life,1911,0
Bodies In Mexico Mass Grave Apparently Not Those Of Missing Students,1109,1
British hostage David Haines beheaded by Islamic State terrorists,2241,0
Pants on Fire: Duncan Hunter makes unconfirmed claim Border Patrol caught at least 10 ISIS fighters,2266,0
"James Wright Foley, Kidnapped Journalist, Apparently Executed by ISIS",1016,0
"Rare meteorite impact causes blast in Nicaragua's capital, Managua",1722,0
Jose Canseco shoots self in hand,1697,0
Indian worker sacked after going on leave for 24 years,2441,1
Bali Awry,1883,0
Michael Brown shooting audio caught on tape?,149,0
"Obama, Outraged Over Beheading, Vows to Stay on Course",1966,1
Attorney: New audio reveals pause in gunfire when Michael Brown was shot,1605,0
Axl Rose NOT Dead: Fake MSNBC Death Hoax Goes Viral On Facebook,2525,1
"It was me! Student, 19, reveals SHE was the Teletubbies' giggling baby in the sky - and was paid just £250 and a box of toys",1623,1
"Batmobile Stolen From ""Batman v Superman: Dawn of Justice"" Set, Zack Snyder Knows Who Did It",672,-1
Mexican investigators fear mass grave might hold 43 missing students,2334,0
"BATMOBILE NOT STOLEN, MTV CONTEST PRIZE REMAINS UNCLAIMED",1459,0
Boko Haram 'ceasefire' doubts after attacks reported in Nigeria,1027,1
"Rumor: Apple Watch to feature 512MB of RAM, 4GB of storage",1585,0
Government fires employee who skipped work for 24 years,2134,1
Kim Jong-un ‘is so fat from eating cheese that he has broken his ankles’,2053,0
"'American bombing had signed my death certificate': Missing US journalist James Wright Foley goes unflinching to his death as ISIS behead him in horrific video, as a warning to Obama",1116,0
"#Hairgate: Reports of iPhone 6 pulling out hair, beards, likely exaggerated",2276,0
Islamic State releases video apparently showing the beheading of missing US journalist James Foley,1721,0
Christian Bale in Talks to Play Steve Jobs in Danny Boyle's Biopic,1215,0
"HBO streaming service could launch in April for $15 per month, work on Apple TV",75,0
Michael Brown shooting audio caught on tape?,120,0
iPhone Game Developer Quits Job By Hiding The Greatest Letter Of Resignation Ever Inside His Game,2328,1
'Banksy' Reacts To Paris Attack With Poignant Drawing,1688,0
"Nigeria Says It Struck A Cease-Fire With Boko Haram, But Are They Talking To The Right Guy?",2356,0
"U.S. accidentally delivered weapons to the Islamic State by airdrop, militants say",2168,0
Texas City plumber's truck ends up in Syrian war,1950,1
"Islamic State training fighter pilots in captured jets, monitoring group says",630,0
Congressman: ‘At least 10 ISIS fighters’ caught trying to cross into US,2385,0
"12in Retina MacBook Air release date rumours: All-new 12in MacBook Air design for 2015, launching at WWDC?",1362,0
"ISIS beheads American photo-journalist James Wright Foley, threatens more to come",1948,0
Video: Islamic State Claims to Have Captured US Weapons Airdrop Near Kobane,1076,0
"Leader of Qaeda-Linked Somali Group Is Dead, U.S. Says",1982,0
Turkish president says American weapons drop for Kurdish fighters was 'wrong' after supplies end up in the hands of ISIS,2172,1
"James Foley: American Journalist, James Wright Foley Beheaded in New ISIS Video [Breaking News]",2067,1
Vigilantes cut off alleged rapist's penis,1476,0
YPG Confirms: Gill Rosenberg Not Captured in Kobani,26,1
"Six months after abducting Nigerian schoolgirls, Boko Haram reportedly wants to free them",1588,0
The 'cub of Baghdadi': Has this boy become the youngest victim of Isis’s use of child soldiers?,1024,0
Report: Former Baseball Star Jose Canseco Accidentally Shot At Home,2000,0
"Mass Graves Found In Mexico, Near Place Where 43 Students Went Missing",983,0
Teen Makes $72 Million on the Stock Market,1563,-1
Conflicting reports on alleged IS capture of Canadian woman,1976,0
Mexico checks if 43 missing students in mass grave,1156,0
Nasa questions whether crater in Nicaragua caused by meteorite,1056,1
Vigilantes cut off alleged rapist's penis,1981,1
WSJ: Apple cut watch health features due to erratic sensors,1750,0
ISIS militants appear to behead abducted American journalist James Wright Foley in graphic video,2495,0
Kim Jong-un 'set to open a new restaurant in SCOTLAND',2192,0
"Managua explosion not a meteorite, NASA suggests",1573,1
Islamist terrorists Jabhat Ansar al-Deen tweet picture of Texas plumber’s truck fitted with anti-aircraft gun in Syria,2242,1
"Video showing American journalist beheaded believed real, officials and family say",2450,1
Christian Bale will not play Steve Jobs,2455,0
Fence-jumper got farther into White House,1274,0
Kidnapped Nigerian schoolgirls: Government claims ceasefire deal with Boko Haram that will bring missing girls home,1419,0
BREAKING NEWS: ISIS beheads missing American journalist James Wright Foley as warning to US to cease action in Iraq,1744,0
MPs credit sergeant-at-arms for saving lives in Parliament Hill shootings,611,0
ISIL video claims beheading of kidnapped journalist James Foley,933,0
CNN Plays Alleged Audiotape of Michael Brown ShootingMilitarization Of Police,1605,0
White House Fence Jumper Actually Made It Pretty Far Inside,2303,0
Batman Set To Play Steve Jobs In Upcoming Biopic,1299,-1
Street Artist BANKSY Arrested? Again?,949,0
Alleged audio of Michael Brown shooting released,1817,0
Nasa questions whether crater in Nicaragua caused by meteorite,1731,-1
The Arrest of the ISIS Leader's Wife and Son,703,-1
"Report: Stainless steel Apple Watch will be priced $500, gold at $5,000",1425,0
Unverified video shows beheading of aid worker David Haines,2206,0
Vogue's new digs are reportedly swarming with rats,1693,0
"No, Robert Plant Didn’t Rip Up an $800 Million Contract",2489,0
SHOCK CLAIM: PGA Golfer Says Tiger Woods Is Suspended For Failed Drug Test,1417,0
ISIS Getting Ebola,1669,0
Russian Yeti Or Bigfoot Hoax? New Footage Sparks Debate,2377,0
New Audio Reveals Pause in Gunfire When Michael Brown Was Shot: Attorney,1446,0
Isis claims to behead US journalist,2495,0
Is this the world's oldest burger? Man claims to have kept McDonald's Quarter Pounder for 20 YEARS,2474,0
CNN audio: Is this the moment Michael Brown was shot?,2317,0
This Guy Paid Off His Parents’ Mortgage For Christmas,1599,0
Eyewitness Says Viral Video of Homeless Man Was Staged,2061,-1
Street Artist BANKSY Arrested? Again?,48,0
CNN plays chilling audio recording allegedly from Michael Brown shooting: “At least 11 shots”,1817,0
Anyone for dog meat soup? Kim Jong-Un considers opening restaurant in Scotland selling North Korean delicacies,2309,0
Christian Bale in Talks to Play Steve Jobs (Exclusive),72,0
More American Weapons for ISIS,2200,0
Apple Watch battery will require nightly charging,1898,0
US hostage Luke Somers dies after rescue bid,892,0
Breaking: Soldier shot at National War Memorial in Ottawa,1071,0
Big Bank Hank of The Sugarhill Gang is dead at 57,2080,1
Lynch mob chop man's penis off after catching him allegedly trying to rape teenager,1981,1
"Tiger Woods is not on suspension for failing a drug test, his agent and a PGA official say",2330,1
From bendgate to hairgate: Now iPhone 6 users complain the device is ripping out their hair,2276,0
Sugarhill Gang's Big Bank Hank Dead At 57,2398,1
Pentagon: Airstrike killed terror leader in Somalia,839,1
ISIS executioner 'Jihadi John' identified as Mohammed Emwazi,2349,1
Dog abandoned at Scotland train station with suitcase,2523,1
Has Ebola infected Isis militants in Mosul?,1506,0
Audio recording allegedly captures moment Michael Brown was shot,1916,0
Nigeria says ceasefire agreed with Boko Haram,840,0
Attorney: New audio reveals pause in gunfire when Michael Brown was shot,721,0
White House Fence Jumper Actually Made It Pretty Far Inside,1488,0
It's back! The incredible new Batmobile takes a spin around Detroit... after rumors it had been STOLEN,1737,0
Libya: Missing Libya Planes Spark Security Concerns,1312,1
Russian Man Wakes Up to Find His Testicles Have Been Stolen,845,1
Michael Phelps' self-proclaimed girlfriend says she was born a BOY and reveals 'amazing' sex with Olympian,494,1
"Whoa, Paul Rudd Was One of the Airport Heroes Who Took Down the Homophobe",1094,0
Heartbroken girl spends week in KFC after getting dumped,159,0
"Cook said to confirm Apple Watch is showerproof, lasts a day",2472,0
Meteorite strike in Nicaragua puzzles experts,1213,-1
"Rare meteorite impact causes blast in Nicaragua's capital, Managua",2264,0
BiH: Seven Primary School Students Pregnant After Five-Day Excursion,1804,1
"No, Banksy has not been arrested (sigh)",1940,1
Islamic State claims it executed American photojournalist James Foley,1679,0
ISIS Border Crisis: DHS Chief Says Terrorists Not Entering US Through Mexico,1185,0
Brian Williams Insists NBC News Meteorologist Did Not Pee in the Snow While on Air,1829,-1
“Axl Rose dead 2014” : Guns N' Roses frontman killed by internet death hoax,1859,1
An Audio Recording of the Michael Brown Shooting Has Reportedly Surfaced,693,0
Accountant Says Comcast Got Him Fired for Contesting Bogus Charges,451,0
Sugarhill Gang Rapper ‘Big Bank Hank’ Dies at 57,2398,1
YPG Confirms: Gill Rosenberg Not Captured in Kobani,2302,0
Christian Bale Won't Play Steve Jobs After All,2455,0
"Islamist Militants 'Steal' 11 Commercial Planes In Libya, Sparking Terror Attack Fears",920,0
"ISIS: We have our hands on weapons, ammo air-dropped by U.S.",2295,0
Man who skipped work for 24 years is finally fired,829,1
Watch: US Marine saved by helmet after being shot by Taliban sniper,488,1
Comcast blocks Tor,2177,-1
Al-Shabab leader who ordered Kenya mall massacre believed killed in US drone attack in Somalia,1176,0
WATCH: Stan Beaton cries tears of joy when phone engineers find treasured voicemail recording of his late wife he thought was lost forever,996,1
Wife Of ISIS Leader Abu Bakr al-Baghdadi Detained In Lebanon,509,0
"Mexico hit by student massacre: At least 17 anti-corruption protesters 'rounded up, murdered and dumped in a mass grave' - and another 26 are missing",2334,0
Meteorite leaves crater in Nicaraguan capital Managua,1573,-1
Missing American journalist reportedly beheaded by Islamic State ,2450,0
Nigeria says it has deal with Boko Haram to release kidnapped girls,557,0
ISIS Border Crisis: DHS Chief Says Terrorists Not Entering US Through Mexico,742,0
"Despite no Ebola case in Kansas City, the rumor goes viral",1943,1
Watch: ISIS Claims to Have Captured U.S. Airdropped Weapons,2404,0
ISIS Appears To Behead American Photojournalist In YouTube Video,903,0
"Apple Watch pricing: Will you spend $5000 for Gold edition, $500 for stainless steel?",2419,0
Has Ebola infected Isis militants in Mosul?,1891,0
Officials: Report That Area Town Is Under Ebola Quarantine Is False,1467,1
"Man cuts off manhood, throws it in the bin, after girlfriend leaves over small penis",2496,1
Kim Jong-Un's Sister Takes Control in North Korea,2473,0
Christian Bale In Talks To Play Steve Jobs In Sony's Next Biopic,1217,0
ISIS Seemingly Beheaded American Journalist James Wright Foley,2495,0
Two GOP Congressmen Say Suspected Terrorists Caught Crossing U.S.–Mexico Border,2261,0
Iraqi Official Dismisses ‘Unfounded’ Reports That ISIS Fighters Have Ebola,2003,0
Unconfirmed reports claim Canadian-Israeli Gill Rosenberg captured by ISIS,1976,0
"No, it's not Tiger Woods selling an island in Lake Mälaren",1375,-1
Senior Western Intelligence Official Confirms London Rapper Abdel Majed Abdel Bary Is A Suspect In The Foley Killing,1530,0
Ebola Scare in Kansas City,2104,0
Al Qaida hostage killed in raid,1988,0
Banksy 'Arrested & Real Identity Revealed' Is The Same Hoax From Last Year,2468,1
NYC relaxes response to marijuana possession,2163,1
ISIL video claims beheading of kidnapped journalist James Foley,2047,0
Canadian official identifies dead Ottawa gunman as Michael Zehaf-Bibeau,2246,0
Saudi Arabian cleric issues fatwa against snowmen,732,1
Apple Watch Gold Edition rumored to be priced at $1200: Will you buy?,424,0
British hostage David Haines beheaded by Islamic State terrorists,2102,1
Pentagon: ISIS Got U.S. Weapons Package,1597,1
"Yemen says U.S. man freed, sister says he’s dead",1988,0
Video Messaging App Says Audio Recording Of Michael Brown's Shooting Is Authentic,1916,0
"Stainless steel Apple Watch could cost just $499, but gold will be 10 times as pricey",2365,0
Tropical spider burrowed under man's skin through appendix scar and lived there for THREE DAYS,986,-1
IRAQI HEALTH OFFICIAL: EBOLA HAS KILLED 5 ISIS FIGHTERS,1778,0
