Headline,Body ID,Stance
"'American bombing had signed my death certificate': Missing US journalist James Wright Foley goes unflinching to his death as ISIS behead him in horrific video, as a warning to Obama",2388,0
ISIS Beheads Kidnapped Photojournalist James Wright Foley in Horrific Video Message to the U.S.,1679,0
"Planetary Alignment Decrease Gravity Hoax on Jan 4, 2015: ‘Will Decrease Gravity For 5 Minutes Causing Partial Weightlessness’ in January is Totally Bogus",1377,1
"Nigeria claims deal with Boko Haram on ceasefire, kidnapped girls",2191,0
Sugarhill Gang's Big Bank Hank Dead At 57,1637,1
CNN Airs Alleged Audio from Michael Brown Shooting,2481,0
Macaulay Culkin Dead? Another Death Hoax Circulates On Facebook,1752,1
HORROR: ISIS Fighters Have Reportedly Contracted Ebola,1689,0
ISIS leader ‘killed’ in US airstrikes,1645,0
"Oh Hey, Paul Rudd Was One Of The Dallas Airport Homophobe Heroes, No Big",1735,-1
ISIS Leader Killed: Abu Bakr Al-Baghdadi Reportedly Killed By U.S. Airstrike,1645,0
BREAKING: ISIS Beheads American Journalist James Wright Foley,1679,0
"Apple Watch Specs Tipped; Said to Feature 512MB RAM, 4GB of Storage",1277,0
"Yemen says U.S. man freed, sister says he’s dead",2247,0
Missing American journalist reportedly beheaded by Islamic State ,1011,0
"Ann Arbor pizza delivery driver surprised with $2,000 tip",676,1
US Lawmaker: Ten ISIS Fighters Have Been Apprehended Coming Across Southern Border (Video),2249,0
Shots Heard In Alleged Brown Shooting Recording [AUDIO],384,0
Mexico finds 4 more graves at site of suspected student massacre,777,0
‘Feminist’ says she aborted baby because it was a boy,1494,1
Journalist James Wright Foley reportedly beheaded by ISIS,928,0
China: Satirical site warns citizens over name choices,2260,1
"Gill Rosenberg, Canadian-Israeli Woman Feared Kidnapped By ISIS, Says She's Safe",2302,0
NEWS/ Meet the Teletubbies Sun Baby: 19-Year-Old Jess Smith Reveals Herself as the Smiling Face Who Looked Over Teletubbyland,2371,0
ISLAMIC STATE BEHEADS MISSING AMERICAN JOURNALIST JAMES WRIGHT FOLEY,2386,1
Utah Man Hospitalized After Winning Eggnog Chugging Contest,1901,1
"Meteorite makes big crater in Nicaragua, government says",2475,-1
Boko Haram Denies Nigeria Cease-Fire Claim,2272,1
Video Purports To Show Beheading Of U.S. Journalist By Militants,1580,0
That Boko Haram Ceasefire in Nigeria Isn’t A Ceasefire,837,1
ISIS Beheading of U.S. Journalist James Foley Posted to YouTube,2096,0
Hope Fades for Girls' Release After Boko Haram 'Truce' Breached,531,0
"Paradise is open to all, even dogs, Pope tells boy",1905,1
Nun who gave birth ‘had no idea’ she was pregnant,1828,0
Insurgents killed in Nigeria despite alleged truce with Boko Haram,1761,0
Confusion Surrounds Capture Of “ISIS Leader’s Wife”,1877,0
"Calm Yourselves, Durex Has NOT Come Out With A Pumpkin Spice Condom",2252,1
U.S. airstrike kills Islamic Al Shabab terrorist leader in Somalia,2364,0
Tiger Woods' former luxury island goes on sale,965,1
Isis claims to behead US journalist,1116,0
Mexico checks if 43 missing students in mass grave,1984,0
Fence-jumper got farther into White House,1840,1
"Rare meteorite impact causes blast in Nicaragua's capital, Managua",601,-1
Pumpkin Spice Condoms Could Be The Only Thing To Save The World From Basic Children,2354,0
"Ann Arbor pizza delivery driver surprised with $2,000 tip",2122,1
ISLAMIC STATE BEHEADS MISSING AMERICAN JOURNALIST JAMES WRIGHT FOLEY,1679,0
"Apple Watch Battery Life Currently 'About a Day', but May Improve for 2015 Launch",1702,0
"Op-Ed: Hoax – Priest who never existed claims he died, saw female God",1549,1
Report claims Kim Jong-un underwent surgery to repair fractured ankles,1095,0
Kimye’s Fault? Anna Wintour’s NYC ‘Vogue’ Offices Hit With Disgusting Rat Infestation: ‘Rat Droppings On Desks’,1619,0
Axl Rose Dead? Of Course Not — Tiresome Internet Death Hoax Plague Hits Guns N’ Roses Frontman,1271,1
Israeli Canadian fighting ISIS posts on Facebook: I'm safe and secure,1173,0
Report: Possible audio tape of Michael Brown shooting,2250,0
ISIS Blasts 'Scorpion Bombs' At Civilian Areas In Iraq; Mosul Residents Living In Fear,1251,1
Audio of gunfire in Michael Brown case authenticated by app company,2118,0
Unconfirmed reports saying ISIS UK Hostage David Haines Beheaded,1757,0
Sugarhill Gang Rapper ‘Big Bank Hank’ Dies at 57,2035,1
Report: Audio Reveals Pause Between Gunshots When Michael Brown Was Shot,1818,0
Teen Makes $72 Million on the Stock Market,1184,1
Steve Jobs Biopic Eyes Seth Rogen to Play Apple Co-Founder Steve Wozniak,1002,0
Is Ebola Virus Spreading Among ISIS Militants? Reports Claim Jihadists Seeking Cure at Mosul Hospital,1689,0
"Catholic Priest Dead For 48 Minutes, Is Miraculously Revived – His Revelations About God Are Even More Shocking",1008,1
White House Fence Jumper Pushed Past Female Guard,2303,0
Christian Bale will not play Steve Jobs,1217,0
"Mass Graves Found In Mexico, Near Place Where 43 Students Went Missing",1795,0
Kimye’s Fault? Anna Wintour’s NYC ‘Vogue’ Offices Hit With Disgusting Rat Infestation: ‘Rat Droppings On Desks’,2498,1
Small Meteorite Strikes in Nicaragua's Capital City of Managua,0,1
Spider Burrows Into Australian Man's Appendix Scar (VIDEO),1923,-1
Update: Frisco paramedics transporting patient believed to be exhibiting Ebola-like symptoms,1129,0
Apple Watch may be powered by Samsung processor,1771,0
Animal lovers abuzz over pope’s comments that 'paradise is open to all of God’s creatures',1371,1
Nigeria says ceasefire agreed with Boko Haram,1588,0
Soldier shot near Canadian parliament building,2410,0
Graffiti Artist Banksy Arrested In London; Identity Revealed,1884,-1
"Dogs DO go to heaven… and cats, and horses: Pope assures young boy that there is a place in paradise for animals as well",1651,1
Boko Haram denies it has agreed ceasefire,2530,0
American hostage killed in rescue attempt in Yemen - senior official,2247,0
Eyewitness Says Viral Video of Homeless Man Was Staged,1996,-1
Unconfirmed reports saying ISIS UK Hostage David Haines Beheaded,2206,0
Microsoft Hires Dalek-style Robocops to Guard Silicon Valley HQ,2529,1
"So, There Might Be a Rat Infestation at Vogue",1619,0
Shots Heard In Alleged Brown Shooting Recording [AUDIO],693,0
ISIS Beheading of U.S. Journalist James Foley Posted to YouTube,1288,0
"Dead for 48 minutes, Catholic Priest claims God is female",1549,-1
Jose Canseco Accidentally Shot Himself in the Hand,1145,0
Islamic State fighters detonate 'SCORPION bombs' in terror siege,386,0
An accidental delivery of arms to the Islamic State and the problem with airdrops,2397,0
Continuing Violence Puts Boko Haram Ceasefire In Jeopardy,2139,0
Josh Paler Lin Gives A Homeless Man $100 And Follows Him To See How He Spends It,1388,0
Boko Haram Denies Nigeria Cease-Fire Claim,2191,0
Jeh Johnson shoots down Duncan Hunter's assertion IS is entering U.S. via Mexico,324,1
Alleged Ottawa gunman: What we know so far about Michael Zehaf-Bibeau,1329,0
"Fidel Castro Rumors Sweep Internet, but No Sign in Cuba",1003,0
Isis claims US hostage Kayla Mueller killed in coalition airstrike,1293,0
Now the Vogue Rats Are Chewing Through Couture,2498,1
Vladimir Putin’s Motorcade Looks Like A Massive Knob,2391,1
Seth Rogen to Star as Steve Wozniak in Sony's Steve Jobs Biopic [Updated],1002,0
Missing American journalist reportedly beheaded by Islamic State ,2388,0
WFB’s Bill Gertz: Obama Administration ‘Trying to Play Down’ Missing Libyan Airliners,1958,1
Media outlets identify 'Jihadi John',1939,0
Bali spider burrows under Aussie’s chest,1602,0
Ottawa Shooting: Soldier Shot at Canada's National War Memorial,2281,1
Lebanon confirms holding ISIS chief’s kin,2283,1
Original Apple Watch Health Features Were Dropped Due to Consistency Issues,1917,0
An Indian Civil Servant Just Got Sacked After Not Turning Up For Work For 25 Years,932,1
Alleged audio of Michael Brown shooting released,2345,0
Tourist wakes to find strange red trail on his stomach - and discovers a spider has burrowed through his appendix scar and crawled UNDER his skin while on holiday in Bali,1923,-1
ISIL video claims beheading of kidnapped journalist James Foley,632,0
"Insiders Claim Steel Apple Watch to Start at $500, Gold at $4,000",2277,0
"Macaulay Culkin Dead? Hoax Goes Viral, Claims Actor Found Dead in Apartment",1805,1
Mexico finds 4 more graves at site of suspected student massacre,983,0
Ottawa investigates reports that Isis has captured Canadian-Israeli woman,1976,0
Texas Truck Winds Up in Syria With Islamic Militants,1906,1
What One Homeless Man Does with $100 Will Astonish You (VIDEO),2061,1
Magic mushrooms found in BUCKINGHAM PALACE by Alan Titchmarsh,2480,0
Hundreds mourn the 'death' of Fidel Castro after rumours sweep Twitter (but are they confusing him with recently departed Fidel Castro Odinga from Nairobi?),2251,0
Macaulay Culkin Victim of Another Online Death Hoax,198,1
DNA test confirms child is IS head Abu Bakr al-Baghdadi's daughter,931,0
Comcast calls rumor that it disconnects Tor users “wildly inaccurate”,2178,1
ISIS leader ‘killed’ in US airstrikes,891,0
"Canterbury Christ Church University student Jess Smith, from Chatham, starred as Teletubbies' sun",2227,1
Kim Jong-Un's sister reportedly running N. Korea,2477,0
Constipated goldfish operated on by North Walsham vet,958,1
IPhone 6 users are tearing their hair out,2276,0
Missing American journalist reportedly beheaded by Islamic State ,847,0
Isis video claims to show beheading of British hostage David Haines,2440,0
"US, UK eye rapper as British-born militant who beheaded journalist James Foley",1079,0
Fence jumper reportedly made it much further into White House than Secret Service said,1921,0
James Foley remembered as 'brave and tireless' journalist,1679,0
Macaulay Culkin dead hoax: Fake death report spreads on social networks,1559,1
Christian Bale Exits Steve Jobs Movie (Exclusive),2455,0
ISIS fighters 'have contracted Ebola': World Health Organisation investigating reports militants showed up at Iraqi hospital with lethal disease,2180,0
"Apple Watch Pricing to Reportedly Start at $500 for Stainless Steel, $4,000 for Gold",2365,0
Axl Rose Dies? Guns N’ Roses Singer Dead ‘West Hollywood Home at Age 52′ is Fake,2166,1
Alleged audio of Michael Brown shooting released,2481,0
KIM DINE WITH ME: Porky president Kim Jong-un to open UK restaurant serving DOG,1222,-1
"Six months after abducting Nigerian schoolgirls, Boko Haram reportedly wants to free them",2144,0
Abdel Majed Abdel Bary Emerges as Suspect in Foley Beheading,1202,0
Satirical news site attacks China’s weird English names,2260,1
Paul Rudd Helped Tackle A Violent Homophobe So That’s Another Reason To Love Him [UPDATE],1735,-1
ESPN to save NFL's image with all-male domestic abuse discussion,1699,-1
Mohammed Emwazi: Man identified as Isis killer 'Jihadi John' was 'stopped by MI5' while on safari holiday in Africa in 2010,921,0
‘Islamic tribunal confirmed in Texas’,200,0
"Unhappy Customer: Comcast Told My Employer About Complaint, Got Me Fired",1383,0
Bunbury local discovered a spider had burrowed under his skin on Bali holiday,1478,1
Penis Spray-Painted on a $2.5 Million Car Was Just for a Prank Video,1148,1
‘Wild Misinformation’: Brian Williams Explains the Mike Seidel Liveshot,1046,1
IRAQI HEALTH OFFICIAL: EBOLA HAS KILLED 5 ISIS FIGHTERS,819,0
Teacher sex tape exposed as a FAKE after internet detectives trace the origin of pornographic clip,1496,-1
Boko Haram denies ceasefire claim by Nigeria's government,1885,1
Wife and son of Isil leader Abu Bakr al-Baghdadi 'detained at Lebanon border',1263,-1
WHO investigates media reports ISIS fighters contracted Ebola,938,0
Militant Group Says It Killed American Journalist in Syria,847,0
Isis claims to behead US journalist,1721,0
Canadian-Israeli Woman May Have Been Captured In Syria: Reports,1899,0
Strange mark turns out to be tropical spider burrowing under vacationer's skin,1864,0
An Audio Recording of the Michael Brown Shooting Has Reportedly Surfaced,398,0
Report: Nearly a Dozen Commercial Airliners Missing Ahead of 9/11 Anniversary After Islamists Overrun Libyan Airport,1515,0
Vigilantes cut off alleged rapist's penis,650,1
Weaponized Ebola? ISIS Militants Said To Contract Deadly Virus,2180,0
ISIL Beheads American Photojournalist in Iraq,1589,1
#ISIS beheads photojournalist James Wright Foley in a massage to US to end its intervention in #Iraq.,2450,1
Did a plumber's pick-up truck from Texas end up carrying an anti-aircraft gun for Islamic fighters on the front lines of Syria?,2280,0
ISIS Beheading of U.S. Journalist James Foley Posted to YouTube,1948,0
Lego letter from the 1970s still offers a powerful message to parents 40 years later,1969,0
This Week In Weird News: Horrible Human Slaps Elderly Woman For Sneezing,1952,0
Shots Heard In Alleged Brown Shooting Recording [AUDIO],816,0
"Meteorite Strikes Nicaraguan Capital, Creates 16-Foot-Deep Crater",1213,-1
James Foley beheading: London rapper turned jihadist believed to be under investigation for murder of journalist in Syria,1530,0
Gateway Pundit,1314,0
ISIS Appears To Behead American Photojournalist In YouTube Video,2388,0
Is the Alleged Audio of the Gunshots That Killed Michael Brown a Hoax?,1564,1
"BREAKING: ""Brat Pack"" Judd Nelson Found Dead in Los Angeles Condo",2286,-1
"No, that broken pencil illustration isn't by Banksy",1584,0
'Jihadi John' identified: ISIS killer named as Mohammed Emwazi from West London,2202,0
"Apple Watch Stainless Steel variant reportedly priced at $500, $4,000 for the gold variant",2365,0
Former British Rapper Reportedly Under Investigation for James Foley Beheading,330,0
Video: Islamic State Claims to Have Captured US Weapons Airdrop Near Kobane,1597,0
Jordan’s King May Participate Personally In ISIS Raids,1644,0
What Glenn Beck Fears May Be Done With the 11 Missing Jets,1197,1
"NYPD to issue tickets instead of arrest for weed possession, report says",2389,0
Apple may launch 12-inch MacBook Air with Retina Display,1063,0
ISIL video claims beheading of kidnapped journalist James Foley,1747,0
NEWS/ You'll Never Guess How a Homeless Man Spent $100—Watch the Touching Video!,738,1
"In New York City, Marijuana May Mean Ticket, Not Arrest",2389,0
Reports: Islamic State uses chlorine gas against Iraqi forces,1590,0
"Obama, Outraged Over Beheading, Vows to Stay on Course",2147,0
Lebanon 'holding IS leader's daughter and ex-wife',670,0
Report: Nigerian Woman Quarantined in KC with Ebola-Like Symptoms (Video),260,0
Man breaks down in tears when a lost recording of his deceased wife resurfaces,2020,1
"James Foley: American Journalist, James Wright Foley Beheaded in New ISIS Video [Breaking News]",2386,1
Small Meteorite Hits Managua,1722,0
"Gold Apple Watch Edition price? Speculators say at least $10,000",790,0
ISIL allegedly kills US journalist in video,2096,0
Two GOP Congressmen Say Suspected Terrorists Caught Crossing U.S.–Mexico Border,2249,0
The Chinese Guide to Avoiding a Bad English Name,1660,1
Nasa questions whether crater in Nicaragua caused by meteorite,767,1
Isis claims it has US airdrop of weapons,2404,0
‘The cub of Baghdadi': ISIS reports its youngest jihadist ‘got martyred’ in battle,230,0
ISIS Appears To Behead American Photojournalist In YouTube Video,933,0
Islamic State Leader al-Baghdadi “Not Dead”,1466,0
Ottawa gunman identified as 32-year-old Michael Zehaf-Bibeau,440,0
"HBO streaming service could launch in April for $15 per month, work on Apple TV",203,0
"Jihadi John named as Mohammed Emwazi, from west London",2123,0
Two GOP Congressmen Say Suspected Terrorists Caught Crossing U.S.–Mexico Border,2266,0
Militant Group Says It Killed American Journalist in Syria,2495,0
Texas Truck Winds Up in Syria With Islamic Militants,1614,1
Expert casts doubt on Bunbury man Dylan Thomas’s burrowing stomach-spider story,1478,-1
Kurds fear Isis use of chemical weapon in Kobani,964,0
Rapper Big Bank Hank of Sugarhill Gang dies at 57,2398,1
Seth Rogen to Star as Steve Wozniak in Sony's Steve Jobs Biopic [Updated],1575,0
YPG Confirms: Gill Rosenberg Not Captured in Kobani,1330,0
Apple Watch won’t be the digital doctor it could have been,521,0
An Audio Recording of the Michael Brown Shooting Has Reportedly Surfaced,2235,0
Durex on Rumored ‘Pumpkin Spice’ Condom: No Comment,2354,0
"Rats at Vogue's NYC offices - watch your step, Anna Wintour",1693,0
Angry mob cut off rapist’s penis with meat cleaver (VIEWER DISCRETION),805,1
Wife and son of Isil leader Abu Bakr al-Baghdadi 'detained at Lebanon border',2155,0
Media reports identify Londoner as Islamic State's ‘Jihadi John’,997,0
Kim Jong-un ‘is so fat from eating cheese that he has broken his ankles’,1854,0
Apple Watch to reportedly offer 'Power Reserve' to help extend battery life,1911,0
Report: 4 ISIS Terrorists Caught at Southern Border in 36 Hrs,2093,0
Is the Alleged Audio of the Gunshots That Killed Michael Brown a Hoax?,2345,-1
SEE IT: California homeless man uses $100 gift to give food to others,1388,0
US airstrike targets Al Shabaab leader Ahmed Abdi Godane in Somalia,2374,0
Report: Christian Bale Will Play Steve Jobs,1217,0
"Islamic State, in video titled ""A Message to America,"" beheads American journalist James Wright Foley who was kidnapped in 2012",2047,0
Pentagon: Airstrike killed terror leader in Somalia,1982,0
Islamic Militants Post Video Claiming to Show Beheading of U.S. Journalist,1471,0
MPs credit sergeant-at-arms for saving lives in Parliament Hill shootings,1631,0
CNN Posts Alleged Audio of Michael Brown Shooting,2287,0
Israeli Canadian fighting ISIS posts on Facebook: I'm safe and secure,1899,0
Led Zeppelin’s Robert Plant ripped up a $924 million reunion contract,295,-1
Vogue's new digs are reportedly swarming with rats,2072,0
Senior Western Intelligence Official Confirms London Rapper Abdel Majed Abdel Bary Is A Suspect In The Foley Killing,472,0
Batman Set To Play Steve Jobs In Upcoming Biopic,1846,-1
ISIL allegedly kills US journalist in video,2047,0
Zack Snyder’s ‘Batman V Superman: Dawn Of Justice’ Stolen Batmobile Rumor Put To Rest,1538,0
'I aborted my baby because it was a boy': Outrage after 'feminist' blogger claims gender prompted termination,2014,-1
New Audio Recording From Ferguson May Capture Michael Brown Shooting,2287,0
Mexico prosecutor: Students not in 1st mass graves,1795,1
Seth Rogen Eyed to Play Apple's Steve Wozniak in Christian Bale's Steve Jobs Movie (Exclusive),614,0
"In Vogue vs Rats War, the Rats Are Winning",2106,0
URGENT: ISIS kills 300 Iraqi soldiers by chlorine gas attack in Saqlawiyah,1590,1
"Boko Haram Could Release Kidnapped Girls, Nigerian Officials Say",600,0
Bali spider burrows under Aussie’s chest,2042,-1
#Hairgate trends on social media: iPhone 6 users complain of ripped out hair,1738,0
New Audio Shows Michael Brown Was Shot at 11 Times,2481,0
"Soldier shot, Parliament locked down after gunfire erupts at war memorial",2347,1
‘Photo of slain IS leader’ reported to be doctored,891,0
Unverified video shows beheading of aid worker David Haines,2348,0
Batmobile Stolen From 'Batman V Superman: Dawn Of Justice' Set? Report Claims That One Of The Batmobile Models Is Missing! Detroit Locals Responsible?,1242,0
WAS NBC METEOROLOGIST MIKE SEIDEL PEEING IN THE SNOW ON CAMERA? A TESTY BRIAN WILLIAMS EXPLAINS,1829,0
Nicaragua Meteorite Impact Theory May Be Meteor-wrong,1722,0
"Obama, Outraged Over Beheading, Vows to Stay on Course",2386,1
Unconfirmed reports saying ISIS UK Hostage David Haines Beheaded,2102,0
"Jeh Johnson: Politicians Shouldn't 'Feed The Flames Of Fear' Over ISIS, Ebola",666,1
That Boko Haram Ceasefire in Nigeria Isn’t A Ceasefire,2272,1
US Intel: Taliban Man Released From Gitmo in Bergdahl Deal is Back to Militant Activity,2159,0
Isis supporters claim US hostage killed in coalition air strike in Syria,2387,0
ISIL Beheads American Photojournalist in Iraq,2147,0
Sugarhill Gang Rapper ‘Big Bank Hank’ Dies at 57,598,1
REVEALED: Woman Behind $5 Million Per Year Youtube Channel Is a Former Porn Star  Read more at: http://nextshark.com/revealed-woman-behind-5-million-per-year-youtube-channel-is-a-former-porn-star/#rmns,1315,1
HORROR: ISIS Fighters Have Reportedly Contracted Ebola,1974,0
Texas City plumber's truck ends up in Syrian war,2379,1
Is this the world's oldest burger? Man claims to have kept McDonald's Quarter Pounder for 20 YEARS,1586,0
#ISIS beheads photojournalist James Wright Foley in a massage to US to end its intervention in #Iraq.,2495,0
Large space object slams Nicaragua’s capital as asteroid passes Earth,1825,0
Iraqi media: ISIS militants have contracted Ebola,1904,0
"Boko Haram: Kidnapped Girls Have Been Married Off, Truce Never Happened",2463,0
GOP Rep: ‘At Least Ten ISIS Fighters Have Been Caught Coming Across The Mexican Border’,1890,0
"Boko Haram Denies Truce, Says Kidnapped Girls Have Been “Married Off”",1540,-1
Meteorite leaves crater in Nicaraguan capital Managua,1073,0
Has Ebola infected Isis militants in Mosul?,2003,0
Isis claims it has US airdrop of weapons,2509,0
Staff Reporter,1784,0
Pentagon: ISIS Got U.S. Weapons Package,2172,1
Someone painted a graffiti dick on a $2.5 million car,498,1
"North Korean leader Kim Jong-un’s mystery illness actually two broken ankles, newspaper says",859,0
"Despite no Ebola case in Kansas City, the rumor goes viral",2501,1
"Everybody Relax, Banksy Wasn’t Arrested And Exposed As A 35-Year-Old Man",2362,1
Missing jetliners raise fear of new 9/11-style attacks after Libyan airport falls to Islamic militants,2162,0
The pumpkin spice condom is not happening,1954,1
Experts: More facts needed on purported audio recording of Michael Brown shooting,2149,0
Obama Denounces James Foley's Execution: 'Today The Entire World Is Appalled',1679,0
"Suspected meteorite leaves crater in Managua, is linked to asteroid",1825,0
"Kayla Jean Mueller, U.S. hostage, killed in Jordan airstrike, ISIS claims",2376,0
Vigilantes cut off alleged rapist's penis,830,1
British-born rapper is main suspect in search for ISIS jihadist who beheaded James Foley,1598,0
11 aircraft are missing from ‘terrorist-held’ Tripoli airport ahead of 9/11 anniversary,1165,0
"Tropical spider burrows under man's skin, lives there for three days",1057,-1
"Managua explosion not a meteorite, NASA suggests",961,-1
The Pumpkin-Spice Condom Is Just a Figment of Your Own Gross Imagination,2269,1
GOP Rep: ‘At Least Ten ISIS Fighters Have Been Caught Coming Across The Mexican Border’,1398,0
Sugarhill Gang rapper Big Bank Hank dead at 57,2351,1
Tropical spider 'burrowed under man's skin through scar' - video report,1883,0
Isis leader Abu Bakr al-Baghdadi's 'wife and son detained in Lebanon',2268,0
No One In North Korea Is Allowed To Share Kim Jong Un's Name,1678,1
Jilted lover chops off his penis after girlfriend dumps him,1171,1
That Was Fast: Christian Bale Bails on Steve Jobs Biopic,1215,-1
"SEE IT: ISIS militants caught trying to cross border into Texas, Congressman claims",1376,0
Shocking Photos! Mom Tries To Sell Son To Pay For Daughter's Cancer Treatment,1574,1
This Is Why Rumors That ISIS Is Crossing The Border Into The U.S. Aren’t Going Away,2249,0
The 'cub of Baghdadi': Has this boy become the youngest victim of Isis’s use of child soldiers?,1785,0
Bugatti Veyron Vandalized With Penis Graffiti? Viral Photo Isn’t What It Seems,1144,0
Batmobile Stolen From 'Batman V Superman: Dawn Of Justice' Set? Report Claims That One Of The Batmobile Models Is Missing! Detroit Locals Responsible?,672,0
Microsoft turns to robotic security guards to watch for trouble,552,1
Report: Christian Bale Just Bailed on the Steve Jobs Movie,945,-1
US confirms death of Somalia terror group leader,313,-1
ISIS Claims To Have Captured US Airdrop Weapons,2295,0
Isis claims to behead US journalist,2096,0
"Islamic State leader's family detained by Lebanon, officials say",281,0
"Absent from duty for 25 years, CPWD official dismissed",2441,1
Vigilantes cut off alleged rapist's penis,2005,1
Snowmen Declared Anti-Islamic As Snow Falls in Saudi Arabia,1064,1
Nigeria says ceasefire agreed with Boko Haram,1540,0
U.S. arms airdrop fell into ISIS hands: Pentagon,2172,1
Fake-News: 'McDonald's Will Stop Serving Overweight Customers',1848,-1
"Christian Bale passes on role of Steve Jobs, actor reportedly felt he wasn't right for part",1226,1
"Islamic State, in video titled ""A Message to America,"" beheads American journalist James Wright Foley who was kidnapped in 2012",2147,0
BREAKING: ISIS Beheads American Journalist James Wright Foley,1948,0
Mexico Says Students Not Among Dead in Mass Grave,1822,0
REPORT: The Batmobile Might Have Been Stolen In Detroit,2135,0
ISIS Video Claims to Show Beheading of British Hostage,2348,0
Matt Taibbi on leave of absence from First Look Media,267,0
REPORT: Alleged New Audio of Michael Brown Shooting,2287,0
"Eyewitness: Viral Video That Netted $130K in Donations ""is Bullshit""",1130,1
Nigerians doubtful of girls' release after Boko Haram 'truce' breached,1540,0
Banksy arrest hoax: US website claims street artist caught in Watford,2051,1
"Rats at Vogue's NYC offices - watch your step, Anna Wintour",2520,0
Meet The College Student Who Claims She Was The ‘Teletubbies’ Sun Baby,1327,0
Does Vogue's New Office Have a Rat Infestation?,1693,0
Michael Brown shooting audio caught on tape?,2118,0
Islamic State 'training pilots to fly fighter jets',2406,0
Pentagon: ISIS Got U.S. Weapons Package,1120,0
"What was fake on the Internet this week: Obama’s peace prize, pumpkin-spice condoms and insane winter snow",1400,1
Parents are furious after seven girls aged 13-14 fall pregnant on a school trip,2170,1
Watch NAKED airport worker walk through scanner in bizarre protest against 'rough' guards,2234,1
#ISIS beheads photojournalist James Wright Foley in a massage to US to end its intervention in #Iraq.,2047,0
